Restaurant_Name,Locality,Cuisines,Average_Cost_for_two,Restaurant_Url,City,Address,Available_Time,Contact_Number,Dining_Ratings,Dining_Votes,Delivery_Ratings,Delivery_Votes
Latitude Cafe And Restro,"Maharana Pratap Nagar, Bhopal","North Indian, Chinese, Fast Food, Pizza, Burger, Thai, Asian, Biryani","₹1,800 for two",https://www.zomato.com/bhopal/latitude-cafe-and-restro-2-maharana-pratap-nagar/info,Bhopal,"Plot 244, King Shopping Center, Maharana Pratap Nagar, Bhopal",11am – 12midnight,+918982349324,4.1,50,4.0,15
Naveen's Bapu Ki Kutia,"Gulmohar Colony, Bhopal","North Indian, South Indian, Chinese, Fast Food, Desserts, Shake, Beverages",₹700 for two,https://www.zomato.com/bhopal/naveens-bapu-ki-kutia-gulmohar-colony/info,Bhopal,"Shop 1&2 Ground Floor, Opposite Aura Mall, Gulmohar Colony, Bhopal",12noon – 11pm,+918823052691,3.9,302,4.2,"7,814"
The Bastion,"Hoshangabad Road, Bhopal","Continental, North Indian, Chinese, Biryani, Mughlai, Desserts","₹1,200 for two",https://www.zomato.com/bhopal/the-bastion-hoshangabad-road/info,Bhopal,"Plot-5, Vidhya Nagar, Sector A, Near Barkatullah University, Hoshangabad Road, Bhopal","12midnight – 4am, 12noon – 12midnight",+919131133455,4.3,50,4.1,"1,601"
Poppin' Deli,"Arera Colony, Bhopal","Cafe, Coffee, Mexican, Pizza, Fast Food, Desserts, Beverages","₹1,100 for two",https://www.zomato.com/bhopal/poppin-deli-arera-colony/info,Bhopal,"265, E2, Arera Colony, Bhopal",11am – 11pm,+918770452084,4.2,55,-,0
Ecko- Artisanal Bistro,"Gulmohar Colony, Bhopal","North Indian, Continental, Chinese, Biryani, Pizza, Pasta, Desserts, Cafe","₹1,000 for two",https://www.zomato.com/bhopal/ecko-artisanal-bistro-gulmohar-colony/info,Bhopal,"4th Floor, HBD Arcade, Ishwar Nagar, Gulmohar Colony, Bhopal","12midnight – 1:30am, 1pm – 12midnight",+916264755727,4.3,184,3.9,115
Zoku,"Habib Ganj, Bhopal","Asian, Chinese","₹1,200 for two",https://www.zomato.com/bhopal/zoku-habib-ganj/info,Bhopal,"Ground Floor, Bansal One Building, Rani Kamlapati, Habib Ganj, Bhopal",12noon – 10:45pm,"+919893338259,+919893338269",3.9,10,New,3
Momo Cafe - Courtyard Marriot,"Courtyard By Marriot, Maharana Pratap Nagar, Bhopal","North Indian, Continental, Italian, Cafe","₹1,600 for two",https://www.zomato.com/bhopal/momo-cafe-courtyard-marriot-maharana-pratap-nagar/info,Bhopal,"Courtyard By Marriot, 4th Floor, DB City Mall, Maharana Pratap Nagar, Bhopal",6:30am – 11:30pm,"+919171099811,+917000595733",4.1,307,-,0
Ivoryy,"Habib Ganj, Bhopal","Mediterranean, Asian","₹1,500 for two",https://www.zomato.com/bhopal/ivoryy-habib-ganj/info,Bhopal,"2nd Floor, Bansal One Mall, Habib Ganj, Bhopal",12noon – 11:30pm,+919244780116,4.2,56,-,0
Fusion Cafe - Radisson Hotel,"Radisson - Bhopal Gulmohar Colony, Bhopal","North Indian, Continental, Chinese, Desserts","₹1,000 for two",https://www.zomato.com/bhopal/fusion-cafe-radisson-hotel-1-gulmohar-colony/info,Bhopal,"E8, Ishwar Nagar, Huzur, Opposite Savoy Complex, Gulmohar Colony, Bhopal",12:30pm – 11pm,+919329331017,4.2,111,3.7,118
Zaaiqa - Noor Us Sabah Palace,"Kohefiza, Bhopal","North Indian, Mughlai, Kebab, Awadhi, Biryani, Desserts, Continental","₹3,500 for two",https://www.zomato.com/bhopal/zaaiqa-noor-us-sabah-palace-kohefiza/info,Bhopal,"VIP Road, Hotel Welcome Heritage, Kohefiza, Bhopal",12:30pm – 11pm,+917554223333,4.2,276,-,0
Pirates Of Grill,"Maharana Pratap Nagar, Bhopal","Chinese, Salad, North Indian, BBQ, Mughlai, Oriental, Desserts","₹1,000 for two",https://www.zomato.com/bhopal/pirates-of-grill-maharana-pratap-nagar/info,Bhopal,"Shop R-7, 3rd Floor, DB City Mall, Maharana Pratap Nagar, Bhopal","12noon – 4pm, 6:30pm – 10:30pm","+917880055663,+917880055662",4.5,"1,163",4.3,791
Bhopal Bakehouse & Cafe,"Arera Colony, Bhopal","Bakery, Italian, Fast Food, Desserts, Beverages, Cafe",₹400 for two,https://www.zomato.com/bhopal/bhopal-bakehouse-cafe-arera-colony/info,Bhopal,"E-4/90, 10 Number Market, Arera Colony, Bhopal",2pm – 11pm,+917225034444,4.1,283,4.2,"2,796"
Effotel By Sayaji,"Hoshangabad Road, Bhopal","North Indian, South Indian, Continental, Seafood, Chinese, Biryani, Desserts, Beverages","₹2,000 for two",https://www.zomato.com/bhopal/effotel-by-sayaji-hoshangabad-road/info,Bhopal,"435/14 435/1/6, Bawadiya Kalan, Hoshangabad Road, Bhopal",8am – 11:30pm,+918839000120,4.5,81,4.0,297
Pin And Pan,"Gulmohar Colony, Bhopal","Cafe, Italian, Asian, Fast Food, Continental, Desserts, Shake, Beverages","₹1,200 for two",https://www.zomato.com/bhopal/pin-and-pan-gulmohar-colony/info,Bhopal,"E-8, Shop G-08 & G-09, Ground Floor, Fortune Signature Commercial Arcade, Gulmohar Colony, Bhopal",11am – 10:45pm,+919993945830,4.5,87,4.3,170
Lamington Cafe Patisserie,"Arera Colony, Bhopal","Cafe, Coffee, Beverages, Pasta, Pizza, Italian, Bakery, Desserts",₹650 for two,https://www.zomato.com/bhopal/lamington-cafe-patisserie-arera-colony/info,Bhopal,"E/7, LIG-B/308, Ground Floor, Arera Colony, Bhopal",11:30am – 11pm,+918989684881,3.9,22,4.3,89
Romeo Lane,"Habib Ganj, Bhopal","North Indian, Asian, Continental","₹1,500 for two",https://www.zomato.com/bhopal/romeo-lane-habib-ganj/info,Bhopal,"First Floor, Bansal One, CW-2, Habibganj Railway Station, Zone-II, Arera Colony, Side, Habib Ganj, Bhopal",12noon – 1am,"+919039008161,+919039008162",New,8,-,0
Chalu Chinese,"Gulmohar Colony, Bhopal","Chinese, Momos, Sichuan",₹600 for two,https://www.zomato.com/bhopal/chalu-chinese-gulmohar-colony/info,Bhopal,"Khasra 9/2/29/2, Bawadiya Kalan, Near Aura Mall, Gulmohar Colony, Bhopal","12midnight – 5am, 11am – 12midnight",+917719089727,4.3,291,3.6,"1,379"
Cowboy Restaurant & Lounge,"Habib Ganj, Bhopal","North Indian, Mexican, Chinese, Continental, Biryani, Bar Food, Desserts, Beverages","₹1,400 for two",https://www.zomato.com/bhopal/cowboy-restaurant-lounge-habib-ganj/info,Bhopal,"Plot 3, Bittan Market, Opposite Habibganj Police Station, Habib Ganj, Bhopal",12noon – 10pm,"+917554270500,+919399635755",4.1,652,4.0,669
WOW! Momo,"Maharana Pratap Nagar, Bhopal","Momos, Fast Food, Chinese, Tibetan, Sichuan, Beverages, Desserts",₹350 for two,https://www.zomato.com/bhopal/wow-momo-maharana-pratap-nagar/info,Bhopal,"FS 6&7, Third Floor, DB Mall Arera Hills, Maharana Pratap Nagar, Bhopal",10am – 11:55pm,"+919147182190,+919836198361",4.1,146,4.1,512
WOW! China,"Maharana Pratap Nagar, Bhopal","Chinese, Oriental, Asian, Sichuan, Seafood, Momos",₹550 for two,https://www.zomato.com/bhopal/wow-china-maharana-pratap-nagar/info,Bhopal,"6&7 DB, Third Floor FS, Mall Arera Hills, Maharana Pratap Nagar, Bhopal",10am – 11:55pm,"+919147182191,+919836198361",3.9,110,3.6,625
Ming Dynasty - Noor Us Sabah,"Kohefiza, Bhopal","Chinese, Japanese, Thai, Burmese","₹3,500 for two",https://www.zomato.com/bhopal/ming-dynasty-noor-us-sabah-kohefiza/info,Bhopal,"Hotel Noor Us Sabah, VIP Road, Kohefiza, Bhopal",12:30pm – 11pm,+917554223333,4.0,170,-,0
Cafe Amado,"Arera Colony, Bhopal","Cafe, Coffee, Beverages, Italian, Asian, Fast Food, Bakery, Desserts","₹1,000 for two",https://www.zomato.com/bhopal/cafe-amado-1-arera-colony/info,Bhopal,"E-2/ 69, 2nd Floor, Fab India Lane, Arera Colony, Bhopal",12noon – 10:30pm,+916262424888,3.6,44,-,0
Infinity - Taj Lakefront,"Taj Lakefront TT Nagar, Bhopal","Mediterranean, Bar Food, Beverages","₹3,000 for two",https://www.zomato.com/bhopal/infinity-taj-lakefront-tt-nagar/info,Bhopal,"10th Floor, Taj Lake Front, Bhopal Link Road 3, TT Nagar, Bhopal",5pm – 11:30pm,+917554370000,3.8,20,-,2
Padharo Sa,"Habib Ganj, Bhopal","Rajasthani, North Indian, Mithai",₹500 for two,https://www.zomato.com/bhopal/padharo-sa-habib-ganj/info,Bhopal,"BP 1, 3rd Floor, Mansarover Complex, Hoshangabad Road, Habib Ganj, Bhopal",8am – 11pm,"+919893024785,+917554289454,+919893022785",3.1,63,4.4,"4,362"
Manmarziyaan,"Kolar, Bhopal","Biryani, Desserts",₹500 for two,https://www.zomato.com/bhopal/manmarziyaan-kolar/info,Bhopal,"DK-3/26, Danish Kunj, Kolar, Bhopal",12noon – 11:15pm,+918450898022,3.9,8,3.9,292
Marbal Arch - Noor Us Sabah Palace,"Kohefiza, Bhopal","North Indian, Chinese, Continental","₹1,500 for two",https://www.zomato.com/bhopal/marbal-arch-noor-us-sabah-palace-kohefiza/info,Bhopal,"Hotel Noor Us Sabah Palace, VIP Road, Kohefiza, Bhopal",7am – 11pm,+917554223333,4.3,171,-,0
Molecule Air Bar,"Arera Colony, Bhopal","North Indian, Italian, Asian, European, Finger Food, Pizza, Desserts","₹1,600 for two",https://www.zomato.com/bhopal/molecule-air-bar-arera-colony/info,Bhopal,"Plot 32, Krishna Emporio, Arera Colony, Bhopal",12:15pm – 11:45pm,"+918516936601,+918516936602,+918516936604",3.4,171,3.8,282
Socialite Seven,"Maharana Pratap Nagar, Bhopal","Mughlai, Biryani, Fast Food, Pasta, Finger Food, Chinese, Continental","₹1,000 for two",https://www.zomato.com/bhopal/socialite-seven-maharana-pratap-nagar/info,Bhopal,"Fourth Floor, Hare Govind Complex, Near Proline Fitness, Maharana Pratap Nagar, Bhopal",3pm – 11:30pm,+917554266665,4.3,201,3.1,88
Golden Tulip,"Maharana Pratap Nagar, Bhopal","North Indian, Mughlai, Biryani, Chinese, Asian, Continental","₹1,300 for two",https://www.zomato.com/bhopal/golden-tulip-maharana-pratap-nagar/info,Bhopal,"Zone 1, Narmadapuram Road, Maharana Pratap Nagar, Bhopal",7am – 11:30pm,+917898988503,3.8,11,-,0
Mediterranean Rooftop Restaurant,"Kolar, Bhopal","North Indian, Chinese, Thai, Momos, Fast Food, Biryani, Mughlai, Shake","₹1,000 for two",https://www.zomato.com/bhopal/mediterranean-rooftop-restaurant-kolar/info,Bhopal,"Maanshiva Complex, Commercial Space, Danish Kunj, Kolar, Bhopal",12:30pm – 11pm,"+919589028502,+917440439209",3.3,8,4.0,21
The Eclair Lounge- Courtyard By Marriott Bhopal,"Courtyard By Marriot, Maharana Pratap Nagar, Bhopal","Cafe, Coffee, Fast Food, Chinese, Pasta, Shake, Beverages","₹1,000 for two",https://www.zomato.com/bhopal/the-eclair-lounge-courtyard-by-marriott-bhopal-maharana-pratap-nagar/info,Bhopal,"Courtyard By Marriot, 4th Floor, DB City Mall, Maharana Pratap Nagar, Bhopal",11am – 11pm,"+917556661632,+918349101527",4.2,254,-,0
The Dublin Lounge Restaurant And Pub,"Maharana Pratap Nagar, Bhopal","North Indian, Chinese, Biryani","₹1,200 for two",https://www.zomato.com/bhopal/the-dublin-lounge-restaurant-and-pub-maharana-pratap-nagar/info,Bhopal,"Plot 2, Bank Street, Zone 2, Maharana Pratap Nagar, Bhopal",11am – 11:45pm,"+919111503697,+917581049188",3.9,12,2.5,8
Mantar Restaurant,"Gulmohar Colony, Bhopal","North Indian, Chinese","₹1,000 for two",https://www.zomato.com/bhopal/mantar-restaurant-gulmohar-colony/info,Bhopal,"79/6, 79/8, Village Bawadiya Kalan, Gulmohar Colony, Bhopal",12noon – 11pm,+917999307948,2.7,6,3.8,40
Under The Mango Tree - Jehan Numa Palace,"TT Nagar, Bhopal","North Indian, Kebab, Biryani, Mughlai, Desserts","₹3,000 for two",https://www.zomato.com/bhopal/under-the-mango-tree-jehan-numa-palace-tt-nagar/info,Bhopal,"157, Shymala Hills, TT Nagar, Bhopal",7pm – 11pm,+919993091077,4.2,328,-,0
The Ten Suites,"TT Nagar, Bhopal","Cafe, Sandwich, Burger, Pizza, Bakery",₹600 for two,https://www.zomato.com/bhopal/the-ten-suites-tt-nagar/info,Bhopal,"10, 4 Bungalow Road, Civil Lines, Professors Colony, TT Nagar, Bhopal",1pm – 11pm,+919922852110,4.0,46,4.2,77
Shahnama - Jehan Numa Palace,"TT Nagar, Bhopal","North Indian, Chinese, Hyderabadi","₹2,000 for two",https://www.zomato.com/bhopal/shahnama-jehan-numa-palace-tt-nagar/info,Bhopal,"157, Shymala Hills, TT Nagar, Bhopal",7am – 11pm,+917552661100,4.6,316,-,0
Boscos,"Maharana Pratap Nagar, Bhopal","Mediterranean, Italian, Mexican","₹1,400 for two",https://www.zomato.com/bhopal/boscos-maharana-pratap-nagar/info,Bhopal,"OB 3/4, 4th Floor, DB Mall, Arera Hills, Maharana Pratap Nagar, Bhopal",12noon – 11pm,+919302252025,3.9,7,4.2,102
Barbeque Nation,"Gulmohar Colony, Bhopal","North Indian, BBQ, Biryani, Kebab, Continental, Chinese, Beverages, Desserts","₹1,500 for two",https://www.zomato.com/bhopal/barbeque-nation-1-gulmohar-colony/info,Bhopal,"STC, 2nd Floor, Virasha, Bawadiya Kalan, Gulmohar Colony, Bhopal","12noon – 3:45pm, 6:30pm – 11pm","+919319294266,+919319294265",4.4,349,3.9,"2,496"
Kebabsville - Sayaji Hotel,"Sayaji Hotel, Bhopal","North Indian, Bar Food, BBQ, Beverages","₹1,500 for two",https://www.zomato.com/bhopal/kebabsville-sayaji-hotel-tt-nagar/info,Bhopal,"A-3, Van Vihar Road, Prempura, TT Nagar, Bhopal",7pm – 11pm,"+917024151505,+917024151506,+917552767777",4.7,468,-,0
Zauq,"TT Nagar, Bhopal","North Indian, Mughlai, BBQ, Thai, Desserts",₹900 for two,https://www.zomato.com/bhopal/zauq-4-tt-nagar/info,Bhopal,"Point 4, Van Vihar Road, Food Point, Shymla Hills, TT Nagar, Bhopal",2pm – 11pm,"+917247099398,+917552762680",3.7,151,3.7,434
Cafe Latte,"Kohefiza, Bhopal","Cafe, Coffee, Fast Food, Wraps, Bakery, Desserts, Shake, Beverages",₹600 for two,https://www.zomato.com/bhopal/cafe-latte-3-kohefiza/info,Bhopal,"Khanugaon, VIP Road, Kohefiza, Bhopal",10:30am – 11pm,"+917554223333,+918109012133",4.1,92,-,0
Amer Bakery Hut,"Arera Colony, Bhopal","Bakery, North Indian, Burger, Pizza, Chinese, Continental, Asian, Beverages",₹600 for two,https://www.zomato.com/bhopal/amer-bakery-hut-arera-colony/info,Bhopal,"Bittan Market, Arera Colony, Bhopal",11am – 10:45pm,+918448440914,4.1,696,4.2,"6,675"
Manohar Dairy And Restaurant,"Maharana Pratap Nagar, Bhopal","North Indian, South Indian, Burger, Pizza, Sandwich, Fast Food, Desserts, Shake",₹400 for two,https://www.zomato.com/bhopal/manohar-dairy-and-restaurant-maharana-pratap-nagar/info,Bhopal,"32 A & B, Ram Gopal Maheshwari Marg, Zone 1, Near Jyoti Talkies, Maharana Pratap Nagar, Bhopal",8:30am – 10:30pm,"+917554040406,+917554040407,+919522286868",4.3,"1,694",4.4,39.2K
Ru-Bar-Ru,"Maharana Pratap Nagar, Bhopal","Modern Indian, Chinese, Mediterranean, Italian","₹1,000 for two",https://www.zomato.com/bhopal/ru-bar-ru-maharana-pratap-nagar/info,Bhopal,"Plot 39, ISBT Main Road, Maharana Pratap Nagar, Bhopal",12noon – 12midnight,+919978997806,3.9,52,3.0,7
The Pizza Slice,"Arera Colony, Bhopal","Pizza, Fast Food, Italian, Desserts, Beverages",₹400 for two,https://www.zomato.com/bhopal/the-pizza-slice-arera-colony/info,Bhopal,"E/3/43, Arera Colony, Bhopal","12midnight – 3am, 11:30am – 12midnight",+918827662428,4.1,20,3.8,"1,110"
Bageecha Bistro,"Airport Area, Bhopal","North Indian, South Indian, Chinese, Fast Food, Pizza, Shake, Beverages, Desserts",₹350 for two,https://www.zomato.com/bhopal/bageecha-bistro-airport-area/info,Bhopal,"Khasra 25/3/2/1/2, Gandhi Nagar, By Pass Road, Near BDA Colony, Airport Area, Bhopal",2pm – 11:30pm,+917000772134,3.3,5,-,0
Kalonji,"Hoshangabad Road, Bhopal","North Indian, Fast Food, Street Food, Chinese, Biryani, Desserts, Beverages",₹500 for two,https://www.zomato.com/bhopal/kalonji-hoshangabad-road/info,Bhopal,"9, Top Floor, Ganesh Nagar, Near Ashima Mall, Hoshangabad Road, Bhopal","12midnight – 1:45am, 8am – 11:45pm",+917724932455,3.9,4,3.6,"1,102"
Blue Lagoon Farm,"Kohefiza, Bhopal","North Indian, Chinese, Pasta, Fast Food, Desserts, Shake, Beverages","₹1,000 for two",https://www.zomato.com/bhopal/blue-lagoon-farm-kohefiza/info,Bhopal,"Near Sai Acadmy, Bisankhedi, Kohefiza, Bhopal",1pm – 10:30pm,+917722998891,3.7,27,New,0
Mehfil E Dawat,"Gulmohar Colony, Bhopal","North Indian, Mughlai, Awadhi",₹400 for two,https://www.zomato.com/bhopal/mehfil-e-dawat-gulmohar-colony/info,Bhopal,"Plot 138, Sector B, Vidhya Nagar, Gulmohar Colony, Bhopal","12midnight – 3am, 11:30am – 12midnight",+919926305522,3.7,37,4.1,"1,318"
Sagar Gaire Fast Food,"Maharana Pratap Nagar, Bhopal","Chinese, North Indian, Fast Food",₹350 for two,https://www.zomato.com/bhopal/sagar-gaire-fast-food-maharana-pratap-nagar/info,Bhopal,"28, ISBT, Commercial Campus, Near Chetak Bridge, Maharana Pratap Nagar, Bhopal",10am – 10pm,+918889266638,4.1,762,3.9,15.6K
KFC,"DB City, Maharana Pratap Nagar, Bhopal","Burger, Fast Food, Biryani",₹450 for two,https://www.zomato.com/bhopal/kfc-maharana-pratap-nagar/info,Bhopal,"R-7, Third Floor, Db City Mall, Arera Hills, Zone-1, Maharana Pratap Nagar, Bhopal","12midnight – 2am, 11am – 12midnight",+917556644391,4.0,830,3.6,"7,224"
Under The Jamun Tree,"TT Nagar, Bhopal","North Indian, Mughlai, Continental, Desserts","₹1,500 for two",https://www.zomato.com/bhopal/under-the-jamun-tree-tt-nagar/info,Bhopal,"Jehan Numa Retreat, Dr. Sallem Ali Road, Near Van Vihar, TT Nagar, Bhopal","12noon – 3pm, 7pm – 11pm","+919981122282,+918085642624,+918770472689",4.4,119,-,0
Hong Kong,"Maharana Pratap Nagar, Bhopal","Chinese, Seafood, Sichuan, Rolls",₹800 for two,https://www.zomato.com/bhopal/hong-kong-maharana-pratap-nagar/info,Bhopal,"131/4, Zone 2, Near Pragati Petrol Pump, Maharana Pratap Nagar, Bhopal",11am – 11pm,+917554271900,4.4,887,4.2,"5,886"
Coffee Cafe,"Airport Area, Bhopal","Cafe, Coffee, Tea, Beverages, Pizza, Sandwich, Rolls, Fast Food",₹600 for two,https://www.zomato.com/bhopal/coffee-cafe-airport-area/info,Bhopal,"11, First Floor, Aditya Avenue, Airport Area, Bhopal",12noon – 10:45pm,+917898887891,3.9,15,4.1,71
Biggies Burger,"Gulmohar Colony, Bhopal","Burger, Wraps, Fast Food, Desserts, Shake, Beverages",₹450 for two,https://www.zomato.com/bhopal/biggies-burger-gulmohar-colony/info,Bhopal,"Shop 06, Rohit Nagar, Gulmohar Colony, Bhopal","12midnight – 6:30am, 10am – 12midnight",+919019910510,4.2,87,4.2,"1,157"
Club Obello New York,"Hoshangabad Road, Bhopal","North Indian, Chinese","₹1,000 for two",https://www.zomato.com/bhopal/club-obello-new-york-hoshangabad-road/info,Bhopal,"300, Third Floor, Aashima Mall, Bawadiya Kalan, Hoshangabad Road, Bhopal",4pm – 12midnight,"+919981573947,+919089087979",-,1,4.3,48
Burger Ring,"Gulmohar Colony, Bhopal","Burger, Fast Food, Momos, Pizza",₹500 for two,https://www.zomato.com/bhopal/burger-ring-1-gulmohar-colony/info,Bhopal,"Bawadiya Kalan, Phase 1, Rohit Nagar, Near Mahindra Petrol Pump, Gulmohar Colony, Bhopal",11am – 10pm,+918839235729,3.7,4,4.0,20
Jharokha - Hotel Amer Palace,"Maharana Pratap Nagar, Bhopal","North Indian, Chinese, Biryani, Continental, Rolls, Desserts, Beverages","₹1,500 for two",https://www.zomato.com/jharokhahotelamerpalace/info,Bhopal,"209, Zone 1, Maharana Pratap Nagar, Bhopal",12noon – 11pm,"+917554272110,+919300311770",4.1,213,4.0,600
La Kuchina - Jehan Numa Palace,"TT Nagar, Bhopal","Salad, Chinese, Italian, Beverages, Desserts","₹2,500 for two",https://www.zomato.com/bhopal/la-kuchina-jehan-numa-palace-tt-nagar/info,Bhopal,"157, Hotel Jehan Numa Palace, Shymala Hills, TT Nagar, Bhopal","12:30pm – 3pm, 7pm – 11pm",+917552661100,4.5,261,-,0
My Bar Headquarter,"Maharana Pratap Nagar, Bhopal","North Indian, Biryani, Mughlai, Kebab, Chinese, Fast Food, Bar Food","₹1,500 for two",https://www.zomato.com/bhopal/my-bar-headquarter-maharana-pratap-nagar/info,Bhopal,"2nd Floor, Bansal One Building, Maharana Pratap Nagar, Bhopal",12noon – 12midnight,+918982054441,New,4,-,0
Biggies Burger,"Airport Area, Bhopal","Burger, Wraps, Fast Food, Desserts, Shake, Beverages",₹300 for two,https://www.zomato.com/bhopal/biggies-burger-airport-area/info,Bhopal,"Shop 3, 4, Plot 294, Lalghati, Gufa Mandir Road, Airport Area, Bhopal","12midnight – 2am, 11am – 12midnight","+918889990129,+917553582596",4.2,245,4.0,"1,678"
CafeChino - Jehan Numa Palace,"TT Nagar, Bhopal","Cafe, Fast Food, Beverages, Desserts, Sandwich",₹800 for two,https://www.zomato.com/bhopal/cafechino-jehan-numa-palace-tt-nagar/info,Bhopal,"Hotel Jehan Numa Palace, 157, Shamla Hills Road, Shamla Hills, TT Nagar, Bhopal",10:30am – 11pm,"+917552661100,+919993091077",4.3,307,-,0
TAO - Jehan Numa Palace,"TT Nagar, Bhopal","Asian, Japanese, Thai, Chinese","₹2,200 for two",https://www.zomato.com/bhopal/tao-jehan-numa-palace-tt-nagar/info,Bhopal,"Hotel Jehan Numa Palace, 157, Shamla Hills, TT Nagar, Bhopal",11am – 11pm,"+917552661100,+919993091077",4.9,199,-,0
Icekraft - The Secret Kitchen,"Maharana Pratap Nagar, Bhopal","Desserts, Ice Cream, Shake, Pasta, Burger, Pizza, Beverages",₹350 for two,https://www.zomato.com/bhopal/icekraft-the-secret-kitchen-maharana-pratap-nagar/info,Bhopal,"210, Arham Complex, M.P. Nagar, Maharana Pratap Nagar, Bhopal",12:15pm – 12midnight,+919229222100,3.6,27,3.7,859
32 Degree North East,"Kajlas, Bhopal","North Indian, Fast Food",₹800 for two,https://www.zomato.com/bhopal/32-degree-north-east-kajlas/info,Bhopal,"Kerwa Dam Road, Khudaganj, Kajlas, Bhopal",12noon – 11:30pm,+919893202121,4.8,427,4.0,12
Hotel Silver Inn,"Jhangirabad, Bhopal","North Indian, Chinese","₹1,000 for two",https://www.zomato.com/bhopal/hotel-silver-inn-1-jhangirabad/info,Bhopal,"3 A, Ashoka Garden, Raisen Road, Jhangirabad, Bhopal",11am – 11pm,"+919229345603,+919229345602",4.1,29,3.9,560
"Above & Beyond, Garden Kitchen & Club","TT Nagar, Bhopal","Continental, Italian, Beverages, Bar Food","₹1,200 for two",https://www.zomato.com/bhopal/above-beyond-garden-kitchen-club-tt-nagar/info,Bhopal,"Khasra 41/1SA, Plot 50, Ward 26, Barkhedi Kalan, TT Nagar, Bhopal",1pm – 12midnight,+919111110655,3.9,11,New,0
Drinx Exchange,"Maharana Pratap Nagar, Bhopal","Italian, Mexican, Chinese, North Indian, American, Desserts","₹1,500 for two",https://www.zomato.com/bhopal/drinx-exchange-maharana-pratap-nagar/info,Bhopal,"T1 & T2, Third Floor, DB City Mall, Maharana Pratap Nagar, Bhopal",12noon – 11pm,"+919755552076,+917974724223",4.4,253,3.7,34
Taco Bell,"Maharana Pratap Nagar, Bhopal",Mexican,₹500 for two,https://www.zomato.com/bhopal/taco-bell-maharana-pratap-nagar/info,Bhopal,"Unit 26, Third Floor, DB City Mall, Opposite MP Nagar, Maharana Pratap Nagar, Bhopal",11am – 11pm,+917669715903,3.8,88,3.8,"1,553"
Moti Mahal Delux,"Aashima Mall, Hoshangabad Road, Bhopal","North Indian, Chinese, Desserts, Beverages","₹1,000 for two",https://www.zomato.com/bhopal/moti-mahal-delux-hoshangabad-road/info,Bhopal,"Second Floor, Aashima Mall, Hoshangabad Road, Bhopal",11am – 10pm,"+917554053302,+919425628603",3.8,56,4.0,308
The Brunch House,"Courtyard By Marriot, Maharana Pratap Nagar, Bhopal","North Indian, Street Food, South Indian, Beverages",₹300 for two,https://www.zomato.com/bhopal/the-brunch-house-maharana-pratap-nagar/info,Bhopal,"26-27, Near I.S.B.T, Maharana Pratap Nagar, Bhopal",9am – 11pm,"+917554945500,+917697047164,+919598956563",4.2,180,3.9,"4,370"
Culture Bakery Cafe,"Airport Area, Bhopal","Italian, Bakery, Coffee, Cafe, Wraps, Pizza, Fast Food, Shake",₹550 for two,https://www.zomato.com/bhopal/culture-bakery-cafe-1-airport-area/info,Bhopal,"A 120, Indra Vihar Colony, Tilak Nagar, Airport Area, Bhopal","12midnight – 12:15am, 11am – 12midnight",+918819088883,3.7,35,4.1,463
The Giant Panda,"DB City, Maharana Pratap Nagar, Bhopal","Asian, Fast Food, Chinese, Beverages, Desserts","₹1,200 for two",https://www.zomato.com/bhopal/the-giant-panda-maharana-pratap-nagar/info,Bhopal,"T-12 -13, 3rd Floor, DB Mall, Maharana Pratap Nagar, Bhopal",11am – 11pm,+918982417888,4.4,166,4.3,"2,180"
Khalifah,"Kohefiza, Bhopal","Burger, Pizza, Sandwich, Fast Food",₹200 for two,https://www.zomato.com/bhopal/khalifah-2-kohefiza/info,Bhopal,"E-63, BDA Colony, Opposite Tulips Beauty Parlour, Kohefiza, Bhopal","12midnight – 4:45am, 2pm – 11:45pm",+917067588181,3.9,4,4.4,540
Domino's Pizza,"JP Nagar, Bhopal","Pizza, Fast Food, American, Chinese, Desserts",₹500 for two,https://www.zomato.com/bhopal/dominos-pizza-jp-nagar/info,Bhopal,"Ground Floor, Peoples Mall, Rasala Khedi, Bhanpur, JP Nagar, Bhopal",11am – 12:45am,+917554280069,3.9,323,4.1,"3,717"
Rolls Mania,"Kohefiza, Bhopal","Rolls, Fast Food, Street Food, Beverages",₹300 for two,https://www.zomato.com/bhopal/rolls-mania-kohefiza/info,Bhopal,"Shop 4, Collectorate Office Road, Kohefiza, Bhopal",1pm – 2am,+917554923234,3.8,162,4.0,"4,734"
Farzi Cafe,"Arera Colony, Bhopal",Cafe,"₹1,500 for two",https://www.zomato.com/bhopal/farzi-cafe-arera-colony/info,Bhopal,"006-007-008, 2nd Floor, Bansal One, Rani Kamlapati Station, Arera Colony, Bhopal",10am – 10pm,+919926171111,New,1,-,0
Bapu Ki Kutia,"TT Nagar, Bhopal","North Indian, Chinese, South Indian, Fast Food, Street Food",₹400 for two,https://www.zomato.com/bhopal/bapu-ki-kutia-tt-nagar/info,Bhopal,"Near Rajbhavan, Roshanpura, TT Nagar, Bhopal",11am – 11pm,+918103811227,4.0,775,4.3,24.2K
Machan,"Taj Lakefront TT Nagar, Bhopal","Asian, South Indian, Chinese, Continental, Italian, Bar Food, Desserts","₹3,500 for two",https://www.zomato.com/bhopal/machan-tt-nagar/info,Bhopal,"2nd Floor, Bhadbhada Chouraha, Bhopal Link Road 3, Near Taj Lake, TT Nagar, Bhopal",7am – 10:30pm,+917554370000,3.9,12,-,0
Handcrafted Cafe & Roastery,"Arera Colony, Bhopal","Cafe, Coffee, Pizza, Fast Food, Pasta, Panini",₹500 for two,https://www.zomato.com/bhopal/handcrafted-cafe-roastery-arera-colony/info,Bhopal,"E-3/75, Near Narmada Trauma Centre, Arera Colony, Bhopal",8:30am – 11:15pm,+918602652040,4.5,16,4.3,530
Subway,"Aashima Mall, Hoshangabad Road, Bhopal","Healthy Food, Sandwich, Fast Food, Wraps, Salad, Beverages",₹400 for two,https://www.zomato.com/bhopal/subway-hoshangabad-road/info,Bhopal,"GF-17, Aashima Mall, Hoshangabad Road, Bhopal","12midnight – 2am, 9:30am – 12midnight","+919826055309,+917554053009",3.8,125,4.2,"6,748"
TDS: 10 Downing Street,"DB City, Maharana Pratap Nagar, Bhopal","North Indian, Chinese, Continental, Biryani, Italian, Fast Food","₹1,500 for two",https://www.zomato.com/bhopal/tds-10-downing-street-maharana-pratap-nagar/info,Bhopal,"3rd Floor, DB City Mall, Maharana Pratap Nagar, Bhopal",12noon – 12midnight,"+917552514210,+917067018164",4.5,787,4.3,"1,793"
