Restaurant_Name,Locality,Cuisines,Average_Cost_for_two,Restaurant_Url,City,Address,Available_Time,Contact_Number,Dining_Ratings,Dining_Votes,Delivery_Ratings,Delivery_Votes
Firecraft Woodfire Pizza by Rajhans,"Maharana Pratap Nagar, Bhopal","Pizza, North Indian, Italian, Chinese, Biryani, Beverages","₹1,000 for two",https://www.zomato.com/bhopal/firecraft-woodfire-pizza-by-rajhans-maharana-pratap-nagar/info,Bhopal,"Plot 271, Hotel Rajhans Regency, Zone 2, Maharana Pratap Nagar, Bhopal",12noon – 11pm,"+919685499001,+917554033452",4.5,25,4.0,335
Sanchi - Sayaji Hotel,"Sayaji Hotel, Bhopal","North Indian, Chinese, Continental, Oriental, Salad, Shake, Desserts, Beverages","₹1,500 for two",https://www.zomato.com/bhopal/sanchi-sayaji-hotel-tt-nagar/info,Bhopal,"A-3, Van Vihar Road, Prempura, TT Nagar, Bhopal","12noon – 3pm, 7pm – 11pm","+917552767777,+917024151505,+917024151506",4.3,196,-,4
V's Foodie Corner,"Gulmohar Colony, Bhopal","Chinese, Momos",₹350 for two,https://www.zomato.com/bhopal/vs-foodie-corner-gulmohar-colony/info,Bhopal,"Khasra-9/2/29/2, Fortune Pride, Trilanga Main Road, Opposite Aura Mall, Gulmohar Colony, Bhopal","12midnight – 4:30am, 11am – 12midnight",+919663933643,4.2,95,3.2,31
Countryside Meadows,"Kajlas, Bhopal","North Indian, Chinese, Continental, Pasta, Pizza, Desserts, Beverages","₹1,200 for two",https://www.zomato.com/bhopal/countryside-meadows-kajlas/info,Bhopal,"Kerwa Main Road, Gram Khudaganj, Kajlas, Bhopal",1pm – 11:30pm,+919993168444,3.6,140,3.7,424
Khan Sahab,"Peer Gate Area, Bhopal","North Indian, Mughlai, Biryani, Desserts",₹800 for two,https://www.zomato.com/bhopal/khan-sahab-peer-gate-area/info,Bhopal,"Model Ground, Hamidia Road, Peer Gate Area, Bhopal",11am – 12midnight,"+919584222666,+919229332500",4.2,935,4.1,15.3K
Pizza Hut,"Kohefiza, Bhopal","Pizza, Fast Food, Pasta, Desserts, Italian","₹1,000 for two",https://www.zomato.com/bhopal/pizza-hut-1-kohefiza/info,Bhopal,"A6, Housing Board Colony, Main Road, Kohefiza, Bhopal","12midnight – 3am, 10am – 12midnight",+918720030534,4.1,77,3.9,"1,590"
Over The Moon Bistro,"Gulmohar Colony, Bhopal","Chinese, Italian, Beverages, Desserts, Burger, Sandwich",₹700 for two,https://www.zomato.com/bhopal/over-the-moon-bistro-gulmohar-colony/info,Bhopal,"G-1/109, 4th Floor, Ajay Complex, Above IndusInd Bank, Near Aura Mall, Gulmohar Trilanga, Gulmohar Colony, Bhopal",11am – 11pm,+917400556969,3.9,132,4.0,274
Hongkong Restaurant,"Airport Area, Bhopal","Chinese, North Indian, Seafood, Sichuan",₹500 for two,https://www.zomato.com/bhopal/hongkong-restaurant-airport-area/info,Bhopal,"Plot 8, Aditya Avenue, Airport Area, Bhopal",10:30am – 11:30pm,+917067117393,4.6,340,4.2,"2,803"
Black Mamba Pub & Club,"Aashima Mall, Hoshangabad Road, Bhopal",North Indian,"₹1,000 for two",https://www.zomato.com/bhopal/black-mamba-pub-club-hoshangabad-road/info,Bhopal,"Near Hyundai Showroom, Ahmedpur Kalan, Chinar Fortune, Hoshangabad Road, Bhopal",10am – 12midnight,+919893293793,3.9,63,-,0
Bhopal Udipi Restaurant,"JP Nagar, Bhopal","North Indian, South Indian, Chinese, Street Food, Beverages",₹300 for two,https://www.zomato.com/bhopal/bhopal-udipi-restaurant-jp-nagar/info,Bhopal,"05, Near Chola Mandir, JP Nagar, Bhopal",11:30am – 11pm,+919589028808,3.2,15,4.0,"3,050"
Smooky Tandoor,"Gulmohar Colony, Bhopal","North Indian, Mughlai, Chinese, Rolls, Fast Food, Desserts",₹500 for two,https://www.zomato.com/bhopal/smooky-tandoor-1-gulmohar-colony/info,Bhopal,"Shop 315, Rohit Nagar Phase-2, Bawadiya Kalan, Gulmohar Colony, Bhopal","12midnight – 2am, 12noon – 12midnight",+916264652246,2.5,4,3.9,135
Bay Leaf - Courtyard Marriott,"Maharana Pratap Nagar, Bhopal","Asian, Italian, North Indian, Lucknowi, Mughlai, Desserts","₹2,000 for two",https://www.zomato.com/bhopal/bay-leaf-courtyard-marriott-maharana-pratap-nagar/info,Bhopal,"Courtyard By Marriot, Fourth Floor, DB City Mall, Maharana Pratap Nagar, Bhopal",7pm – 11:30pm,"+919109918976,+919109918868",4.4,201,-,0
Shahi Durbar,"TT Nagar, Bhopal","Ice Cream, Waffle, Beverages, Desserts, Fast Food, Coffee",₹400 for two,https://www.zomato.com/bhopal/shahi-durbar-1-tt-nagar/info,Bhopal,"129- A, Malviya Nagar, TT Nagar, Bhopal","12midnight – 2am, 11am – 12midnight","+918602726170,+917000169442",4.8,154,4.3,"2,871"
Vrindavan Dhaba,"Hoshangabad Road, Bhopal","North Indian, Chinese",₹600 for two,https://www.zomato.com/bhopal/vrindavan-dhaba-hoshangabad-road/info,Bhopal,"Near Aashima Mall, Gulmohar Colony, Hoshangabad Road, Bhopal","12midnight – 3:15am, 9:30am – 12midnight",+917554074028,4.0,717,4.1,34.8K
Land Of Liberty,"BHEL, Bhopal",Chinese,"₹1,000 for two",https://www.zomato.com/bhopal/land-of-liberty-bhel/info,Bhopal,"Raj Avenue 5, Minal Shopping Street, Huzur, Ayodhya Bypass Road, BHEL, Bhopal",5pm – 12midnight,+917000359797,-,3,-,0
Langar Bistro & Restro,"Kolar, Bhopal","Thai, Chinese, North Indian, Seafood, Mughlai, Biryani, Beverages",₹850 for two,https://www.zomato.com/bhopal/langar-bistro-restro-kolar/info,Bhopal,"Shop 7, Sagar Home-11, Sarvdharam Sector A, Near Vishal Mega Mart, Kolar, Bhopal",12noon – 11pm,+918516057649,3.9,8,4.1,263
Lord Of The Drinks,"TT Nagar, Bhopal","North Indian, Continental, Pizza, Fast Food, Burger","₹1,000 for two",https://www.zomato.com/bhopal/lord-of-the-drinks-tt-nagar/info,Bhopal,"National Law University, Kerwa Dam Road, TT Nagar, Bhopal",1pm – 12midnight,+919238805414,New,2,-,0
House 230- The Gourmet Kitchen,"TT Nagar, Bhopal","Chinese, Continental, North Indian, Fast Food, Momos","₹1,000 for two",https://www.zomato.com/bhopal/house-230-the-gourmet-kitchen-tt-nagar/info,Bhopal,"230, Kerwa Dam Road, TT Nagar, Bhopal",12noon – 12midnight,+918989888988,3.1,9,-,1
Atmosphere,"Maharana Pratap Nagar, Bhopal","North Indian, Continental, Fast Food, Chinese, Beverages","₹1,000 for two",https://www.zomato.com/bhopal/atmosphere-1-maharana-pratap-nagar/info,Bhopal,"239, Sunny Palace, Shashwat Tower, Near Surendra Vilas, Zone-I, Maharana Pratap Nagar, Bhopal",11am – 11pm,"+917000661262,+919294895640",3.5,35,-,0
Hotel Kavish Mahal,"Gulmohar Colony, Bhopal","North Indian, Chinese, Fast Food",₹350 for two,https://www.zomato.com/bhopal/hotel-kavish-mahal-gulmohar-colony/info,Bhopal,"67, Phase 2, Rohit Nagar, Gulmohar Colony, Bhopal",11am – 12midnight,+919340187266,New,4,4.3,39
Hotel Zorba,"Hoshangabad Road, Bhopal","North Indian, Mughlai, Chinese, Fast Food",₹700 for two,https://www.zomato.com/bhopal/hotel-zorba-hoshangabad-road/info,Bhopal,"49, Kundan Nagar, Bagmugaliya, Near Bhel Sangam Chouraha, Hoshangabad Road, Bhopal",11am – 11pm,"+918602433308,+917554050247",-,3,3.4,29
House Of Delici,"Airport Area, Bhopal","North Indian, Chinese, Fast Food, Pizza, Mughlai, Desserts, Beverages","₹1,600 for two",https://www.zomato.com/bhopal/house-of-delici-airport-area/info,Bhopal,"Rooftop, Alark Squre, Gram Nayapura, Lalghati Squre, Airport Area, Bhopal","12midnight – 3am, 1pm – 12midnight",+919340852084,3.2,30,3.8,331
Chai Nagri,"Gulmohar Colony, Bhopal","Fast Food, Pizza, Street Food, Healthy Food, Shake, Tea, Beverages",₹400 for two,https://www.zomato.com/bhopal/chai-nagri-gulmohar-colony/info,Bhopal,"49, Sahyog Vihar, Gulmohar Colony, Bhopal",24 Hours,+919039392508,4.0,60,3.7,570
Raasta,"Habib Ganj, Bhopal","Asian, Italian, Continental, Pizza, Fast Food, Desserts, Bar Food","₹1,500 for two",https://www.zomato.com/bhopal/raasta-habib-ganj/info,Bhopal,"F001, First Floor, Habib Ganj, Bhopal",12:15pm – 11:30pm,+918982054449,-,0,New,1
Tangelo - Citrus Classic,"Hoshangabad Road, Bhopal","North Indian, Chinese, Sichuan",₹700 for two,https://www.zomato.com/bhopal/tangelo-citrus-classic-hoshangabad-road/info,Bhopal,"Plot 468/325, Near Toyota Showroom, Hoshangabad Road, Bhopal",9am – 11pm,+916262601982,3.9,13,3.4,11
Delhi 6,"DB City, Maharana Pratap Nagar, Bhopal","North Indian, Street Food",₹350 for two,https://www.zomato.com/bhopal/delhi-6-maharana-pratap-nagar/info,Bhopal,"Third Floor, Near DB City Mall, Maharana Pratap Nagar, Bhopal",11am – 11pm,+919685468170,3.1,88,4.1,354
E Square,"Arera Colony, Bhopal","North Indian, South Indian, Fast Food, Sandwich, Pizza",₹300 for two,https://www.zomato.com/bhopal/e-square-arera-colony/info,Bhopal,"E8/2 12 Bus Stop, Arera Colony, Bhopal",11am – 11pm,"+919754534000,+917554034000",4.4,224,-,0
Sanjay Sweets,"JP Nagar, Bhopal","North Indian, Chinese, Street Food, Fast Food, Desserts, Beverages",₹300 for two,https://www.zomato.com/bhopal/sanjay-sweets-jp-nagar/info,Bhopal,"Plot 12, Karond Chouraha, JP Nagar, Bhopal",Opens at 10:29pm,+917223886314,4.0,178,4.2,17.3K
The Public House Café N Restaurant,"Maharana Pratap Nagar, Bhopal","North Indian, Kebab, Oriental, Fast Food, Mughlai, Chinese, Beverages",₹800 for two,https://www.zomato.com/bhopal/the-public-house-café-n-restaurant-maharana-pratap-nagar/info,Bhopal,"Mahadev Complex, Lower Ground Floor, Shivaji Nagar, Opposite Board Office, Maharana Pratap Nagar, Bhopal",12:30pm – 11pm,"+917999192203,+917554925567",4.4,906,4.0,"1,517"
Rajhans Thali,"Maharana Pratap Nagar, Bhopal","North Indian, Rajasthani",₹500 for two,https://www.zomato.com/bhopal/rajhans-thali-maharana-pratap-nagar/info,Bhopal,"268, Near Sargam Talkies, Zone 2, Maharana Pratap Nagar, Bhopal",11am – 10:30pm,+917554033400,4.1,744,4.4,"8,720"
Twisst Of Tadka,"Aashima Mall, Hoshangabad Road, Bhopal","North Indian, Mughlai, Biryani, Fast Food, Sichuan",₹650 for two,https://www.zomato.com/bhopal/twisst-of-tadka-hoshangabad-road/info,Bhopal,"74, Vidya Nagar Phase 2, Hoshangabad Road, Bhopal",11am – 11pm,"+919425363956,+918982378595,+917554700099",4.6,190,4.0,"5,014"
The Celestial Park Hotel,"Hoshangabad Road, Bhopal","North Indian, Chinese","₹1,000 for two",https://www.zomato.com/bhopal/the-celestial-park-hotel-hoshangabad-road/info,Bhopal,"Halka 42, Khasra 225, 226, 227, Gram Bhairopur, Teh Huzur, Hoshangabad Road, Bhopal",11am – 11pm,"+919516000911,+919516000910",-,2,3.7,17
Kathi Junction,"Hoshangabad Road, Bhopal","North Indian, Chinese, Mughlai, Biryani, Rolls, Fast Food, Ice Cream, Beverages","₹1,000 for two",https://www.zomato.com/bhopal/kathi-junction-hoshangabad-road/info,Bhopal,"House 08, Sector C, Vidya Nagar, Hoshangabad Road, Bhopal",11am – 11pm,+919522077666,3.3,7,4.0,244
Marbella's Cafe and Lounge,"Airport Area, Bhopal","North Indian, Chinese, Roast Chicken, Fast Food, Street Food",₹500 for two,https://www.zomato.com/bhopal/marbellas-cafe-and-lounge-airport-area/info,Bhopal,"3rd Floor, Signature Plaza, Airport Road, Indra Vihar Colony, Lal Ghati, Opposite Manuabhan Tekri, Airport Area, Bhopal","12midnight – 2am, 2:30pm – 12midnight",+918383826717,3.9,29,3.4,306
Guilt Trip,"TT Nagar, Bhopal","Bakery, Desserts",₹400 for two,https://www.zomato.com/bhopal/guilt-trip-tt-nagar/info,Bhopal,"129, AFMPCCL Building, TT Nagar, Bhopal","12midnight – 2am, 12:15pm – 12midnight",+919685349469,-,1,3.2,47
Hotel Rajhans Regent,"Maharana Pratap Nagar, Bhopal","North Indian, Chinese, Continental, Desserts","₹1,000 for two",https://www.zomato.com/bhopal/hotel-rajhans-regent-maharana-pratap-nagar/info,Bhopal,"Plot 12-14-15, Commercial Area, Near Chetak Bridge Circle, Maharana Pratap Nagar, Bhopal",11am – 11pm,+917553501888,4.0,360,4.2,"3,509"
Burgerland,"BHEL, Bhopal","Burger, Wraps, Sandwich, Fast Food",₹300 for two,https://www.zomato.com/bhopal/burgerland-bhel/info,Bhopal,"Shop 5-6, Ground Floor, Raj Avenue 4-A, Minal Shopping Street, Minal Residency, JK Road, BHEL, Bhopal",11:15am – 11pm,+919407090176,3.1,11,3.7,334
Haji Hotel,"Peer Gate Area, Bhopal","North Indian, Biryani, Mughlai",₹300 for two,https://www.zomato.com/bhopal/haji-hotel-peer-gate-area/info,Bhopal,"House 13, Madina Hotel Gali Ibrahimpura, Peer Gate Area, Bhopal",12noon – 12midnight,"+919074151908,+918827664067",4.3,355,4.1,"9,759"
Ranjit's Lakeview,"TT Nagar, Bhopal","North Indian, Mughlai, Chinese",₹600 for two,https://www.zomato.com/bhopal/ranjits-lakeview-tt-nagar/info,Bhopal,"Van Vihar Road, Shamla Hills, TT Nagar, Bhopal",8:30am – 11pm,+919827707700,3.5,119,3.9,"2,266"
Bake N Shake,"Arera Colony, Bhopal",Bakery,₹400 for two,https://www.zomato.com/bhopal/bake-n-shake-arera-colony/info,Bhopal,"B1, GM Tower, Stop 10, Arera Colony, Bhopal","12midnight – 2:30am, 10am – 12midnight","+917554076666,+917554291111",4.2,752,4.3,17K
Hot Pot Buffet,"Maharana Pratap Nagar, Bhopal","North Indian, Chinese, Desserts",₹300 for two,https://www.zomato.com/bhopal/hot-pot-buffet-maharana-pratap-nagar/info,Bhopal,"Plot Z-3, Zone 1, Maharana Pratap Nagar, Bhopal",12:15pm – 10:30pm,+919111130710,3.3,4,4.2,77
Kake Da Dhaba,"Gulmohar Colony, Bhopal","Chinese, North Indian, Biryani, Mughlai, Desserts, Beverages",₹650 for two,https://www.zomato.com/bhopal/kake-da-dhaba-gulmohar-colony/info,Bhopal,"18, 19, Ultimate Heights, Bawadiya Kalan, Shahpura Road, Gulmohar Colony, Bhopal",12noon – 11pm,+916264825511,3.9,4,3.4,44
Tilakrams Sweets Bakery Restaurant,"JP Nagar, Bhopal","Mithai, South Indian",₹400 for two,https://www.zomato.com/bhopal/tilakrams-sweets-bakery-restaurant-jp-nagar/info,Bhopal,"A/09, Ground Floor, JK Tower, Opposite Peoples Hospital, Bhanpur Road, JP Nagar, Bhopal",8am – 11:15pm,+917566424222,3.9,4,4.2,557
Hotel 18 Keys,"Habib Ganj, Bhopal","North Indian, Chinese, BBQ, Street Food, Pasta","₹1,000 for two",https://www.zomato.com/bhopal/hotel-18-keys-habib-ganj/info,Bhopal,"Plot 20, Hoshangabad Road, Near ISBT Stand, Habib Ganj, Bhopal","12midnight – 2:30am, 8:15am – 12midnight",+919589111818,3.5,8,4.3,315
Hotel Kalonji,"BHEL, Bhopal","Chinese, North Indian, Biryani",₹700 for two,https://www.zomato.com/bhopal/hotel-kalonji-bhel/info,Bhopal,"Gate 1, Minal Residency, JK Road, BHEL, Bhopal","12midnight – 2am, 7:30am – 12midnight",+917898050590,3.3,4,3.7,"1,434"
1909 Crown of Bhopal,"Jhangirabad, Bhopal","Oriental, North Indian, Salad, Kebab, Bar Food","₹1,800 for two",https://www.zomato.com/bhopal/1909-crown-of-bhopal-jhangirabad/info,Bhopal,"Minto Hall Road, Jhangirabad, Bhopal",11am – 10pm,+916384469320,-,1,-,0
Pepperazzi,"TT Nagar, Bhopal","North Indian, Chinese, Fast Food, Mughlai, Beverages, Continental, Italian, Wraps",₹800 for two,https://www.zomato.com/bhopal/pepperazzi-tt-nagar/info,Bhopal,"64 A, Civil Line, Shyamla Hills, TT Nagar, Bhopal","12midnight – 2am, 12noon – 12midnight","+919926325497,+919340029933",3.9,54,4.0,"1,035"
Tabbar House,"BHEL, Bhopal","North Indian, Italian, Chinese, Fast Food","₹1,000 for two",https://www.zomato.com/bhopal/tabbar-house-bhel/info,Bhopal,"Plot 16 And 17, Gaurav Tower, Minal Residency, JK Road, BHEL, Bhopal",12noon – 11:45pm,+919303836652,4.6,19,3.9,155
Hungry Burger,"JP Nagar, Bhopal",Fast Food,₹250 for two,https://www.zomato.com/bhopal/hungry-burger-jp-nagar/info,Bhopal,"Shop 126, Near PNT Colony Berasiya Road Qazi Camp JP Nagar, Bhopal",1:30pm – 1am,+919300370472,4.0,231,4.0,"6,146"
Fusion Meals,"Gulmohar Colony, Bhopal",North Indian,₹550 for two,https://www.zomato.com/bhopal/fusion-meals-gulmohar-colony/info,Bhopal,"Shop 42, Shaitan Singh Market, Gulmohar Colony, Bhopal",12:30pm – 11:45pm,+919438569962,3.9,4,4.0,534
Hot & Crunchy Fried Chicken,"Aashima Mall, Hoshangabad Road, Bhopal","Fast Food, Arabian, Beverages",₹400 for two,https://www.zomato.com/bhopal/hot-crunchy-fried-chicken-hoshangabad-road/info,Bhopal,"C-4, Second Floor, Aashima Mall, Hoshangabad Road, Bhopal",11am – 10pm,+918349524140,3.9,14,3.7,338
Mr. Taste,"Peer Gate Area, Bhopal","Sandwich, Pizza, Fast Food, Street Food, Chinese, Momos, Beverages",₹250 for two,https://www.zomato.com/bhopal/mr-taste-peer-gate-area/info,Bhopal,"Shop 3, Kilol Park, Peer Gate Area, Bhopal",1pm – 11pm,+916269359316,-,3,New,4
The Fern Residency,"Maharana Pratap Nagar, Bhopal","North Indian, Fast Food, Chinese, Desserts, Sandwich, Oriental, Asian",₹900 for two,https://www.zomato.com/bhopal/the-fern-residency-maharana-pratap-nagar/info,Bhopal,"Plot 7, ISBT Commercial Complex, Near Chetak Bridge, Maharana Pratap Nagar, Bhopal",Opens tomorrow at 12noon,"+918889266678,+916262033955,+916262033944",3.9,39,4.0,21
Pitchers Cafe Bar,"DB City, Maharana Pratap Nagar, Bhopal","North Indian, Chinese, Italian, Burger, Fast Food, Pasta, Biryani, Desserts","₹1,500 for two",https://www.zomato.com/bhopal/pitchers-cafe-bar-2-maharana-pratap-nagar/info,Bhopal,"3rd Floor, D B City Mall, Maharana Pratap Nagar, Bhopal",Opens tomorrow at 12noon,+919131245032,3.1,38,3.9,84
The Evening Post,"Arera Colony, Bhopal","Cafe, Coffee, Salad, Italian, Healthy Food, Fast Food",₹800 for two,https://www.zomato.com/bhopal/the-evening-post-arera-colony/info,Bhopal,"E-4/79, 1st Floor, Vandemataram Square, Arera Colony, Bhopal",12noon – 11pm,+919111888092,New,0,-,0
Rahul Meena Momos And More,"Gulmohar Colony, Bhopal","Momos, Chinese, Fast Food, North Indian, Waffle, Shake, Beverages",₹300 for two,https://www.zomato.com/bhopal/rahul-meena-momos-and-more-2-gulmohar-colony/info,Bhopal,"Shop 13, Block 05, Mahindra Business Square, Rohit Nagar, Gulmohar Colony, Bhopal",2pm – 11:30pm,+919644403111,3.3,5,3.8,396
Winni Cakes & More,"Gulmohar Colony, Bhopal","Bakery, Desserts, Fast Food",₹500 for two,https://www.zomato.com/bhopal/winni-cakes-more-gulmohar-colony/info,Bhopal,"House 280, Bawardiya Kalan, Rohit Nagar, Phase 2, Gulmohar Colony, Bhopal",11am – 11pm,+916283361134,3.6,19,4.0,883
McDonald's,"DB City, Maharana Pratap Nagar, Bhopal","Burger, Fast Food, Beverages, Coffee",₹500 for two,https://www.zomato.com/bhopal/mcdonalds-maharana-pratap-nagar/info,Bhopal,"Third Floor, DB City mall, Maharana Pratap Nagar, Bhopal",11am – 10:45pm,+919993563050,3.9,773,4.0,15.1K
Monk's Cafe,"BHEL, Bhopal","Pizza, Fast Food, Street Food, Tea, Shake, Beverages",₹300 for two,https://www.zomato.com/bhopal/monks-cafe-bhel/info,Bhopal,"4, Deep Mohini Colony, Jamburi Maidan, Khajuri Khala Road, BHEL, Bhopal",5pm – 11pm,+917987150769,3.7,6,4.1,62
Kaffeine Diet Cafe,"Hoshangabad Road, Bhopal","Pizza, Pasta, Momos, Fast Food, Street Food, Coffee, Tea, Beverages",₹350 for two,https://www.zomato.com/bhopal/kaffeine-diet-cafe-hoshangabad-road/info,Bhopal,"Shop 11A, Ground Floor, Bagli, Hoshangabad Road, Bhopal",12noon – 10:30pm,+919770035967,3.5,11,3.7,153
Alishan Restaurant,"JP Nagar, Bhopal","North Indian, Chinese, Mughlai",₹900 for two,https://www.zomato.com/bhopal/alishan-restaurant-jp-nagar/info,Bhopal,"Plot 3, Near AlpanaTalkies, JP Nagar, Bhopal",11am – 11pm,"+918269350950,+919630250131",3.9,11,3.7,120
Eagle Boys Pizzeria And Cafe,"Arera Colony, Bhopal","Cafe, Coffee, Shake, Beverages, Pizza, Burger, Fast Food",₹600 for two,https://www.zomato.com/bhopal/eagle-boys-pizzeria-and-cafe-arera-colony/info,Bhopal,"Plot 44, Opposite SBI, Arera Colony, Bhopal",12noon – 11pm,+918888841518,3.4,4,3.7,13
AL - Amaan,"Jhangirabad, Bhopal","North Indian, Beverages, Street Food",₹500 for two,https://www.zomato.com/bhopal/al-amaan-jhangirabad/info,Bhopal,"House G 10, Shop 3, 4, Mayur Vihar Colony, Ashok Garden, Jhangirabad, Bhopal",2pm – 11pm,+919301755323,-,2,3.8,143
Suruchi's 24x7,"Gulmohar Colony, Bhopal","North Indian, Chinese, Pizza, Sandwich, Fast Food, Street Food, Desserts, Shake",₹400 for two,https://www.zomato.com/bhopal/suruchis-24x7-gulmohar-colony/info,Bhopal,"Shop 2, Near Apolo Hospital, Gulmohar Colony, Bhopal",24 Hours,+919589905331,3.7,20,4.0,627
Angithi Restaurant,"Gulmohar Colony, Bhopal","North Indian, Mughlai, Chinese, Biryani",₹500 for two,https://www.zomato.com/bhopal/angithi-restaurant-gulmohar-colony/info,Bhopal,"Shop 1, Mahindra Business Square, Bawadiya Colony, Gulmohar Colony, Bhopal",11am – 11pm,+919993438888,3.4,118,4.0,"2,855"
Barcode - Kwality's Motel Shiraz,"Maharana Pratap Nagar, Bhopal","North Indian, Kebab, Fast Food, Beverages","₹1,500 for two",https://www.zomato.com/bhopal/barcode-kwalitys-motel-shiraz-maharana-pratap-nagar/info,Bhopal,"Opposite Board Office Square, Shivaji Nagar, Maharana Pratap Nagar, Bhopal",11:30am – 12midnight,+917554032900,4.1,16,-,0
Chicken Kukduku,"Gulmohar Colony, Bhopal","Biryani, North Indian",₹300 for two,https://www.zomato.com/bhopal/chicken-kukduku-gulmohar-colony/info,Bhopal,"E-7/851, Basantkunj, Opposite SBI Branch, Gulmohar Colony, Bhopal",12noon – 12midnight,+919826770511,3.9,5,4.1,"2,291"
Lazeez Hakeem,"Maharana Pratap Nagar, Bhopal","North Indian, Biryani, Chinese, Mughlai","₹1,000 for two",https://www.zomato.com/bhopal/lazeez-hakeem-maharana-pratap-nagar/info,Bhopal,"187 A, Zone 1, Maharana Pratap Nagar, Bhopal",9am – 1am,+917745977459,4.0,685,4.3,11K
Ba Dastoor,"Jhangirabad, Bhopal","North Indian, Biryani, Chinese, Fast Food, Kebab, Mughlai, Mandi, Desserts","₹1,200 for two",https://www.zomato.com/bhopal/ba-dastoor-jhangirabad/info,Bhopal,"Plot 9, 80 Feet Road, Near Ashoka Garden, Jhangirabad, Bhopal",1pm – 11pm,+919111012866,4.3,49,4.1,"2,514"
Hakeem Restaurant,"Maharana Pratap Nagar, Bhopal","North Indian, Chinese, Mughlai, Fast Food, Kebab, Pizza, Desserts, Beverages","₹1,000 for two",https://www.zomato.com/bhopal/hakeem-restaurant-1-maharana-pratap-nagar/info,Bhopal,"Plot 84, Infront Of Raymond Showroom, Zone 2, Maharana Pratap Nagar, Bhopal",11am – 11pm,"+918889942333,+917554233342",3.9,399,3.9,"5,303"
Anny's Artisan Bistro,"Arera Colony, Bhopal","North Indian, Oriental, Continental, Italian, Pizza, Chinese, Desserts","₹1,200 for two",https://www.zomato.com/bhopal/annys-artisan-bistro-arera-colony/info,Bhopal,"E-2/71, E-2, Near IndusInd Bank, Arera Colony, Bhopal",12noon – 12midnight,+918889178686,3.5,69,4.0,"1,458"
SKG Sanjha Chulha,"Maharana Pratap Nagar, Bhopal","North Indian, Chinese, Fast Food, Street Food, Beverages",₹500 for two,https://www.zomato.com/bhopal/skg-sanjha-chulha-maharana-pratap-nagar/info,Bhopal,"Plot 19, Ground Floor, Opposite Sameer MRI, Maharana Pratap Nagar, Bhopal",11am – 11pm,+919977993699,3.2,9,3.7,513
House of Ming,"Taj Lakefront TT Nagar, Bhopal","Chinese, Asian, Seafood, Cantonese, Sichuan, Desserts, Ice Cream","₹3,000 for two",https://www.zomato.com/bhopal/house-of-ming-tt-nagar/info,Bhopal,"1st Floor, Taj Lake Front Hotel, Link Road 3, Bhadbhada Chowraha, TT Nagar, Bhopal","12:30pm – 2:30pm, 6:30pm – 10:30pm",+917554370000,3.9,4,-,0
Sharma And Vishnu Fast Food - Ayodhya Bypass,"BHEL, Bhopal","North Indian, Chinese, Fast Food, Biryani, Beverages",₹300 for two,https://www.zomato.com/bhopal/sharma-and-vishnu-fast-food-ayodhya-bypass-bhel/info,Bhopal,"S1/S2/S3, Welcome Apartment, Ayodhya Bypass, BHEL, Bhopal",11:30am – 10:30pm,+919111099941,4.1,346,4.2,19.4K
House No.230 The Gourmet Kitchen & Bar,"TT Nagar, Bhopal","North Indian, Chinese, Salad, Fast Food, Desserts, Beverages, Shake","₹1,000 for two",https://www.zomato.com/bhopal/house-no-230-the-gourmet-kitchen-bar-tt-nagar/info,Bhopal,"230, Mendori, Near NLIU College, Kerwa Dam Road, TT Nagar, Bhopal",12noon – 12midnight,+919981356975,-,2,-,0
Ganesham Fast Food - Kolar Road,"Kolar, Bhopal","North Indian, Biryani, Sandwich, Pizza, Shake",₹500 for two,https://www.zomato.com/bhopal/ganesham-fast-food-kolar-road-kolar/info,Bhopal,"Shop 3 and 4, V.D Nair Complex, Mahabali Nagar, Kolar Road, Kolar, Bhopal",9am – 11pm,"+917554056287,+919111823999",4.0,534,4.0,22.5K
The Brunch House 2.0,"Hoshangabad Road, Bhopal","North Indian, Oriental, Fast Food, Chinese, Mughlai, Kebab, Biryani",₹700 for two,https://www.zomato.com/bhopal/the-brunch-house-2-0-hoshangabad-road/info,Bhopal,"Plot 6, Vidya Nagar, Sector C, Opposite Bagmugaliya Thana, Hoshangabad Road, Bhopal",12:15pm – 11:30pm,+919598956563,4.0,21,4.1,270
Sharma Ji Fast Food Corner & Restaurant,"TT Nagar, Bhopal",Chinese,₹200 for two,https://www.zomato.com/bhopal/sharma-ji-fast-food-corner-restaurant-tt-nagar/info,Bhopal,"256, Nehru Nagar Road, TT Nagar, Bhopal",12noon – 10:45pm,+919131807336,-,3,4.2,34
Moksh Club,"Kohefiza, Bhopal","Chinese, North Indian, Mughlai, Fast Food",₹850 for two,https://www.zomato.com/bhopal/moksh-club-1-kohefiza/info,Bhopal,"Near Akash Garden, Bairagarh, Kohefiza, Bhopal","12:15am – 1:45am, 4pm – 12midnight",+919303666699,-,2,4.0,6
Veera Da Malai Chaap,"TT Nagar, Bhopal","North Indian, Rolls",₹450 for two,https://www.zomato.com/bhopal/veera-da-malai-chaap-1-tt-nagar/info,Bhopal,"124, Nehru Nagar Chouraha, Near Sai Mandir, TT Nagar, Bhopal",1pm – 12midnight,+919893888564,New,2,4.3,32
Rajhans Time Out Restaurant,"Maharana Pratap Nagar, Bhopal","North Indian, Pizza",₹300 for two,https://www.zomato.com/bhopal/rajhans-time-out-restaurant-maharana-pratap-nagar/info,Bhopal,"Hotel Rajhans, Near Sargam Talkines, Maharana Pratap Nagar, Bhopal",11am – 10:45pm,"+917554033400,+919303131741",4.1,225,4.2,939
The Ministry Of Taste,"BHEL, Bhopal","North Indian, Chinese, Seafood, Biryani, Fast Food",₹800 for two,https://www.zomato.com/bhopal/the-ministry-of-taste-bhel/info,Bhopal,"Shop 4-5, Regal Civic Centre, Awadhpuri, BHEL, Bhopal",1:30pm – 11:30pm,+919522705444,2.8,5,3.6,817
Krispy,"Gulmohar Colony, Bhopal",Fast Food,₹200 for two,https://www.zomato.com/bhopal/krispy-1-gulmohar-colony/info,Bhopal,"Shop 09, Ground Floor, Green City, Amaltash Bawadiya Kala, Gulmohar Colony, Bhopal",1:30pm – 12midnight,+917554171445,New,2,New,2
Cook Dooh Kooh,"Gulmohar Colony, Bhopal","North Indian, Mughlai, Chinese, Fast Food",₹400 for two,https://www.zomato.com/bhopal/cook-dooh-kooh-gulmohar-colony/info,Bhopal,"E-8, Shop 1, Sehkarita Nagar, Opposite Shweta Complex, Gulmohar Colony, Bhopal",12:45pm – 10:30pm,"+919111729222,+919111709222",4.1,138,4.1,"4,998"
Handcrafted Café & Roastery,"Hoshangabad Road, Bhopal","Cafe, Coffee",₹250 for two,https://www.zomato.com/bhopal/handcrafted-café-roastery-hoshangabad-road/info,Bhopal,"Shop 5, Ground Floor, Maple High Street,Opposite Ashima Mall, Hoshangabad Road, Bhopal",,+918602652040,4.4,47,4.1,293
