Restaurant_Name,Locality,Cuisines,Average_Cost_for_two,Restaurant_Url,City,Address,Available_Time,Contact_Number,Dining_Ratings,Dining_Votes,Delivery_Ratings,Delivery_Votes
Bun Teaa The Roof Top Baithak,"TT Nagar, Bhopal","Tea, Sandwich, Pizza, Pasta, Chinese, Momos",₹250 for two,https://www.zomato.com/bhopal/bun-teaa-the-roof-top-baithak-tt-nagar/info,Bhopal,"LIG 80, Nehru Nagar, TT Nagar, Bhopal",10:30am – 10:30pm,+919826802281,-,2,3.7,16
Caffeine Machine,"Kolar, Bhopal","Fast Food, Beverages",₹400 for two,https://www.zomato.com/bhopal/caffeine-machine-kolar/info,Bhopal,"Shop 9, Block A, Sagar Premium Tower Phase 2, Near JK Hospital Road, Kolar, Bhopal",11am – 11pm,+918251009175,3.5,8,4.1,41
Memsaheb,"Arera Colony, Bhopal","North Indian, Continental, Mughlai, Biryani, Desserts","₹2,000 for two",https://www.zomato.com/bhopal/memsaheb-arera-colony/info,Bhopal,"E-2/71, Second Floor, Arera Colony, Bhopal",12noon – 12midnight,+919522287493,3.4,8,4.0,22
Hotel Shikha,"Peer Gate Area, Bhopal","North Indian, Chinese, South Indian, Street Food, Fast Food, Pizza, Biryani, Desserts",₹600 for two,https://www.zomato.com/bhopal/hotel-shikha-4-peer-gate-area/info,Bhopal,"8, Azad Market, Jumerati, Peer Gate Area, Bhopal",10am – 12midnight,+917610272222,4.2,255,4.1,"5,550"
Hotel Ranjeet,"Peer Gate Area, Bhopal","North Indian, Mughlai, Chinese, Biryani, Continental, Italian, Desserts, Beverages",₹800 for two,https://www.zomato.com/bhopal/hotel-ranjeet-peer-gate-area/info,Bhopal,"3, Hamidia Road, Peer Gate Area, Bhopal",12noon – 11:30pm,+917552740502,4.0,205,4.1,910
NV Cafe Rooftop Restaurant,"Gulmohar Colony, Bhopal","North Indian, Chinese, Mughlai, Sichuan, Beverages",₹600 for two,https://www.zomato.com/bhopal/nv-cafe-rooftop-restaurant-gulmohar-colony/info,Bhopal,"House 2, Khasra 12/1/3, 12/2/2, 12/1/2, 2nd Floor, Bawadiya Kalan, Trilochan Nagar, Gulmohar Colony, Bhopal",12noon – 12midnight,+916266146352,-,2,New,4
Hong Kong Restaurant,"Gulmohar Colony, Bhopal","Chinese, Italian, North Indian, Seafood, Shake, Beverages, Sichuan",₹800 for two,https://www.zomato.com/bhopal/hong-kong-restaurant-gulmohar-colony/info,Bhopal,"B-22, Hoshangabad Road, Vidhya Nagar, Gulmohar Colony, Bhopal",11am – 11:30pm,+917067117393,3.3,7,4.2,725
Kake Di Hatti,"Maharana Pratap Nagar, Bhopal","North Indian, Chinese, Rolls",₹350 for two,https://www.zomato.com/bhopal/kake-di-hatti-maharana-pratap-nagar/info,Bhopal,"188, Zone 1, Maharana Pratap Nagar, Bhopal",10:45am – 10:45pm,+918982899255,3.0,12,3.7,49
Hummus Nest,"Arera Colony, Bhopal","Healthy Food, Arabian, Lebanese, Wraps, Fast Food, Desserts, Beverages",₹500 for two,https://www.zomato.com/bhopal/hummus-nest-arera-colony/info,Bhopal,"E4, 384 Arera Colony Ground Floor, Arera Colony, Bhopal",12noon – 11pm,+917389537078,3.6,10,3.8,272
Al Amaan,"Peer Gate Area, Bhopal",North Indian,₹300 for two,https://www.zomato.com/bhopal/al-amaan-peer-gate-area/info,Bhopal,"House 22, Shoukat Mahal, Near Iqbal Maidan, Peer Gate Area, Bhopal",3pm – 12midnight,+917804828703,3.6,4,3.9,217
Zaitoon-E-Khaas,"Peer Gate Area, Bhopal","North Indian, Chinese, Mughlai, Seafood, Kebab, Biryani, Shake, Beverages","₹1,000 for two",https://www.zomato.com/bhopal/zaitoon-e-khaas-peer-gate-area/info,Bhopal,"Shop 1, Model Ground, Peer Gate Area, Bhopal","12midnight – 1am, 12noon – 12midnight",+916263144687,3.4,18,4.1,"3,401"
Vrindavan Restaurant & Dhaba,"Gulmohar Colony, Bhopal","North Indian, Chinese, Desserts, Shake, Beverages",₹400 for two,https://www.zomato.com/bhopal/vrindavan-restaurant-dhaba-gulmohar-colony/info,Bhopal,"11/12, Mahendra Business Square, Block 05, Gulmohar Colony, Bhopal",11:30am – 12midnight,+917724860867,-,3,4.0,715
Dakshin Foods,"Hoshangabad Road, Bhopal","North Indian, South Indian, Beverages",₹150 for two,https://www.zomato.com/bhopal/dakshin-foods-2-hoshangabad-road/info,Bhopal,"LIG-38, Amravati, Near Aiims Hospital, South Bagsewaniya Hoshangabad Road, Bhopal",8am – 11pm,+916265458532,-,2,4.0,9
Vrinda's Cafe,"Jhangirabad, Bhopal","Pizza, Sandwich, Rolls, Chinese, Beverages",₹100 for two,https://www.zomato.com/bhopal/vrindas-cafe-jhangirabad/info,Bhopal,"A-8, Shop 1, New Ashoka Garden, Jhangirabad, Bhopal",3pm – 11:30pm,+919806772126,3.3,4,-,0
Wonder Bread,"Kohefiza, Bhopal","Bakery, Fast Food",₹400 for two,https://www.zomato.com/bhopal/wonder-bread-kohefiza/info,Bhopal,"A-6, Kohefiza, Bhopal",9am – 11pm,+917554297897,4.1,117,4.0,467
Pizza Kitchen,"Maharana Pratap Nagar, Bhopal","Pizza, Pasta, Shake",₹500 for two,https://www.zomato.com/bhopal/pizza-kitchen-maharana-pratap-nagar/info,Bhopal,"F 127, Gautam Nagar, Govindpura, Huzur, Maharana Pratap Nagar, Bhopal",10:30am – 11pm,+918707350046,4.0,22,4.4,"3,293"
Natural Ice Cream,"Maharana Pratap Nagar, Bhopal","Ice Cream, Desserts",₹300 for two,https://www.zomato.com/bhopal/natural-ice-cream-maharana-pratap-nagar/info,Bhopal,"190, Hansa Complex, Zone 1, Maharana Pratap Nagar, Bhopal",10am – 10:30pm,+917552555510,4.4,288,4.6,"4,182"
The Sky Squad Cafe And Lounge,"Jhangirabad, Bhopal","Cafe, Coffee, Fast Food, Pizza, Sandwich, Burger, Chinese, Beverages","₹1,000 for two",https://www.zomato.com/bhopal/the-sky-squad-cafe-and-lounge-jhangirabad/info,Bhopal,"Plot 06, Shree Chandan Plaza, Ashok Vihar, Jhangirabad, Bhopal",12noon – 11pm,+917554171397,New,2,New,3
Divine The Friendly Cafe,"BHEL, Bhopal","Sandwich, Fast Food, Chinese, Salad, Street Food, Shake, Beverages",₹300 for two,https://www.zomato.com/divine-the-friendly-cafe-food-truck/info,Bhopal,"Plot 11, Ajanta Complex, Bharat Nagar, BHEL, Bhopal",2:30pm – 11pm,+919074662057,New,2,New,0
Khalsa Amritsari Kulche Wala,"Arera Colony, Bhopal",North Indian,₹300 for two,https://www.zomato.com/bhopal/khalsa-amritsari-kulche-wala-arera-colony/info,Bhopal,"Shop A-2, Sarvdharm Mandir Market, 11 Bus Stop, Arera Colony, Bhopal",11am – 11pm,+919303718168,3.9,6,4.4,336
Mr. Idli Ultimate Food House,"Gulmohar Colony, Bhopal",South Indian,₹400 for two,https://www.zomato.com/bhopal/mr-idli-ultimate-food-house-gulmohar-colony/info,Bhopal,"3, Lower Ground Floor, Bawadiya Kalan, Opposite Aura Mall, Gulmohar Colony, Bhopal",8am – 10:30pm,"+917554004813,+917000792051",3.9,47,4.2,"1,195"
Indian Coffee House,"TT Nagar, Bhopal","Coffee, North Indian, Chinese, Mughlai, South Indian, Fast Food, Street Food, Ice Cream",₹400 for two,https://www.zomato.com/bhopal/indian-coffee-house-tt-nagar/info,Bhopal,"66, New Market, Malviya Nagar, Near TT Nagar, Bhopal",8am – 10:15pm,+917552554594,4.1,539,4.3,480
Urban Truffles,"Gulmohar Colony, Bhopal","Pizza, Pasta, Fast Food, Shake, Beverages",₹400 for two,https://www.zomato.com/bhopal/urban-truffles-gulmohar-colony/info,Bhopal,"Shop 5, LGF Virasha STC, Gulmohar Colony, Bhopal",11:30am – 11pm,+918575072501,-,2,3.8,52
Haji Hotel Lassi And Faluda,"Peer Gate Area, Bhopal",Beverages,₹200 for two,https://www.zomato.com/bhopal/haji-hotel-lassi-and-faluda-peer-gate-area/info,Bhopal,"Itwara Road, Itwara, Seedia School Colony, Peer Gate Area, Bhopal",11am – 12midnight,+919826064603,-,1,-,0
Vidhi Dhaba,"Airport Area, Bhopal","North Indian, Chinese, Street Food, Kebab, Biryani",₹400 for two,https://www.zomato.com/bhopal/vidhi-dhaba-airport-area/info,Bhopal,"Mubarikpur Chauraha, Airport Area, Bhopal",1pm – 12midnight,+919713338169,3.7,26,3.8,137
Da Pizzeria,"Kohefiza, Bhopal","Pizza, Fast Food, Desserts, Beverages",₹600 for two,https://www.zomato.com/bhopal/da-pizzeria-kohefiza/info,Bhopal,"House 87, Nayapura, Kohefiza, Bhopal",11am – 12midnight,+917566006666,2.7,5,4.2,"2,595"
Rajashthan Sweets & Namkeen,"Kolar, Bhopal","Mithai, Street Food",₹200 for two,https://www.zomato.com/bhopal/rajashthan-sweets-namkeen-kolar/info,Bhopal,"Plot-355, Mandakni Colony, Kolar Road, Kolar, Bhopal",8am – 10:30pm,+919893652543,3.3,9,3.9,"1,340"
Mitho Wok Street,"Gulmohar Colony, Bhopal","Chinese, Momos, Fast Food, Desserts, Seafood, Beverages","₹1,000 for two",https://www.zomato.com/bhopal/mitho-wok-street-2-gulmohar-colony/info,Bhopal,"Shop 9, Plot 11, Ground Floor, Bawadia Kalan, Near Red Temple, Gulmohar Colony, Bhopal",12:30pm – 11:15pm,+917000632297,4.2,35,4.0,"1,575"
Manohar Dairy,"Arera Colony, Bhopal","Mithai, Bakery, Street Food",₹650 for two,https://www.zomato.com/bhopal/manohar-dairy-arera-colony/info,Bhopal,"Shop G/2, Kirpal Centre, Market 10, Huzur, Arera Colony, Bhopal",9am – 10:15pm,"+919111149922,+917554040416",3.6,8,4.4,"5,515"
Swaad Times,"Peer Gate Area, Bhopal","Pizza, Fast Food, Pasta, Burger, Shake, Beverages",₹300 for two,https://www.zomato.com/bhopal/swaad-times-3-peer-gate-area/info,Bhopal,"Shop 3, 1st Floor, Jawahar Chowk, Peer Gate Area, Bhopal","12midnight – 3am, 3pm – 11:45pm",+916232603722,2.8,6,4.4,244
Rice Bowl Thai & Chinese,"Habib Ganj, Bhopal","Chinese, Thai, Sichuan",₹700 for two,https://www.zomato.com/bhopal/rice-bowl-thai-chinese-habib-ganj/info,Bhopal,"4B, Mezanine Floor, A Block, Mansarovar Complex, Habib Ganj, Bhopal",12noon – 10pm,+917554273888,4.0,422,4.2,"4,890"
Cafe Nadora,"Gulmohar Colony, Bhopal","Cafe, Coffee, Italian, North Indian, Chinese, Fast Food, Desserts, Beverages",₹800 for two,https://www.zomato.com/bhopal/cafe-nadora-gulmohar-colony/info,Bhopal,"Plot 131, Sahayog Vihar, Gulmohar Colony, Bhopal",12noon – 10:30pm,"+919001007094,+917611176444",4.3,95,4.2,625
Rafiq Biryaan,"JP Nagar, Bhopal","North Indian, Biryani",₹200 for two,https://www.zomato.com/bhopal/rafiq-biryaan-jp-nagar/info,Bhopal,"Shop 369, Gali 3, Qazi Camp Congress, Opposite Taj Studio, JP Nagar, Bhopal",8am – 3am,+918085069942,4.0,304,4.2,"8,586"
The Royal Cafe & Coffee,"BHEL, Bhopal","North Indian, Chinese, Pasta, Burger, Sandwich, Rolls, Fast Food",₹550 for two,https://www.zomato.com/bhopal/the-royal-cafe-coffee-1-bhel/info,Bhopal,"Shop 4, Plot 46, Indrapuri, Sector C, BHEL, Bhopal",11am – 11:15pm,+919200211339,3.4,5,4.0,"1,043"
The China Terrace,"Kolar, Bhopal","Chinese, Seafood, Momos, Fast Food",₹500 for two,https://www.zomato.com/bhopal/the-china-terrace-kolar/info,Bhopal,"G/3, Khasra 162, Sarvdharam Kolar Road, Kolar, Bhopal",12:45pm – 11:30pm,+918305526516,3.6,17,3.8,201
AL Barkat Hotel,"Peer Gate Area, Bhopal","North Indian, Mughlai",₹400 for two,https://www.zomato.com/bhopal/al-barkat-hotel-peer-gate-area/info,Bhopal,"Imami Gate Chouraha, Peer Gate Area, Bhopal",1pm – 11:30pm,+917000742971,3.9,4,4.0,24
The Sambhar Cafe,"Maharana Pratap Nagar, Bhopal","South Indian, Beverages",₹300 for two,https://www.zomato.com/bhopal/the-sambhar-cafe-maharana-pratap-nagar/info,Bhopal,"Plot 185, Maharana Pratap Nagar, Bhopal",8:30am – 10pm,+919926790850,-,3,4.5,326
Hotel Atishay,"Maharana Pratap Nagar, Bhopal","North Indian, Chinese, Desserts",₹700 for two,https://www.zomato.com/bhopal/hotel-atishay-maharana-pratap-nagar/info,Bhopal,"Plot 55, Zone 1, Maharana Pratap Nagar, Bhopal",11:30am – 10:30pm,+917552558881,3.6,120,4.3,925
Street Food By Punjab Grill,"Maharana Pratap Nagar, Bhopal","North Indian, Biryani, Chinese, Mughlai, Kebab, Desserts, Beverages","₹1,000 for two",https://www.zomato.com/bhopal/street-food-by-punjab-grill-maharana-pratap-nagar/info,Bhopal,"T-9, T11, 3nd Floor DB City Mall, Maharana Pratap Nagar, Bhopal",12noon – 11pm,+919993012533,4.2,26,4.0,"1,865"
Coriander Leaf,"TT Nagar, Bhopal","French, Mediterranean, Asian","₹1,500 for two",https://www.zomato.com/bhopal/coriander-leaf-tt-nagar/info,Bhopal,"Jehan Numa Retreat, Dr. Saleem Ali Road, Near Van Vihar, TT Nagar, Bhopal","12noon – 3pm, 7pm – 11pm",+917556606600,4.1,28,-,0
Ratan's Little Paradise,"Arera Colony, Bhopal","Fast Food, Beverages, Shake, Desserts",₹300 for two,https://www.zomato.com/bhopal/ratans-little-paradise-arera-colony/info,Bhopal,"Shop 46, 47, 48A, Manisha Market, Near Shahpura Lake, Arera Colony, Bhopal",10am – 11:30pm,+918819945522,3.9,47,4.3,614
Hotel The Oasis,"Maharana Pratap Nagar, Bhopal","North Indian, Fast Food, Chinese, Mughlai","₹1,000 for two",https://www.zomato.com/bhopal/hotel-the-oasis-maharana-pratap-nagar/info,Bhopal,"Plot R 42, Zone II, Near Navodhya Hospital, Maharana Pratap Nagar, Bhopal",12midnight – 11:30pm,+919893912652,-,0,4.0,30
De Vantage Restro And Lounge,"Arera Colony, Bhopal","North Indian, Sandwich, Kebab, Pizza, Rolls, Fast Food, Biryani, Shake","₹1,000 for two",https://www.zomato.com/bhopal/de-vantage-restro-and-lounge-arera-colony/info,Bhopal,"Shop G004, Raksha Tower, Near Chuna Bhatti, Kolar Road, Arera Colony, Bhopal",1pm – 12midnight,+917024777934,-,1,-,2
The Garlic Bread,"Maharana Pratap Nagar, Bhopal","Italian, Fast Food, Beverages",₹300 for two,https://www.zomato.com/bhopal/the-garlic-bread-maharana-pratap-nagar/info,Bhopal,"Stall 9, Food Court, 3rd Floor, DB City Mall, Arera Hills, Maharana Pratap Nagar, Bhopal",11am – 10pm,+919039261527,2.9,4,4.0,105
Barco's Restro - Bar,"Maharana Pratap Nagar, Bhopal","North Indian, Chinese, Continental","₹1,500 for two",https://www.zomato.com/bhopal/barcos-restro-bar-maharana-pratap-nagar/info,Bhopal,"Plot 215, 216, Zone-II, Near Sargam Cinema, Maharana Pratap Nagar, Bhopal",12:30pm – 1am,"+918720020055,+917771033375",4.0,40,-,0
Noorani Restaurant,"Peer Gate Area, Bhopal","Kebab, North Indian, Mughlai",₹200 for two,https://www.zomato.com/bhopal/noorani-restaurant-peer-gate-area/info,Bhopal,"Shop 4, Bhopal Talkies Chouraha, Saifia College Road, Peer Gate Area, Bhopal",Opens at 10:30pm,"+919685431059,+917828855962",3.5,8,4.1,352
Hideout,"Airport Area, Bhopal","North Indian, Chinese, Mughlai, Biryani, Seafood, Desserts, Shake, Beverages","₹1,200 for two",https://www.zomato.com/bhopal/hideout-14-airport-area/info,Bhopal,"10, Kabeer Dham, Near Garden Estate Society, Airport Area, Bhopal",1:15pm – 10:45pm,+919713014426,3.7,59,4.2,354
Shri Hari Restaurant,"Airport Area, Bhopal",North Indian,₹300 for two,https://www.zomato.com/bhopal/shri-hari-restaurant-airport-area/info,Bhopal,"499, Singarcholi, Airport Area, Bhopal",11am – 11:30pm,+917999941477,3.1,23,3.7,"1,069"
High Spirits Pub And Grill,"TT Nagar, Bhopal","Finger Food, Chinese, Fast Food, North Indian, Beverages","₹1,000 for two",https://www.zomato.com/bhopal/high-spirits-pub-and-grill-tt-nagar/info,Bhopal,"Hotel Ranjit Lake View, Van Vihar Road, Shymala Hills, TT Nagar, Bhopal",11am – 12midnight,+917552660600,4.3,56,-,0
Bakesmiths Bakers,"Gulmohar Colony, Bhopal","Fast Food, Bakery, Desserts",₹300 for two,https://www.zomato.com/bhopal/bakesmiths-bakers-gulmohar-colony/info,Bhopal,"Shop A-04, Tilak Nagar, Eco City Main Road, Bawadia, Gulmohar Colony, Bhopal",11am – 10:30pm,+919755621287,3.1,14,3.4,144
Hot & Crusty Kitchen,"Hoshangabad Road, Bhopal","North Indian, Chinese, Pizza, Rolls, Biryani, Fast Food, Beverages",₹350 for two,https://www.zomato.com/bhopal/hot-crusty-kitchen-hoshangabad-road/info,Bhopal,"2, Shriram Colony, Hoshangabad Road, Bhopal",1:30pm – 11:30pm,+916266244470,-,1,3.7,59
Malhotra's Kitchen,"Gulmohar Colony, Bhopal","North Indian, Mughlai",₹500 for two,https://www.zomato.com/bhopal/malhotras-kitchen-gulmohar-colony/info,Bhopal,"Plot 2, 1st Floor, Sanchar Colony, Opposite Canara Bank, Gulmohar Colony, Bhopal",12noon – 11pm,+919343561629,4.5,87,4.0,464
The Bhopal Canteen,"Maharana Pratap Nagar, Bhopal","North Indian, Chinese, Pizza, Fast Food, Street Food, Desserts, Beverages",₹300 for two,https://www.zomato.com/bhopal/the-bhopal-canteen-maharana-pratap-nagar/info,Bhopal,"B 93, Kasturba Nagar, Chetak Bridge, Maharana Pratap Nagar, Bhopal",12noon – 3am,"+917222900911,+917554908000",3.7,104,3.7,"3,590"
Just Baked - Radisson Hotel,"Radisson - Bhopal Gulmohar Colony, Bhopal","Bakery, Desserts, Burger, Pasta, Fast Food","₹1,100 for two",https://www.zomato.com/bhopal/just-baked-radisson-hotel-gulmohar-colony/info,Bhopal,"E8, Ishwar Nagar, Opposite Savoy Complex, Gulmohar Colony, Bhopal",11am – 11:30pm,+919329331017,-,1,-,0
The Spice Table - Kwality's Motel Shiraz,"Maharana Pratap Nagar, Bhopal","North Indian, Chinese, Mughlai, Biryani, Thai, Oriental, Desserts, Beverages","₹1,200 for two",https://www.zomato.com/bhopal/the-spice-table-kwalitys-motel-shiraz-maharana-pratap-nagar/info,Bhopal,"Near Board Office, Shivaji Nagar, Zone 2, Maharana Pratap Nagar, Bhopal",11am – 11:30pm,+919039444444,4.0,28,4.3,532
Sizzlers Bar & Restaurant,"Gulmohar Colony, Bhopal","North Indian, Chinese","₹1,000 for two",https://www.zomato.com/bhopal/sizzlers-bar-restaurant-gulmohar-colony/info,Bhopal,"Shop 23-25, Bawadiya Kala, Rohit Nagar, Gulmohar Colony, Bhopal",6pm – 11pm,+918120757602,4.2,30,4.1,818
The Lake City Socialite,"TT Nagar, Bhopal","Continental, Chinese, North Indian, Beverages","₹1,000 for two",https://www.zomato.com/bhopal/the-lake-city-socialite-tt-nagar/info,Bhopal,"Hotel Lake View, Shymala Hills, TT Nagar, Bhopal",12:30pm – 11:30pm,+917554221787,-,1,-,0
Kanha Restaurant,"Hoshangabad Road, Bhopal","North Indian, South Indian, Chinese, Fast Food",₹250 for two,https://www.zomato.com/bhopal/kanha-restaurant-hoshangabad-road/info,Bhopal,"Park City, Katara Hills, Barrai, Huzur, Hoshangabad Road, Bhopal",11:15am – 10:45pm,+917509358682,3.4,5,3.6,20
Hotel Amer Greens,"Hoshangabad Road, Bhopal","North Indian, Chinese, Bakery",₹400 for two,https://www.zomato.com/amergreens/info,Bhopal,"Near Gyan Ganga Academy, Hoshangabad Road, Bhopal",11:30am – 11pm,"+919630097155,+917554012770,+919630097156",4.0,151,4.3,"2,154"
Ace Of Clubs,"Gulmohar Colony, Bhopal","North Indian, Chinese, Mughlai, Biryani, Pasta, Fast Food","₹1,200 for two",https://www.zomato.com/bhopal/ace-of-clubs-gulmohar-colony/info,Bhopal,"Plot 80/1, Bawadiya Kalan, Huzur, Gulmohar Colony, Bhopal",12noon – 11:30pm,+918208605218,3.9,9,-,1
Swastik Pure Veg Restaurant,"BHEL, Bhopal","North Indian, Chinese, South Indian, Street Food",₹400 for two,https://www.zomato.com/bhopal/swastik-pure-veg-restaurant-1-bhel/info,Bhopal,"Plot 24-B, Indrapuri, BHEL, Bhopal",11am – 11pm,"+919893312891,+917554272257",4.2,718,3.9,11.6K
Hotel Aditya Residency,"Maharana Pratap Nagar, Bhopal","North Indian, South Indian, Charcoal Chicken, Chinese, Pizza, Fast Food, Desserts, Beverages","₹1,000 for two",https://www.zomato.com/bhopal/hotel-aditya-residency-maharana-pratap-nagar/info,Bhopal,"113, Near City Hospital, Zone 2, Maharana Pratap Nagar, Bhopal",8am – 3am,+917898980107,4.2,30,3.9,"1,418"
Chaat Ka Chaska,"Maharana Pratap Nagar, Bhopal","Street Food, North Indian, Fast Food, Chinese, Desserts, Shake, Beverages",₹400 for two,https://www.zomato.com/bhopal/chaat-ka-chaska-maharana-pratap-nagar/info,Bhopal,"House B-41, Plot 175, Zone 2, M P Nagar Maharana Pratap Nagar, Bhopal",10am – 10pm,+918720020066,3.9,8,3.8,105
Al Zam Zam,"Peer Gate Area, Bhopal","North Indian, Fast Food",₹300 for two,https://www.zomato.com/bhopal/al-zam-zam-peer-gate-area/info,Bhopal,"Shop 1- 9, Central Library, Bhart Talkies Road, Peer Gate Area, Bhopal",11am – 2am,+919755108010,3.7,427,3.6,12.6K
Bella Vita Pizzeria,"Gulmohar Colony, Bhopal","Coffee, Italian, Pizza, Tea, Waffle, Pasta, Pancake, Beverages",₹500 for two,https://www.zomato.com/bhopal/bella-vita-pizzeria-gulmohar-colony/info,Bhopal,"Plot 125, Ground Floor, Door Sanchar Colony, Near Bajaj Classes, Gulmohar Colony, Bhopal",12noon – 11pm,+919109604756,3.7,40,3.8,"1,094"
La Pino'z Pizza,"BHEL, Bhopal","Pizza, Fast Food",₹500 for two,https://www.zomato.com/bhopal/la-pinoz-pizza-bhel/info,Bhopal,"11, Indrapuri, Sector B, Raisen Road, BHEL, Bhopal","12midnight – 2am, 10am – 12midnight",+917898000000,-,2,4.0,313
Giani Ice Cream,"Arera Colony, Bhopal","Ice Cream, Shake, Desserts",₹300 for two,https://www.zomato.com/bhopal/giani-ice-cream-arera-colony/info,Bhopal,"Shop G-1, 28, 10 Market E4, Huzur, Arera Colony, Bhopal","12midnight – 3:30am, 10am – 12midnight",+917987715751,3.6,8,3.8,277
Pure,"Radisson - Bhopal Gulmohar Colony, Bhopal","North Indian, Modern Indian, Gujarati, Desserts, Beverages","₹1,800 for two",https://www.zomato.com/bhopal/pure-gulmohar-colony/info,Bhopal,"Opposite Savoy Complex, E8, Bawadiya Kalan, Gulmohar Colony, Bhopal",7pm – 11pm,+919329331017,3.5,6,-,0
The Food By Courtyard,"Maharana Pratap Nagar, Bhopal","North Indian, Shake, Tea, Desserts",₹450 for two,https://www.zomato.com/bhopal/the-food-by-courtyard-1-maharana-pratap-nagar/info,Bhopal,"14/5, Subhas Nagar, Maharana Pratap Nagar, Bhopal",24 Hours,+919399303052,-,2,3.2,70
Chai Nagri,"Maharana Pratap Nagar, Bhopal","Tea, Coffee, Shake, Beverages, Fast Food, Street Food",₹300 for two,https://www.zomato.com/bhopal/chai-nagri-maharana-pratap-nagar/info,Bhopal,"06, Lower ground Floor, Alaknanda Complex, Maharana Pratap Nagar, Bhopal",10:30am – 10:30pm,+917999745674,-,1,New,4
Rajhans Restaurant,"Peer Gate Area, Bhopal","North Indian, South Indian, Chinese, Fast Food, Desserts, Beverages, Pizza",₹500 for two,https://www.zomato.com/bhopal/rajhans-restaurant-peer-gate-area/info,Bhopal,"Mandir Kamali Road, Ghora Nikkas, Near Nadara Bus Stand, Peer Gate Area, Bhopal",8am – 12midnight,"+917554244263,+919109179446",3.8,471,3.9,15.6K
Hotel Ranjit Legacy,"TT Nagar, Bhopal","North Indian, Chinese, Mughlai, Biryani, Continental, Fast Food, Desserts, Beverages","₹1,000 for two",https://www.zomato.com/bhopal/hotel-ranjit-legacy-tt-nagar/info,Bhopal,"139, Malviya Nagar, Near TT Nagar, Bhopal",11am – 11:30pm,+917880001202,3.2,5,4.2,222
Kuber Dairy And Restaurant,"Hoshangabad Road, Bhopal","North Indian, South Indian, Chinese, Continental, Street Food, Desserts, Shake, Beverages","₹1,000 for two",https://www.zomato.com/bhopal/kuber-dairy-and-restaurant-hoshangabad-road/info,Bhopal,"Plot 696-F, Aashirwad Complex, Arvind Vihar, Baag Mungaliya, Hoshangabad Road, Bhopal",8am – 9:30pm,+919111011556,3.9,10,4.1,406
K2 Club & Lounge,"Arera Colony, Bhopal","North Indian, Continental, Desserts, Beverages",₹800 for two,https://www.zomato.com/bhopal/k2-club-lounge-arera-colony/info,Bhopal,"Top Floor, Reliance Fresh Building, Chunabhatti Road, Arera Colony, Bhopal",11am – 11pm,+917724881917,4.0,62,3.9,19
Citrus,"Hoshangabad Road, Bhopal",North Indian,₹350 for two,https://www.zomato.com/bhopal/citrus-hoshangabad-road/info,Bhopal,"Plot 6, Sector C, Vidya Nagar, Opposite Bagsewaniya Police Station, Hoshangabad Road, Bhopal",12:30pm – 11:30pm,+917554224731,3.9,145,3.9,"1,838"
Nature Cottage,"Kajlas, Bhopal","Chinese, Fast Food",₹300 for two,https://www.zomato.com/bhopal/nature-cottage-kajlas/info,Bhopal,"Plaot 2, Badkhedi Kalan, Kerwa Dam Road, Kajlas, Bhopal",11am – 11pm,+919993478444,2.9,34,4.3,100
Danish's Pizza Inn,"TT Nagar, Bhopal","Pizza, Fast Food, Chinese, North Indian",₹500 for two,https://www.zomato.com/bhopal/danishs-pizza-inn-tt-nagar/info,Bhopal,"Opposite Petrol Pump, Yamana Square, Polytechnic Square, Kilol Park, TT Nagar, Bhopal",1pm – 12midnight,+919893298538,4.1,263,4.4,165
Sky 55,"Maharana Pratap Nagar, Bhopal","Continental, Chinese, North Indian, Oriental, Biryani, Desserts, Beverages","₹1,200 for two",https://www.zomato.com/bhopal/sky-55-maharana-pratap-nagar/info,Bhopal,"R-55, Zone-1, Maharana Pratap Nagar, Bhopal",7pm – 11pm,+919111144999,4.0,73,4.3,50
Cafe Elixir,"Maharana Pratap Nagar, Bhopal","Fast Food, Chinese, Shake",₹350 for two,https://www.zomato.com/bhopal/cafe-elixir-maharana-pratap-nagar/info,Bhopal,"188, Zone I, Maharana Pratap Nagar, Bhopal",11am – 11pm,"+919111150570,+919131912838",2.4,16,-,0
Rhythm On Fire,"Hoshangabad Road, Bhopal","North Indian, South Indian, Chinese, Continental, Fast Food, Desserts",₹700 for two,https://www.zomato.com/bhopal/rhythm-on-fire-hoshangabad-road/info,Bhopal,"640, Bagmugaliya Colony, Arvind Vihar, Opposite UCO Bank, Hoshangabad Road, Bhopal",8am – 11pm,"+919300569201,+919424505002",3.9,51,4.1,"1,567"
Mio Amore Cake Shop,"BHEL, Bhopal",Bakery,₹500 for two,https://www.zomato.com/bhopal/mio-amore-cake-shop-1-bhel/info,Bhopal,"Shop 5, Bhagat Singh Market, Indrapuri, BHEL, Bhopal",9:30am – 12midnight,+911169272801,-,0,3.0,405
South Tak,"Arera Colony, Bhopal",South Indian,₹150 for two,https://www.zomato.com/bhopal/south-tak-arera-colony/info,Bhopal,"E-7, Mig 163, Huzur, Arera Colony, Bhopal",8:45am – 10:45pm,+917828946477,3.7,6,4.2,233
Daawat-E-Khas,"JP Nagar, Bhopal","North Indian, Mughlai",₹300 for two,https://www.zomato.com/bhopal/daawat-e-khas-jp-nagar/info,Bhopal,"House 369, Kazi Camp, Berasia Road, Opposite PNT Colony, JP Nagar, Bhopal","12midnight – 4am, 3pm – 12midnight",+917000299107,-,3,4.0,331
Neembry,"TT Nagar, Bhopal",North Indian,₹800 for two,https://www.zomato.com/bhopal/neembry-tt-nagar/info,Bhopal,"Van Vihar Rd, Ppp. Lakeview Nursery, Prempura, TT Nagar, Bhopal","12noon – 3pm, 7:30pm – 11:30pm",+918770452084,3.9,13,-,0
The Mark Hotel And Club,"Hoshangabad Road, Bhopal","Bar Food, North Indian, Chinese, Biryani, Oriental, Continental, Rolls, Beverages","₹1,400 for two",https://www.zomato.com/bhopal/the-mark-hotel-and-club-hoshangabad-road/info,Bhopal,"National Highway 12, Hoshangabad Road, Bhopal",11am – 11pm,"+919425017940,+919425017941",4.8,58,4.0,676
Starbucks Coffee,"DB City, Maharana Pratap Nagar, Bhopal","Cafe, Coffee, Burger, Desserts, Beverages",₹600 for two,https://www.zomato.com/bhopal/starbucks-coffee-maharana-pratap-nagar/info,Bhopal,"Unit G 32A, Ground Floor, Courtyard Marriot, DB City Mall, Arera Hills, Maharana Pratap Nagar, Bhopal",10am – 11pm,+918097497201,3.5,10,3.8,"1,260"
Shri Gurukripa Restaurant,"BHEL, Bhopal","North Indian, South Indian, Chinese, Fast Food, Desserts, Shake, Beverages",₹400 for two,https://www.zomato.com/bhopal/shri-gurukripa-restaurant-1-bhel/info,Bhopal,"Near Shiv Shakti Dham Mandir, Awadhpuri, BHEL, Bhopal",11am – 11pm,+918349002834,-,3,3.9,"1,070"
