Restaurant_Name,Locality,Cuisines,Average_Cost_for_two,Restaurant_Url,City,Address,Available_Time,Contact_Number,Dining_Ratings,Dining_Votes,Delivery_Ratings,Delivery_Votes
Sankalp,"Maharana Pratap Nagar, Bhopal","South Indian, North Indian, Ice Cream, Beverages",₹300 for two,https://www.zomato.com/bhopal/sankalp-maharana-pratap-nagar/info,Bhopal,"3rd Floor, DB City Mall, Food Court, Maharana Pratap Nagar, Bhopal",10am – 10pm,+917556644177,3.9,243,3.9,300
Baker's Castle,"Arera Colony, Bhopal","Bakery, Desserts, Sandwich, Pizza, Beverages",₹450 for two,https://www.zomato.com/bhopal/bakers-castle-arera-colony/info,Bhopal,"E5/33, Near Apex Bank, Arera Colony, Bhopal",11am – 9:30pm,"+919669001788,+917554297877",3.8,151,4.1,370
D-Runch Kitchen Lounge,"Maharana Pratap Nagar, Bhopal","North Indian, Chinese, Italian, Continental, Kebab, Fast Food, Biryani, Beverages","₹1,500 for two",https://www.zomato.com/bhopal/d-runch-kitchen-lounge-maharana-pratap-nagar/info,Bhopal,"Plot 238, Patel Complex, Opposite DB Mall, Maharana Pratap Nagar, Bhopal",Opens tomorrow at 11am,+919589774444,3.8,14,-,0
Cafe Kudos,"Arera Colony, Bhopal","North Indian, Italian, Fast Food, Chinese, Continental, Biryani, Beverages, Salad",₹800 for two,https://www.zomato.com/bhopal/cafe-kudos-arera-colony/info,Bhopal,"MIG 169, 4th Floor, Arera Colony, Bhopal",3pm – 12midnight,+918989660277,2.6,12,3.3,538
F For Fries,"TT Nagar, Bhopal","Fast Food, Finger Food, Beverages",₹300 for two,https://www.zomato.com/bhopal/f-for-fries-1-tt-nagar/info,Bhopal,"129A, Malviya Nagar, TT Nagar, Bhopal",11:30am – 12:30am,"+917554222466,+918827467918",3.8,60,4.1,"1,159"
Olive Green Cafe And Restaurant,"BHEL, Bhopal","Italian, Pizza, Pasta, Burger, Sandwich, Wraps, Waffle, Shake",₹300 for two,https://www.zomato.com/bhopal/olive-green-cafe-and-restaurant-bhel/info,Bhopal,"41, Shop 2, Sagar State, Minal Gate 3, Ayodhya Bypass, BHEL, Bhopal","12midnight – 12:30am, 12:30pm – 12midnight",+919399286679,-,0,4.3,35
Darbar E Khas,"Jhangirabad, Bhopal","Biryani, North Indian, Mughlai, Chinese, Kebab, Seafood",₹550 for two,https://www.zomato.com/bhopal/darbar-e-khas-jhangirabad/info,Bhopal,"Shop 1, B-1, Ground Floor, Hinotiya Kachiyan, Jhangirabad, Bhopal",1pm – 11pm,+918871263101,3.9,4,4.3,853
Milan Restaurant,"Maharana Pratap Nagar, Bhopal","North Indian, South Indian, Fast Food, Chinese, Street Food, Desserts",₹400 for two,https://www.zomato.com/bhopal/milan-restaurant-maharana-pratap-nagar/info,Bhopal,"189, Zone 1, Maharana Pratap Nagar, Bhopal",12midnight – 10:30pm,"+916232502023,+917552576445",2.6,8,4.0,"8,812"
Arpit's Rivaayat,"Arera Colony, Bhopal",Biryani,₹600 for two,https://www.zomato.com/bhopal/arpits-rivaayat-arera-colony/info,Bhopal,"36/1, Narayan Nagar, Arera Colony, Bhopal",1pm – 11:30pm,+917000193253,4.4,221,4.4,"1,757"
Fantasy Bakery Shop,"TT Nagar, Bhopal",Bakery,₹300 for two,https://www.zomato.com/bhopal/fantasy-bakery-shop-tt-nagar/info,Bhopal,"4/48, New Market, TT Nagar, Bhopal",9:15am – 11pm,+918989118463,3.8,89,4.4,"1,681"
Shagun's Restaurant,"Peer Gate Area, Bhopal","North Indian, Chinese, Fast Food",₹700 for two,https://www.zomato.com/bhopal/shaguns-restaurant-peer-gate-area/info,Bhopal,"Hotel Shagun 7, Hawa Mahal Road, Near Peer Gate Area, Bhopal",9am – 10pm,"+918224083333,+917554205250",4.0,94,3.7,"1,342"
Fitoor,"Gulmohar Colony, Bhopal","North Indian, Chinese, Mughlai, Kebab, Biryani",₹700 for two,https://www.zomato.com/bhopal/fitoor-gulmohar-colony/info,Bhopal,"Shop 26/27, Ground Floor, Shiva Royal Court, Bawadiya Kala, Gulmohar Colony, Bhopal",10am – 11:30pm,+919009992273,3.7,14,4.1,"1,134"
The Barni House,"Gulmohar Colony, Bhopal","North Indian, Chinese, Shake, Pizza, Pasta, Burger, Sandwich, Beverages","₹1,000 for two",https://www.zomato.com/bhopal/the-barni-house-gulmohar-colony/info,Bhopal,"G-1/109, 3rd Floor, Ajay Complex, Near Aura Mall, Gulmohar Colony, Bhopal",12noon – 11pm,"+917400556969,+917554933466",3.9,98,4.0,255
Caffeine Mug,"BHEL, Bhopal","Fast Food, Beverages, Sichuan",₹400 for two,https://www.zomato.com/bhopal/caffeine-mug-bhel/info,Bhopal,"Plot 2, Indrapuri, Sector C, Near Siya Girls Hostel, BHEL, Bhopal",12:30pm – 9:30pm,+918982750607,3.9,5,4.0,136
Green House Bistro,"TT Nagar, Bhopal","Cafe, Fast Food, Continental, Desserts, Beverages",₹800 for two,https://www.zomato.com/bhopal/green-house-bistro-tt-nagar/info,Bhopal,"Jehan Numa Retreat Club & Spa, Vanvihar Road, Near Van Vihar, Prempura, TT Nagar, Bhopal",Opens tomorrow at 11am,"+919981122282,+917556606600,+917006235335",4.6,48,-,0
Khan Sahab Xpress,"Maharana Pratap Nagar, Bhopal","North Indian, Mughlai",₹350 for two,https://www.zomato.com/bhopal/khan-sahab-xpress-maharana-pratap-nagar/info,Bhopal,"Shop 4, KK Plaza, Zone 2, Maharana Pratap Nagar, Bhopal",1pm – 11pm,"+917554948666,+919584222666",3.7,79,3.9,"3,402"
Bread and Better Café,"Gulmohar Colony, Bhopal","Italian, Fast Food, Street Food, Beverages",₹300 for two,https://www.zomato.com/bhopal/bread-and-better-café-gulmohar-colony/info,Bhopal,"Plot 2, Door, E/8 Extension, Gulmohar Colony, Bhopal",11:30am – 10:30pm,+918816815251,3.2,12,4.3,110
Shri Gurukripa Restaurant,"BHEL, Bhopal","North Indian, Biryani",₹400 for two,https://www.zomato.com/bhopal/shri-gurukripa-restaurant-bhel/info,Bhopal,"Shop 9, Nagam Nigam Complex, A Apoorti Mall, BHEL, Bhopal",11am – 11pm,+917470802834,3.0,11,4.0,33.9K
Shikha Greens,"Kolar, Bhopal","North Indian, Pizza","₹1,000 for two",https://www.zomato.com/bhopal/shikha-greens-kolar/info,Bhopal,"110/7, Chuna Bhatti, Kolar, Bhopal",11:30am – 12midnight,+917771888025,-,0,2.1,9
Mezbaan Bhopal,"Jhangirabad, Bhopal","North Indian, Mughlai",₹500 for two,https://www.zomato.com/bhopal/mezbaan-bhopal-jhangirabad/info,Bhopal,"11-12, Ameen Manzil, Opposite Lower Lake, Jhangirabad, Bhopal",12noon – 11pm,+917554904486,4.1,278,4.0,"9,663"
Nothing Before Coffee,"Gulmohar Colony, Bhopal","Beverages, Shake, Coffee, Tea, Street Food, Desserts",₹300 for two,https://www.zomato.com/bhopal/nothing-before-coffee-gulmohar-colony/info,Bhopal,"G-2/HDB, Arcade Doors, Sanchar Nagar, Bawadiya Kalan, Gulmohar Colony, Bhopal",9am – 11:30pm,+918269700703,-,2,4.2,232
Merhaba,"Kohefiza, Bhopal",Fast Food,₹250 for two,https://www.zomato.com/bhopal/merhaba-2-kohefiza/info,Bhopal,"C-196, Shop G-1, Lake Breeze Apartment, BDA Colony, Kohefiza, Bhopal",2:30pm – 12midnight,+918839355059,3.9,14,4.4,358
The Belgian Waffle Co.,"Maharana Pratap Nagar, Bhopal","Waffle, Pancake, Ice Cream, Desserts, Beverages",₹300 for two,https://www.zomato.com/bhopal/the-belgian-waffle-co-maharana-pratap-nagar/info,Bhopal,"3rd Floor, DB City Mall, Maharana Pratap Nagar, Bhopal",12noon – 10:30pm,+919203000123,3.5,55,4.2,"3,894"
The Social Eatery,"Arera Colony, Bhopal","North Indian, Fast Food, Beverages, Chinese, Sichuan",₹500 for two,https://www.zomato.com/bhopal/the-social-eatery-arera-colony/info,Bhopal,"E-3/75, Arera Colony, Bhopal",12:30pm – 11pm,+919893866666,4.0,19,3.2,6
Mewad Soda,"Maharana Pratap Nagar, Bhopal","Shake, Beverages, Desserts",₹150 for two,https://www.zomato.com/bhopal/mewad-soda-maharana-pratap-nagar/info,Bhopal,"Shop 12, Multilevel Parking, Zone 1, Maharana Pratap Nagar, Bhopal",12:15pm – 11:15pm,+919827466143,3.1,11,4.2,442
Kanha Fast Food & Restaurant,"Hoshangabad Road, Bhopal","Rolls, North Indian, Pizza, Chinese, Fast Food, Street Food, Desserts, Beverages",₹300 for two,https://www.zomato.com/bhopal/kanha-fast-food-restaurant-hoshangabad-road/info,Bhopal,"7, B/6, Surendra Land Mark, Hoshangabad Road, Bhopal",11:30am – 11:30pm,+919685432802,3.9,6,3.7,307
Punjabi Touch,"Hoshangabad Road, Bhopal","North Indian, Mughlai",₹550 for two,https://www.zomato.com/bhopal/punjabi-touch-1-hoshangabad-road/info,Bhopal,"Shop 1 & 2, Golden Steel Compound, Hoshangabad Road, Bhopal","12midnight – 2am, 3pm – 12midnight",+918103335333,3.4,5,3.8,32
Mist Restro & Lounge,"Maharana Pratap Nagar, Bhopal","North Indian, Chinese, Fast Food, Beverages, Desserts, Mughlai, Sichuan","₹1,000 for two",https://www.zomato.com/bhopal/mist-restro-lounge-maharana-pratap-nagar/info,Bhopal,"B-59, Kasturba Nagar, Near Chetak Bridge, Maharana Pratap Nagar, Bhopal",11am – 10pm,+917898888835,3.3,5,3.8,157
Loli Mumbai Vada Pav,"Arera Colony, Bhopal","Fast Food, Momos, Shake, Sichuan",₹100 for two,https://www.zomato.com/bhopal/loli-mumbai-vada-pav-arera-colony/info,Bhopal,"Shop 1, Phool Market, 10 Number Market, Arera Colony, Bhopal",12noon – 11pm,+917471122225,3.1,23,4.0,"1,036"
Cake Adda,"BHEL, Bhopal",Bakery,₹500 for two,https://www.zomato.com/bhopal/cake-adda-3-bhel/info,Bhopal,"Shop 5, Bhagat Singh Market, Indrapuri, BHEL, Bhopal",9:30am – 12midnight,+911169272801,3.9,79,3.1,500
Hotel Avantika Cafe & Restaurant,"Jhangirabad, Bhopal","North Indian, Biryani, South Indian, Chinese, Beverages",₹600 for two,https://www.zomato.com/bhopal/hotel-avantika-cafe-restaurant-jhangirabad/info,Bhopal,"28, Iqbal Colony, 80 Feet Road, Jhangirabad, Bhopal",7:30am – 11pm,"+917869411034,+918595490977",2.9,4,4.2,679
The Flying Saucer,"Maharana Pratap Nagar, Bhopal","Continental, Fast Food, Mexican","₹1,000 for two",https://www.zomato.com/bhopal/the-flying-saucer-maharana-pratap-nagar/info,Bhopal,"Flat 09 To Flat 12, 1st Floor, Bansal One Building, Maharana Pratap Nagar, Bhopal",,+919111777061,-,0,-,0
Sukoon Cafe,"Maharana Pratap Nagar, Bhopal","North Indian, Chinese, Italian, Fast Food, Rolls, Sandwich, Desserts, Beverages",₹500 for two,https://www.zomato.com/bhopal/sukoon-cafe-maharana-pratap-nagar/info,Bhopal,"Plot 146, Basement, Premium Centre, Ram Gopal Maheshwari Marg, Zone -1, Maharana Pratap Nagar, Bhopal",11am – 11:30pm,"+917554001212,+919630066636",3.7,193,3.7,303
Sharma And Vishnu Fast Food - Katara Hills,"Habib Ganj, Bhopal","North Indian, Chinese, South Indian, Fast Food, Pasta, Sandwich, Shake, Beverages",₹400 for two,https://www.zomato.com/bhopal/sharma-and-vishnu-fast-food-katara-hills-habib-ganj/info,Bhopal,"HIG 317 A, Ground Floor, Baag Mungaliya Extension, Housing Board Colony, Habib Ganj, Bhopal",9am – 11pm,+918962750410,-,3,4.0,"1,249"
Anni Bhai ki Biryani,"JP Nagar, Bhopal",Biryani,₹250 for two,https://www.zomato.com/bhopal/anni-bhai-ki-biryani-jp-nagar/info,Bhopal,"Shop 1, Qazi Camp, Next to Taj Studio, JP Nagar, Bhopal","12midnight – 5am, 9am – 12midnight","+918871691565,+917987938266",4.2,714,4.3,15K
The Taste Capital,"TT Nagar, Bhopal","Chinese, North Indian, Seafood, Mughlai, Thai, Biryani, Salad","₹1,000 for two",https://www.zomato.com/bhopal/the-taste-capital-tt-nagar/info,Bhopal,"1, Ground Floor, Harshwardhan Nagar, Manit Road, TT Nagar, Bhopal",12noon – 10:45pm,+917489958012,3.7,12,3.9,127
White Shack,"Habib Ganj, Bhopal","Fast Food, Sandwich",₹350 for two,https://www.zomato.com/bhopal/white-shack-3-habib-ganj/info,Bhopal,"Saket Nagar, 80 Feet Koral Road, Habib Ganj, Bhopal",2pm – 11pm,+917880111622,3.8,16,3.7,7
Hotel Sarthak,"TT Nagar, Bhopal","North Indian, Chinese, Sichuan",₹550 for two,https://www.zomato.com/bhopal/hotel-sarthak-1-tt-nagar/info,Bhopal,"37, Malviya Nagar, New Market, TT Nagar, Bhopal",11:30am – 10:45pm,"+917554023200,+919190972351",4.2,32,4.1,528
Food Nation,"Peer Gate Area, Bhopal",Fast Food,₹200 for two,https://www.zomato.com/bhopal/food-nation-1-peer-gate-area/info,Bhopal,"House 48 A, Neem Road, Immami Gate, Peer Gate Area, Bhopal",3:15pm – 11:30pm,+919669089848,3.9,8,4.1,974
Narmada Canteen,"Arera Colony, Bhopal","North Indian, Fast Food, Mithai",₹250 for two,https://www.zomato.com/bhopal/narmada-canteen-4-arera-colony/info,Bhopal,"E 3/24, Arera Colony, Bhopal","12:15am – 6:30am, 7am – 11:45pm",+919009500033,3.6,28,3.7,"6,804"
Marhaba,"Peer Gate Area, Bhopal",Fast Food,₹250 for two,https://www.zomato.com/bhopal/marhaba-peer-gate-area/info,Bhopal,"30, Thana Road, Shahjahanabad, Peer Gate Area, Bhopal",3pm – 11pm,+918839359898,4.1,193,4.2,"3,689"
Dharni's Food,"Gulmohar Colony, Bhopal","North Indian, South Indian, Chinese, Street Food, Fast Food, Desserts, Shake, Beverages",₹300 for two,https://www.zomato.com/bhopal/dharnis-food-gulmohar-colony/info,Bhopal,"S 2, 3, 4, Shree Sai Arcade, Bawadiya Kalan, Gulmohar Colony, Bhopal",12noon – 10:30pm,"+919303131282,+916262600033,+916262999292",4.0,28,4.1,406
Mokachi Cafe,"Kajlas, Bhopal","Cafe, North Indian, Continental, Fast Food, Chinese, Shake, Beverages",₹800 for two,https://www.zomato.com/bhopal/mokachi-cafe-kajlas/info,Bhopal,"Khuda Ganj, Kerwa Dam Road, Near National Law Instititute University, Kajlas, Bhopal",12noon – 11pm,"+917024100200,+917024117780",3.5,105,-,0
PA Se Paratha,"TT Nagar, Bhopal","North Indian, Street Food",₹250 for two,https://www.zomato.com/bhopal/pa-se-paratha-tt-nagar/info,Bhopal,"129/A, FMPCCI Building, Malviya Nagar, Near TT Nagar, Bhopal",9:30am – 11:30pm,+919168078638,4.0,58,4.3,"2,829"
Veg Protein Soya Chaap Corner,"Gulmohar Colony, Bhopal","North Indian, Rolls",₹300 for two,https://www.zomato.com/bhopal/veg-protein-soya-chaap-corner-gulmohar-colony/info,Bhopal,"Shop 3, Ground Floor, Green City Mall Block, Bawadiya Kalan, Gulmohar Colony, Bhopal",2:30pm – 12midnight,+917987108650,3.9,15,4.0,930
Raju Tea Stall,"Peer Gate Area, Bhopal","Street Food, Beverages",₹100 for two,https://www.zomato.com/bhopal/raju-tea-stall-peer-gate-area/info,Bhopal,"123, Ground Floor, Anapuran Building, Ambedkar Library, Sultania Road, Fatehgarh, Peer Gate Area, Bhopal",7am – 12midnight,+919111557665,4.2,177,4.4,323
Sawariya Bakery & Fast Food,"TT Nagar, Bhopal","Fast Food, Chinese, South Indian, North Indian",₹250 for two,https://www.zomato.com/bhopal/sawariya-bakery-fast-food-tt-nagar/info,Bhopal,"Shop 16, Jain Tower, Nehru Nagar, TT Nagar, Bhopal",10am – 12midnight,+919755555629,4.0,216,3.6,10.5K
The Momo Jojo,"Airport Area, Bhopal","Chinese, Momos, Kebab, North Indian, Biryani, Shake",₹350 for two,https://www.zomato.com/bhopal/the-momo-jojo-airport-area/info,Bhopal,"Shop 4, City Chaupati, Lalghati Chauraha, Airport Area, Bhopal",2:30pm – 11pm,+919111011139,3.4,18,4.1,"1,948"
Dippy's Café,"Maharana Pratap Nagar, Bhopal","Fast Food, Beverages",₹300 for two,https://www.zomato.com/bhopal/dippys-café-1-maharana-pratap-nagar/info,Bhopal,"Shop 1, LIG 64, Maharana Pratap Nagar, Bhopal",11:45am – 10:30pm,+919993336868,3.5,8,4.1,44
Edhas Cafe & Restro,"Gulmohar Colony, Bhopal","North Indian, Chinese","₹1,000 for two",https://www.zomato.com/bhopal/edhas-cafe-restro-gulmohar-colony/info,Bhopal,"Shop 106/107, Bawadiya Kalan, Gulmohar Colony, Bhopal","12midnight – 4am, 12noon – 11:45pm",+917987375809,New,0,4.0,18
Bhopali Express,"Jhangirabad, Bhopal","North Indian, Chinese, Mughlai","₹1,000 for two",https://www.zomato.com/bhopal/bhopali-express-2-jhangirabad/info,Bhopal,"Hotel Lake View Campus, Shymala Hills, Jhangirabad, Bhopal","12noon – 3pm, 7pm – 11pm",+918770104997,3.7,12,4.0,25
New Sukh Sagar Restaurant,"Arera Colony, Bhopal","North Indian, South Indian, Chinese, Fast Food, Pizza, Ice Cream, Shake, Beverages",₹500 for two,https://www.zomato.com/bhopal/new-sukh-sagar-restaurant-arera-colony/info,Bhopal,"E 5/33, E5, Arera Colony, Bhopal",11:15am – 11pm,+917554937299,3.9,144,4.0,"5,681"
Moksh,"Kohefiza, Bhopal",North Indian,₹500 for two,https://www.zomato.com/bhopal/moksh-kohefiza/info,Bhopal,"T-A3 & T-A4, Third Floor, Stc Palm Square, Kohefiza, Bhopal","12midnight – 3:30am, 3pm – 12midnight","+918827604444,+918305107106",3.8,176,4.1,"2,725"
Swad Ghar Ka,"BHEL, Bhopal","North Indian, South Indian",₹100 for two,https://www.zomato.com/bhopal/swad-ghar-ka-bhel/info,Bhopal,"131, A- Sector, Sonagiri, BHEL, Bhopal",,"+919179708933,+919179701633",4.5,95,4.1,846
Jameel Hotel - Since 1947,"Peer Gate Area, Bhopal",North Indian,₹250 for two,https://www.zomato.com/bhopal/jameel-hotel-since-1947-peer-gate-area/info,Bhopal,"24, Gali 1, Ibrahimpura, Peer Gate Area, Bhopal",2pm – 12midnight,+919630222271,4.0,414,3.9,372
Spicy Affair,"Peer Gate Area, Bhopal","North Indian, Chinese, Beverages",₹700 for two,https://www.zomato.com/bhopal/spicy-affair-peer-gate-area/info,Bhopal,"Emami Gate Square Hamidia Road, Peer Gate Area, Bhopal",10am – 10pm,+919009332277,4.9,28,-,0
Yuvraj Dhaba,"BHEL, Bhopal","North Indian, Biryani, Mughlai, Seafood",₹400 for two,https://www.zomato.com/bhopal/yuvraj-dhaba-bhel/info,Bhopal,"Plot 2, Opposite Sagar Estate, Ayodhya Bypass Road, BHEL, Bhopal",11am – 12midnight,+918770285821,4.0,285,3.8,"9,163"
South Indian Masala Dosa,"Arera Colony, Bhopal",South Indian,₹200 for two,https://www.zomato.com/bhopal/south-indian-masala-dosa-arera-colony/info,Bhopal,"Shop 149, E-4, Arera Colony, Bhopal",9am – 10pm,+919009876892,4.0,82,4.2,"2,045"
R. K. Udippi Restaurant,"JP Nagar, Bhopal","North Indian, South Indian, Chinese, Fast Food","₹1,000 for two",https://www.zomato.com/bhopal/r-k-udippi-restaurant-jp-nagar/info,Bhopal,"House 1, Pushpa Nagar, 80 Fit Road, Ashoka Garden, JP Nagar, Bhopal",9am – 11pm,"+917869574680,+919981597876",4.0,117,3.9,"9,533"
Hot N Spicy,"TT Nagar, Bhopal","North Indian, Mughlai, Seafood",₹300 for two,https://www.zomato.com/bhopal/hot-n-spicy-tt-nagar/info,Bhopal,"Shop 5, 6 Masjid Narul Islam, Mata Mandir Chouraha, Opposite Nagar Nigam Office, TT Nagar, Bhopal",3pm – 11pm,"+918839722308,+918962175558",4.1,135,3.8,"4,711"
Prakash Family Restaurant,"Aashima Mall, Hoshangabad Road, Bhopal","North Indian, Chinese, Mughlai, Beverages",₹450 for two,https://www.zomato.com/bhopal/prakash-family-restaurant-hoshangabad-road/info,Bhopal,"Ganesh Nagar, Opposite Asha Mall, Hoshangabad Road, Bhopal","12midnight – 1:30am, 11:30am – 12midnight","+919039879767,+917554922451",3.5,34,3.7,"1,163"
Danish Ice Cream,"TT Nagar, Bhopal","Desserts, Ice Cream",₹300 for two,https://www.zomato.com/bhopal/danish-ice-cream-tt-nagar/info,Bhopal,"Shop 1, Opposite Kilol Park Petrol Pump, Kamla Park Road, TT Nagar, Bhopal",11am – 12midnight,+919893298538,3.8,108,-,0
Sharma Bhojnalaya,"JP Nagar, Bhopal","Chinese, South Indian, Fast Food, North Indian, Street Food",₹400 for two,https://www.zomato.com/bhopal/sharma-bhojnalaya-jp-nagar/info,Bhopal,"148 B, Green Park Colony, Berasia Road, JP Nagar, Bhopal",11am – 11pm,"+919039770666,+919340443839",3.6,17,4.1,559
Tilak’s Daawat 24x7,"Maharana Pratap Nagar, Bhopal","North Indian, Chinese, Biryani, South Indian, Seafood, Desserts, Beverages","₹1,000 for two",https://www.zomato.com/bhopal/tilaks-daawat-24x7-maharana-pratap-nagar/info,Bhopal,"197, Obedulla Ganj Road, Zone-2, Maharana Pratap Nagar, Bhopal",9am – 1am,"+917803880808,+919893973629",3.9,324,3.9,15.7K
Food Craft Restaurant,"Kolar, Bhopal","North Indian, South Indian, Kebab, Chinese, Pizza, Pasta, Desserts, Shake",₹500 for two,https://www.zomato.com/bhopal/food-craft-restaurant-kolar/info,Bhopal,"C 8, Mandakani Society, Main Road, Kolar, Bhopal",9:15am – 11:45pm,"+917554056498,+917898780508",3.8,243,4.0,"7,029"
Chappan Bhog,"Gulmohar Colony, Bhopal","North Indian, South Indian, Street Food, Chinese, Beverages, Mithai, Fast Food",₹250 for two,https://www.zomato.com/bhopal/chappan-bhog-gulmohar-colony/info,Bhopal,"10, Kolar Castle, Kolar Road, Gulmohar Colony, Bhopal",8am – 10:30pm,"+917552423423,+919575584428",3.7,132,3.7,"9,897"
Kundan Namkeen Center,"Peer Gate Area, Bhopal","Mithai, Street Food",₹300 for two,https://www.zomato.com/bhopal/kundan-namkeen-center-peer-gate-area/info,Bhopal,"House 1, Lane 2, Ghoda Nikkas, Mangalwara Road, Peer Gate Area, Bhopal",11am – 10pm,"+917552744228,+916267335445",4.1,157,4.2,"7,953"
Chandra's The Fine Dine Family Restaurant,"Jhangirabad, Bhopal","Bakery, Street Food",₹350 for two,https://www.zomato.com/bhopal/chandras-the-fine-dine-family-restaurant-jhangirabad/info,Bhopal,"House 12 A, New Ashoka Garden, Jhangirabad, Bhopal",11:30am – 11pm,+919691625756,3.6,14,4.3,91
New Indian Coffee House,"BHEL, Bhopal","North Indian, Chinese, South Indian",₹300 for two,https://www.zomato.com/bhopal/new-indian-coffee-house-bhel/info,Bhopal,"13 B, Indrapuri, BHEL, Bhopal",11am – 11pm,+917552683041,3.9,67,3.6,"6,836"
Shankar Hotel,"Arera Colony, Bhopal","North Indian, Chinese",₹300 for two,https://www.zomato.com/bhopal/shankar-hotel-arera-colony/info,Bhopal,"117, BDA Complex, Stop 7, Arera Colony, Bhopal",11am – 12midnight,+919893521519,3.7,125,4.0,"2,075"
A2Y Calories,"Gulmohar Colony, Bhopal","Fast Food, Healthy Food, Roast Chicken, Salad, Beverages, Juices",₹200 for two,https://www.zomato.com/bhopal/a2y-calories-1-gulmohar-colony/info,Bhopal,"House 7, Ground Floor, Siddharth Garden Gulmohar Extension, Gulmohar Colony, Bhopal",9am – 12midnight,+917746945306,3.9,92,4.3,"6,023"
Madina Restaurant,"BHEL, Bhopal","North Indian, Chinese, Mughlai, Biryani",₹700 for two,https://www.zomato.com/bhopal/madina-restaurant-bhel/info,Bhopal,"Main, Raisen Road, Hazrat Nizamuddin Colony, Sector B, Ayodhya Nagar, BHEL, Bhopal",12noon – 11pm,+917556007080,4.2,248,3.8,"7,192"
Joginder Punjabi Dhaba,"Jhangirabad, Bhopal",North Indian,₹400 for two,https://www.zomato.com/bhopal/joginder-punjabi-dhaba-jhangirabad/info,Bhopal,"Shop 1, Amrit Complex, Ashoka Garden, Near Prabhat Petrol Pump, Jhangirabad, Bhopal",12noon – 11pm,+917441111189,3.9,81,4.1,"2,415"
BBQ Corner,"Kolar, Bhopal","BBQ, North Indian",₹300 for two,https://www.zomato.com/bhopal/bbq-corner-kolar/info,Bhopal,"Shop. 1, Fine Campus, Opposite SBI Nayapura, Near Anupam Hospital, Kolar, Bhopal",11am – 11:30pm,+917000649224,4.1,124,3.7,"4,304"
Cafe InfiniTea,"Jhangirabad, Bhopal","Salad, Chinese, Pasta, Burger, Wraps, Sandwich, Street Food, Fast Food",₹450 for two,https://www.zomato.com/bhopal/cafe-infinitea-jhangirabad/info,Bhopal,"20/5, Zawabit Line, Neelam Colony, Jhangirabad, Bhopal",11am – 4am,"+919893168687,+919594840936",3.5,33,3.9,866
Cream Dream,"Kohefiza, Bhopal","Ice Cream, Waffle, Desserts",₹250 for two,https://www.zomato.com/bhopal/cream-dream-kohefiza/info,Bhopal,"A-3 Housing Board Colony Kohefiza, Bhopal",12:30pm – 10:30pm,+919752568008,4.1,148,3.7,"1,197"
Tao Bao,"Gulmohar Colony, Bhopal","Korean, Momos, Bubble Tea, Shake, Beverages",₹600 for two,https://www.zomato.com/bhopal/tao-bao-gulmohar-colony/info,Bhopal,"11, Amaltas Green City, Opposite Aura Mall, Gulmohar Colony, Bhopal",12noon – 12midnight,+919893887199,2.6,12,3.5,308
Murga On Wheels,"BHEL, Bhopal","North Indian, Mughlai, Biryani, Chinese, Fast Food",₹500 for two,https://www.zomato.com/bhopal/murga-on-wheels-4-bhel/info,Bhopal,"Shop 01, Ravi Apartment, Sector A, BHEL, Bhopal","12midnight – 2am, 1pm – 11:45pm",+919039759379,3.6,7,4.1,540
BFF- Bhopal Food Factory,"JP Nagar, Bhopal","Sandwich, Pizza, Pasta, Momos, Fast Food, Beverages, Shake, South Indian",₹300 for two,https://www.zomato.com/bhopal/bff-bhopal-food-factory-jp-nagar/info,Bhopal,"Shop 1, Ashirwad Complex, Karond Chouraha, JP Nagar, Bhopal",10am – 10pm,"+917773801550,+917000392941",4.3,275,3.9,14K
Top N Town,"Arera Colony, Bhopal","Ice Cream, Desserts",₹200 for two,https://www.zomato.com/bhopal/top-n-town-1-arera-colony/info,Bhopal,"Shop E 4/23, Market 10, Arera Colony, Bhopal",11am – 11pm,+918602661061,3.7,35,4.2,56
Gurunanak Punjabi Dhaba,"Kohefiza, Bhopal",North Indian,₹350 for two,https://www.zomato.com/bhopal/gurunanak-punjabi-dhaba-kohefiza/info,Bhopal,"Lal Ghati, Opposite HP Petrol Pump, Kohefiza, Bhopal",2pm – 10:30pm,+919981342304,4.1,208,4.0,"2,368"
Gaagar,"Maharana Pratap Nagar, Bhopal","Mithai, Street Food",₹250 for two,https://www.zomato.com/bhopal/gaagar-maharana-pratap-nagar/info,Bhopal,"12 & 11, Jyoti Cinema Complex, Zone 1, Maharana Pratap Nagar, Bhopal",9am – 9:30pm,"+917554256151,+918982898378,+918959819079",3.9,41,4.5,"1,053"
A-One Fast Food,"Kohefiza, Bhopal","Fast Food, North Indian",₹300 for two,https://www.zomato.com/bhopal/a-one-fast-food-2-kohefiza/info,Bhopal,"C 135, BDA Colony, Kohefiza, Bhopal",3pm – 9:30pm,"+919826113260,+919300133538",4.2,194,4.2,"8,496"
Goldmine Bar,"Arera Colony, Bhopal","Kebab, North Indian, Mughlai, Chinese, Finger Food, Desserts",₹600 for two,https://www.zomato.com/bhopal/goldmine-bar-arera-colony/info,Bhopal,"East-3, Unnamed Road, Arera Colony, Bhopal",10am – 1am,+917554939690,4.0,33,-,3
Baniya Bawarchi,"Gulmohar Colony, Bhopal","North Indian, South Indian, Chinese, Beverages",₹400 for two,https://www.zomato.com/bhopal/baniya-bawarchi-3-gulmohar-colony/info,Bhopal,"G-09, Shri Maruti Nandan Complex, Sahyog Vihar, Bawadiya Kalan, Gulmohar Colony, Bhopal",10am – 11:15pm,+917049223213,3.4,6,3.5,83
Regenta Place,"Maharana Pratap Nagar, Bhopal","North Indian, Mughlai, Italian, Oriental, Seafood, Fast Food","₹1,600 for two",https://www.zomato.com/bhopal/regenta-place-maharana-pratap-nagar/info,Bhopal,"Plot-2, ISBT Commercial Campus, Maharana Pratap Nagar, Bhopal",12:30pm – 10:30pm,+919109974488,-,1,-,0
Merhaba,"Peer Gate Area, Bhopal",Fast Food,₹200 for two,https://www.zomato.com/bhopal/merhaba-peer-gate-area/info,Bhopal,"Shop 50, Unani Shafakhana Road, Near Masjid Yaqoob Kha, Peer Gate Area, Bhopal","12midnight – 4am, 2:30pm – 12midnight",+917869558786,-,0,4.3,899
Wind And Waves,"TT Nagar, Bhopal","North Indian, Chinese, Continental, Beverages, Desserts","₹1,000 for two",https://www.zomato.com/bhopal/wind-and-waves-tt-nagar/info,Bhopal,"Lake Driver Road, Near Van Vihar Road, Shymla Hills, TT Nagar, Bhopal",Opens tomorrow at 11am,"+917552661523,+919424796775",3.0,316,4.0,11
Ministry Of Chaaps,"BHEL, Bhopal","North Indian, Chinese, Fast Food, Beverages, Momos",₹400 for two,https://www.zomato.com/bhopal/ministry-of-chaaps-bhel/info,Bhopal,"Shop 1-2, Plot 16, Bhawani Town, Ayodhya Bypass, BHEL, Bhopal",12:30pm – 11pm,+917819917312,3.9,9,4.0,772
