Restaurant_Name,Locality,Cuisines,Average_Cost_for_two,Restaurant_Url,City,Address,Available_Time,Contact_Number,Dining_Ratings,Dining_Votes,Delivery_Ratings,Delivery_Votes
Annpurna Bhojnalaya,"Sanjauli, Shimla",North Indian,₹200 for two,https://www.zomato.com/shimla/annpurna-bhojnalaya-sanjauli/info,Shimla,"Bhatta Kufar, Near SBI Bank, Sanjauli, Shimla",9am – 9:30pm,+919882297398,-,0,-,0
Quick Tandoori Momos,"Longwood, Shimla","Chinese, Momos",₹400 for two,https://www.zomato.com/shimla/quick-tandoori-momos-1-longwood/info,Shimla,"38 - 39/2, The Mall Road, Longwood, Shimla",11am – 7:30pm,+919816928726,-,1,4.1,150
Dawat Restaurant,"Sanjauli, Shimla","North Indian, Chinese",₹200 for two,https://www.zomato.com/shimla/dawat-restaurant-sanjauli/info,Shimla,"Dhalli, Sanjauli, Shimla",7am – 7:30pm,+919418001452,-,0,-,0
Kanwar Dhaba,"Mashobra, Shimla",North Indian,₹200 for two,https://www.zomato.com/shimla/kanwar-dhaba-mashobra/info,Shimla,"1, Baldeyan, Mashobra, Shimla",7am – 9pm,+919857853344,-,0,-,0
Sai Sweets,"Sanjauli, Shimla","Street Food, Mithai",₹150 for two,https://www.zomato.com/shimla/sai-sweets-sanjauli/info,Shimla,"Sanjouli Chowk, Sanjauli, Shimla",7am – 10pm,+919625230000,-,0,-,0
Tamanna Fast Food,"Summer Hill, Shimla","Chinese, Fast Food, North Indian",₹200 for two,https://www.zomato.com/shimla/tamanna-fast-food-summer-hill/info,Shimla,"Shop 3, Near Ambe Book House, Summer Hill, Shimla",9am – 10:30pm,+919805050735,-,0,-,0
City Heart,"Summer Hill, Shimla",Fast Food,₹500 for two,https://www.zomato.com/shimla/city-heart-summer-hill/info,Shimla,"86/1, The Mall, Summer Hill, Shimla",9am – 11pm,+911772807410,-,0,-,0
Papa's Cafe,"Sanjauli, Shimla","Sandwich, Chinese, Burger, Pizza, Shake, Beverages",₹500 for two,https://www.zomato.com/shimla/papas-cafe-sanjauli/info,Shimla,"Dingu Bawri, Sanjauli Bypass Road, Near Dogra Trade Center, Sanjauli, Shimla",10am – 10pm,Not available for this place,-,0,-,0
Keshav Madhav Rasoi,"Longwood, Shimla","North Indian, Chinese, Fast Food, Shake, Beverages",₹450 for two,https://www.zomato.com/shimla/keshav-madhav-rasoi-longwood/info,Shimla,"Jain Hall Middle Bazar, Longwood, Shimla",9am – 10pm,+919816779000,-,0,-,0
Vaishnav Bhojanalay,"Chakkar, Shimla",North Indian,₹200 for two,https://www.zomato.com/shimla/vaishnav-bhojanalay-chakkar/info,Shimla,"Main Bazar, Totu Chowk, Chakkar, Shimla",8am – 10pm,+919882831854,-,0,-,0
Desi Chinese Fast Food Corner,"Sanjauli, Shimla","Chinese, Fast Food",₹200 for two,https://www.zomato.com/shimla/desi-chinese-fast-food-corner-sanjauli/info,Shimla,"Chakrail, Sanjauli, Shimla",8am – 11pm,+917559510007,-,0,-,0
Sky Lark Bhojanalya,"Longwood, Shimla","Chinese, North Indian",₹200 for two,https://www.zomato.com/shimla/sky-lark-bhojanalya-longwood/info,Shimla,"AG Chowk, Longwood, Shimla",10am – 10pm,+919882305609,-,0,-,0
Desi Urban Chai,"Longwood, Shimla","Tea, Fast Food",₹200 for two,https://www.zomato.com/shimla/desi-urban-chai-longwood/info,Shimla,"Mall Road, Longwood, Shimla",10am – 10pm,+917707906860,-,0,-,0
Pirthi's,"Sanjauli, Shimla",Mithai,₹250 for two,https://www.zomato.com/shimla/pirthis-sanjauli/info,Shimla,"Near Shopper Store, Sanjauli Bypass Road, Sanjauli, Shimla",10am – 10pm,Not available for this place,-,0,-,0
Mini Monk Cafe,"Sanjauli, Shimla",North Indian,₹300 for two,https://www.zomato.com/shimla/mini-monk-cafe-sanjauli/info,Shimla,"Lok Sewa Rohru, Sanjauli, Shimla",10am – 10pm,+919805113800,-,0,-,0
Navrattan Restaurant,"Sanjauli, Shimla","North Indian, Chinese","₹1,200 for two",https://www.zomato.com/shimla/navrattan-restaurant-sanjauli/info,Shimla,"Near Tunnel, Majestic Ground, Kufri Road, Dhalli, Sanjauli, Shimla",10am – 10pm,+911772640565,-,0,-,2
Vee Kay's Food Point,"Chakkar, Shimla","Fast Food, Chinese, Finger Food",₹200 for two,https://www.zomato.com/shimla/vee-kays-food-point-chakkar/info,Shimla,"Kenchi More, Airport Road, Totu, Chakkar, Shimla",11am – 11pm,"+919817485505,+917018882796",-,0,-,0
Traditional Food Point,"Chakkar, Shimla","Fast Food, North Indian",₹100 for two,https://www.zomato.com/shimla/traditional-food-point-chakkar/info,Shimla,"205, Power House, Chakkar, Shimla",8am – 9pm,+919816917811,-,0,-,0
The Terrace,"Longwood, Shimla","Cafe, American",₹800 for two,https://www.zomato.com/shimla/the-terrace-longwood/info,Shimla,"Clarkes Hotel, The Mall Road, Longwood, Shimla",7am – 11pm,+911772651010,-,1,-,0
Hotel Grand Majestic,"Summer Hill, Shimla","North Indian, Chinese",₹600 for two,https://www.zomato.com/shimla/hotel-grand-majestic-summer-hill/info,Shimla,"Kufri Road, Kalka Shimla Railway, Dhalli, Summer Hill, Shimla",9am – 10pm,+918988103399,-,0,-,0
Cafe Sid,"Kasumpti, Shimla","North Indian, Chinese",₹400 for two,https://www.zomato.com/shimla/cafe-sid-kasumpti/info,Shimla,"Kasumpti Colony, Shimla Bypass, Kasumpti, Shimla",9am – 10pm,+918219578772,-,0,-,0
Euphoria Grand,"Chakkar, Shimla",North Indian,"₹1,000 for two",https://www.zomato.com/shimla/euphoria-grand-chakkar/info,Shimla,"Rirka, Tutikandi, Chakkar, Shimla",10am – 10pm,+918960600007,-,1,-,0
Cart View Restaurant,"Phagli, Shimla","North Indian, Chinese","₹3,500 for two",https://www.zomato.com/shimla/cart-view-restaurant-phagli/info,Shimla,"Chaura Maidan Road, Phagli, Shimla","7:30am – 10:30pm, 12:30pm – 3pm, 7pm – 10:30pm",+911772804848,-,0,-,0
Loveena Restaurant,"Longwood, Shimla",Fast Food,₹200 for two,https://www.zomato.com/shimla/loveena-restaurant-longwood/info,Shimla,"The Ridge, The Mall Road, Longwood, Shimla",10am – 10pm,+911772812135,-,1,-,0
Nazir's Zayka,"Longwood, Shimla","Chinese, North Indian, Beverages",₹200 for two,https://www.zomato.com/shimla/nazirs-zayka-longwood/info,Shimla,"Shop 1, Ritz Building, The Mall, Longwood, Shimla",8am – 9pm,+919817163569,-,0,-,0
Kamvar Chicken Corners,"Chakkar, Shimla",North Indian,₹400 for two,https://www.zomato.com/shimla/kamvar-chicken-corners-chakkar/info,Shimla,"Totu Chowk, Opposite PNB Bank, Chakkar, Shimla",10am – 8pm,+919817948332,-,0,-,0
Ajay Tea Stall,"Longwood, Shimla","North Indian, Tea",₹200 for two,https://www.zomato.com/shimla/ajay-tea-stall-longwood/info,Shimla,"The Mall Road, Longwood, Shimla",7am – 9pm,+919418126190,-,0,-,0
Bake & Bite,"Sanjauli, Shimla","Bakery, Mithai",₹300 for two,https://www.zomato.com/shimla/bake-bite-sanjauli/info,Shimla,"Shop 3, Housing Board Colony, Near Dogra Trade Centre, Sanjauli, Shimla",8:30am – 10pm,+918219158873,-,0,-,0
Frontier Chat Shop,"Longwood, Shimla","Street Food, Fast Food",₹200 for two,https://www.zomato.com/shimla/frontier-chat-shop-longwood/info,Shimla,"Middle Bazaar, The Mall, Longwood, Shimla",9am – 8pm,+919816809123,-,0,-,0
Riyansh Fast Food Corner,"Kasumpti, Shimla","Chinese, Pasta, Momos",₹250 for two,https://www.zomato.com/shimla/riyansh-fast-food-corner-kasumpti/info,Shimla,"Sector 3, Near New Shimla Bus Stop, Kasumpti, Shimla",11am – 9pm,+918278896607,-,0,-,0
Sharma Bhojnalya,"Phagli, Shimla",North Indian,₹300 for two,https://www.zomato.com/shimla/sharma-bhojnalya-1-phagli/info,Shimla,"Cart Road, Phagli, Shimla",10am – 10pm,+919816789852,-,0,-,0
Deepak Dhaba,"Chakkar, Shimla","North Indian, Chinese",₹200 for two,https://www.zomato.com/shimla/deepak-dhaba-chakkar/info,Shimla,"Taradevi Main Market, Shimla Chandigarh Highway, Chakkar, Shimla",8am – 8pm,"+917018440966,+919418382623",-,0,-,1
Lovely Chicken & Fish Shop,"Longwood, Shimla","Himachali, Seafood",₹300 for two,https://www.zomato.com/shimla/lovely-chicken-fish-shop-longwood/info,Shimla,"Shop 74, Sabzi Mandi, Lower Bazar, Longwood, Shimla",2pm – 9pm,Not available for this place,-,0,-,0
Cardinal Royale Retreat,"Phagli, Shimla","North Indian, Sandwich, Chinese, Pizza, Kebab, Desserts, Beverages",₹600 for two,https://www.zomato.com/shimla/cardinal-royale-retreat-phagli/info,Shimla,"5, Dingle Estate, Near Victory Tunnel, Phagli, Shimla",11:15am – 9:30pm,+919459118105,New,0,New,2
Delhi Darbar,"Sanjauli, Shimla",North Indian,₹550 for two,https://www.zomato.com/shimla/delhi-darbar-sanjauli/info,Shimla,"Dhalli Bypass, Sanjauli, Shimla",9am – 10pm,+918219118129,-,0,-,0
Crazy Bites,"Sanjauli, Shimla","North Indian, Chinese, Street Food",₹200 for two,https://www.zomato.com/shimla/crazy-bites-sanjauli/info,Shimla,"Shop 15, Sheetal Shopping Complex, Near New Hans Jeweller, Sanjauli, Shimla",11am – 10pm,+919817465900,-,0,-,0
Natraj Bar & Restaurant,"Kasumpti, Shimla","Bar Food, Himachali","₹1,000 for two",https://www.zomato.com/shimla/natraj-bar-restaurant-kasumpti/info,Shimla,"Chotta Shimla, Near Lakhanpal General Store, Kasumpti, Shimla",11am – 10pm,Not available for this place,-,0,-,0
Brightland Hotel,"Phagli, Shimla","North Indian, Chinese, Sandwich, Desserts","₹1,400 for two",https://www.zomato.com/shimla/brightland-hotel-1-phagli/info,Shimla,"Cosynook Estate, Adjacent The Mall, Near Army Training Command, Phagli, Shimla",8am – 10pm,+911772803659,-,1,4.0,13
Shiva Food Corner,"Sanjauli, Shimla",North Indian,₹200 for two,https://www.zomato.com/shimla/shiva-food-corner-sanjauli/info,Shimla,"Shop 129, Lakkar Bazar, Sanjauli, Shimla",6am – 10pm,+919625143952,-,0,-,0
Dining Thirteen 17,"Phagli, Shimla",North Indian,₹400 for two,https://www.zomato.com/shimla/dining-thirteen-17-phagli/info,Shimla,"Tasheena Cottage Chowk, Khalini, Phagli, Shimla",11am – 10pm,+919816000070,-,0,-,0
Tibetan Namnas Dhabha,"Panthaghati, Shimla",Chinese,₹200 for two,https://www.zomato.com/shimla/tibetan-namnas-dhabha-panthaghati/info,Shimla,"2nd Tarun Villa Shimla Bypass, Near Tibetian Monestry Panthaghati, Shimla",10am – 10pm,Not available for this place,-,0,-,0
Royal Food Plaza,"Kasumpti, Shimla","North Indian, Chinese",₹400 for two,https://www.zomato.com/shimla/royal-food-plaza-kasumpti/info,Shimla,"BCS, Sector 4 Road, Kasumpti, Shimla",11am – 10pm,+919816167672,-,0,-,0
Prithvichand Amarnath Sweet Shop,"Sanjauli, Shimla","Mithai, Street Food",₹150 for two,https://www.zomato.com/shimla/prithvichand-amarnath-sweet-shop-sanjauli/info,Shimla,"Sanjouli Chowk, Sanjauli, Shimla",7:30am – 9pm,+918918333360,-,0,-,0
Small Victories Mountain Cafe,"Mashobra, Shimla","North Indian, Chinese",₹600 for two,https://www.zomato.com/shimla/small-victories-mountain-cafe-mashobra/info,Shimla,"Mashobra, Sipur, Mashobra, Shimla","8am – 10:30am, 1pm – 3:30pm, 5:30pm – 10:30pm",+918507760776,-,0,-,0
Score: The Vintage Sports Bar,"Longwood, Shimla","North Indian, Continental","₹1,000 for two",https://www.zomato.com/shimla/score-the-vintage-sports-bar-longwood/info,Shimla,"Lower Ground Floor, Hotel Willow Banks, The Mall, Longwood, Shimla",9am – 8pm,+919910170312,-,0,-,0
Sharma Bhojnalya,"Phagli, Shimla",North Indian,₹300 for two,https://www.zomato.com/shimla/sharma-bhojnalya-phagli/info,Shimla,"18, Lal Pani, Phagli, Shimla",7am – 9pm,+917018423391,-,0,-,0
Mahendra Bhai Fast Food,"Summer Hill, Shimla",Chinese,₹100 for two,https://www.zomato.com/shimla/mahendra-bhai-fast-food-1-summer-hill/info,Shimla,"Near Police Chowki, Summer Hill, Shimla",9:30am – 7:30pm,+918679808223,-,0,-,0
Roof Top Cafe,"Kasumpti, Shimla","Chinese, Fast Food, North Indian",₹250 for two,https://www.zomato.com/shimla/roof-top-cafe-kasumpti/info,Shimla,"NH 5, Near Dhalli Tunnel, Kasumpti, Shimla",9am – 11pm,"+919817183884,+917559500040",-,0,-,0
Matta Sher - E - Punjab Dhaba,"Phagli, Shimla",North Indian,₹250 for two,https://www.zomato.com/shimla/matta-sher-e-punjab-dhaba-phagli/info,Shimla,"19, Old Bus Stand, Cart Road, Phagli, Shimla",7am – 11pm,+919817222700,-,0,-,0
Dragon Express,"Longwood, Shimla","Momos, Chinese",₹300 for two,https://www.zomato.com/shimla/dragon-express-longwood/info,Shimla,"Shop 80, Cotton Mary, Lower Bazar, Longwood, Shimla",10am – 10pm,Not available for this place,-,0,-,0
Hungry Head,"Longwood, Shimla","North Indian, Chinese",₹200 for two,https://www.zomato.com/shimla/hungry-head-longwood/info,Shimla,"Near Muscle Gym, Lakkar Bazar, Longwood, Shimla",9am – 10:30pm,+919459521302,-,0,-,0
Sharma Dhaba,"Kasumpti, Shimla","North Indian, Himachali",₹300 for two,https://www.zomato.com/shimla/sharma-dhaba-kasumpti/info,Shimla,"Shop 1, Circular Road, Kasumpti, Shimla",8am – 9pm,Not available for this place,-,0,-,0
Amdo Tibetn Dhabha,"Longwood, Shimla","Tibetan, Chinese",₹300 for two,https://www.zomato.com/shimla/amdo-tibetn-dhabha-longwood/info,Shimla,"Lower Bazar, Longwood, Shimla",10am – 10pm,Not available for this place,-,0,-,0
Pinxx,"Chakkar, Shimla","North Indian, Chinese, Mughlai, Biryani, Desserts, Beverages","₹1,000 for two",https://www.zomato.com/shimla/pinxx-1-chakkar/info,Shimla,"Regenta Place, Near Judicial District Court, Chakkar, Shimla",7:30am – 10pm,+917807799104,-,3,-,0
New India Foods & Sweet Shop,"Sanjauli, Shimla","North Indian, Mithai",₹200 for two,https://www.zomato.com/shimla/new-india-foods-sweet-shop-sanjauli/info,Shimla,"Shop 4, Sanjauli Cemetery Road, Sanjauli, Shimla",9am – 10pm,+919418127424,-,0,-,0
Sharma Sweets,"Longwood, Shimla","Mithai, Street Food",₹300 for two,https://www.zomato.com/shimla/sharma-sweets-longwood/info,Shimla,"Local Bus Stand, Longwood, Shimla",9am – 10pm,+911772657761,-,0,-,1
Raj Kitchen,"Longwood, Shimla","Fast Food, North Indian, Chinese, Desserts, Beverages",₹300 for two,https://www.zomato.com/shimla/raj-kitchen-longwood/info,Shimla,"Near KNH Hospital, Longwood, Shimla",7am – 10pm,"+918894640080,+918219268682",-,0,-,0
City Point Bar & Restaurant,"Chakkar, Shimla",Bar Food,"₹1,000 for two",https://www.zomato.com/shimla/city-point-bar-restaurant-chakkar/info,Shimla,"Main Chowk, Totu, Chakkar, Shimla",10am – 10pm,+919816140451,-,0,-,0
Hotel Narayan By Triund Hotels,"Sanjauli, Shimla","North Indian, Chinese, Mughlai",₹500 for two,https://www.zomato.com/shimla/hotel-narayan-by-triund-hotels-sanjauli/info,Shimla,"Narayan Building Tunnel, Bye Pass Kamla Nagar, Sanjauli, Shimla",8am – 11:30pm,+918894372003,-,0,-,1
Dhalli Delight Dhaba,"Sanjauli, Shimla","North Indian, Chinese, Fast Food",₹300 for two,https://www.zomato.com/shimla/dhalli-delight-dhaba-sanjauli/info,Shimla,"Dhalli Chowk, Sanjauli, Shimla",7:30am – 10:30pm,+918351090990,-,2,-,0
Mirchilly,"Longwood, Shimla","Fast Food, Beverages",₹300 for two,https://www.zomato.com/shimla/mirchilly-1-longwood/info,Shimla,"3, Regal Building, Lakkar Bazar, Ridge Sanjauli Road, Longwood, Shimla",10am – 10pm,Not available for this place,-,0,-,0
Puneet Bhojnalya,"Sanjauli, Shimla",North Indian,₹200 for two,https://www.zomato.com/shimla/puneet-bhojnalya-sanjauli/info,Shimla,"Amar Niwas, Near HDFC Bank, Local Bus Stand, Sanjauli, Shimla",8am – 10pm,+919805650009,-,3,-,1
The Food Court,"Longwood, Shimla",Chinese,₹300 for two,https://www.zomato.com/shimla/the-food-court-longwood/info,Shimla,"Shop 31, Anaj Mandi, Longwood, Shimla",9am – 9pm,+918894061280,-,0,-,0
Panwar Jees Sweet Shop & Dhaba,"Kasumpti, Shimla","Mithai, North Indian",₹300 for two,https://www.zomato.com/shimla/panwar-jees-sweet-shop-dhaba-kasumpti/info,Shimla,"Main Chowk, Malyana Dhalli, Kasumpti, Shimla",11am – 11pm,+919805632231,-,0,-,0
New Plaza Restaurant,"Longwood, Shimla","North Indian, Chinese, Mughlai, Seafood, Continental, Desserts, Beverages",₹900 for two,https://www.zomato.com/shimla/new-plaza-restaurant-longwood/info,Shimla,"60/61, Middle Bazaar, The Mall, Longwood, Shimla",Opens tomorrow at 9:30am,+911772655438,4.1,17,3.4,18
Sachin's Dragon Villa,"Longwood, Shimla","North Indian, Chinese",₹500 for two,https://www.zomato.com/shimla/sachins-dragon-villa-longwood/info,Shimla,"Middle Bazaar, The Mall, Longwood, Shimla",Opens tomorrow at 9am,+918894112424,4.3,20,-,0
Sai Khana Khajana,"Phagli, Shimla","North Indian, Chinese",₹300 for two,https://www.zomato.com/shimla/sai-khana-khajana-phagli/info,Shimla,"Ramnagar, Phagli, Shimla",9am – 10pm,Not available for this place,-,0,-,0
Father's Fast Food & Kitchen,"Sanjauli, Shimla","Fast Food, Chinese, Beverages",₹300 for two,https://www.zomato.com/shimla/fathers-fast-food-kitchen-sanjauli/info,Shimla,"12, Tunnel View, Near Public Choice, Sanjauli, Shimla",10am – 10pm,+917773898379,-,0,-,0
Shyamala Juice And Fast Food Corner,"Summer Hill, Shimla","Juices, Beverages",₹200 for two,https://www.zomato.com/shimla/shyamala-juice-and-fast-food-corner-summer-hill/info,Shimla,"Shop 2, Jai Maa Chintapurni Complex, Summer Hill, Shimla",9am – 8pm,+919418583719,-,0,-,0
Dinesh Vaishnav Bhojnalaya,"Chakkar, Shimla",North Indian,₹250 for two,https://www.zomato.com/shimla/dinesh-vaishnav-bhojnalaya-chakkar/info,Shimla,"Totu Chowk, Mandi Road, Chakkar, Shimla",8am – 10pm,+919218777770,-,0,-,0
New Jaswal Bhojanalya,"Longwood, Shimla","Himachali, North Indian",₹200 for two,https://www.zomato.com/shimla/new-jaswal-bhojanalya-longwood/info,Shimla,"Middle Bazar, Longwood, Shimla",9am – 10pm,+919625955185,-,0,-,0
Thakur Bhojanalya,"Phagli, Shimla",North Indian,₹250 for two,https://www.zomato.com/shimla/thakur-bhojanalya-phagli/info,Shimla,"Shop 2, Ram Bazar, Phagli, Shimla",7am – 10pm,+918894502100,-,0,-,0
Dalziel Restaurant,"Longwood, Shimla",North Indian,₹500 for two,https://www.zomato.com/shimla/dalziel-restaurant-longwood/info,Shimla,"The Mall, AG Chowk, Near SBI Main Branch, Longwood, Shimla",9am – 10pm,+911776451306,-,0,-,0
Amazing Chicken Corner,"Phagli, Shimla","North Indian, Biryani",₹450 for two,https://www.zomato.com/shimla/amazing-chicken-corner-phagli/info,Shimla,"Middle Bazar, Near Gunj Bazar, Phagli, Shimla.",8am – 11pm,Not available for this place,-,0,-,0
Sharma Food,"Longwood, Shimla",North Indian,₹200 for two,https://www.zomato.com/shimla/sharma-food-longwood/info,Shimla,"Auckland, Auckland Tunnel, Longwood, Shimla",8am – 10pm,+919625501766,-,0,-,0
Shan - E - Kinnor,"Kasumpti, Shimla",North Indian,₹300 for two,https://www.zomato.com/shimla/shan-e-kinnor-kasumpti/info,Shimla,"Elephant Tower, Bypass Road, Kasumpti, Shimla",6:30am – 9pm,+918679500975,-,0,-,0
D.F.C. Restaurant,"Summer Hill, Shimla","North Indian, Chinese, Shake",₹300 for two,https://www.zomato.com/shimla/d-f-c-restaurant-summer-hill/info,Shimla,"Near Sood Book Binder, Summer Hill, Shimla",10am – 10pm,Not available for this place,-,0,-,0
Sanjay Fast Food,"Chakkar, Shimla","Fast Food, North Indian",₹400 for two,https://www.zomato.com/shimla/sanjay-fast-food-chakkar/info,Shimla,"Near Wine Shop, Boileauganj, Chakkar, Shimla",8am – 11pm,+918219259522,-,0,-,0
Punjabi Zayaka,"Phagli, Shimla",North Indian,₹300 for two,https://www.zomato.com/shimla/punjabi-zayaka-phagli/info,Shimla,"Khalini, Phagli, Shimla",9am – 10pm,+919418560272,-,0,-,0
Om Sai Fast Food,"Longwood, Shimla","Fast Food, Chinese",₹300 for two,https://www.zomato.com/shimla/om-sai-fast-food-longwood/info,Shimla,"Ram Bazar, Longwood, Shimla",10am – 10pm,+919459090130,-,0,-,0
Silver Oak Restaurant,"Longwood, Shimla","North Indian, Continental",₹800 for two,https://www.zomato.com/shimla/silver-oak-restaurant-longwood/info,Shimla,"Near Tourism Lift, The Mall Road, Longwood, Shimla",7am – 10pm,+919816025758,-,2,-,0
New O.K. Dhaba,"Longwood, Shimla",North Indian,₹200 for two,https://www.zomato.com/shimla/new-o-k-dhaba-longwood/info,Shimla,"Middle Bazaar, The Mall, Longwood, Shimla",9am – 10pm,+911772805613,-,1,-,0
Swadisht Bhojnalya,"Longwood, Shimla",North Indian,₹150 for two,https://www.zomato.com/shimla/swadisht-bhojnalya-longwood/info,Shimla,"18, Lakkar Bazar, Longwood, Shimla",8:30am – 8pm,+918988123047,-,1,-,0
South Spice Kitchen,"Longwood, Shimla","South Indian, Chinese, North Indian, Beverages, Shake, Fast Food",₹300 for two,https://www.zomato.com/shimla/south-spice-kitchen-longwood/info,Shimla,"South Spice Kitchen, Near New Sher E Punjab, Bahang, Longwood, Shimla",7:30am – 11pm,+917620037440,-,0,-,0
Banshira Dhaba,"Longwood, Shimla","North Indian, Chinese, Fast Food, Beverages",₹500 for two,https://www.zomato.com/shimla/banshira-dhaba-longwood/info,Shimla,"Commercial Complex, Near ICICI Bank, SDA Complex Road, Longwood, Shimla",10:30am – 9:30pm,+911772629927,-,1,-,0
The Legacy Hotel,"Longwood, Shimla","North Indian, South Indian, Fast Food, Street Food",₹800 for two,https://www.zomato.com/shimla/the-legacy-hotel-longwood/info,Shimla,"Malhotra Bridge, Longwood, Shimla",11am – 9:30pm,+916230008400,-,0,-,0
Tibetan Dhaba,"Longwood, Shimla","Chinese, Tibetan, Tea, Beverages, Momos",₹300 for two,https://www.zomato.com/shimla/tibetan-dhaba-longwood/info,Shimla,"Krishna Nagar, Cart Road, Longwood, Shimla",10am – 10pm,Not available for this place,-,0,-,0
aOne Restaurant,"Sanjauli, Shimla","North Indian, Chinese, Beverages",₹300 for two,https://www.zomato.com/shimla/aone-restaurant-sanjauli/info,Shimla,"Bypass Road, Near Dhalli Chowk, Sanjauli, Shimla",8am – 9:30pm,+919418080808,-,0,-,0
Pacific Food Paradise,"Sanjauli, Shimla","Chinese, North Indian",₹500 for two,https://www.zomato.com/shimla/pacific-food-paradise-sanjauli/info,Shimla,"31, Kairon Complex, Sanjauli, Shimla",9am – 10pm,+918219673228,-,0,-,0
Nibble Paradise,"Chakkar, Shimla",Chinese,₹300 for two,https://www.zomato.com/shimla/nibble-paradise-chakkar/info,Shimla,"Main Bazar, Bus Stand, Toru, Chakkar, Shimla",10am – 9:30pm,+919816017802,-,0,-,0
Amar Sons Refreshment,"Longwood, Shimla",North Indian,₹150 for two,https://www.zomato.com/shimla/amar-sons-refreshment-longwood/info,Shimla,"21/1, Lakkar Bazar, Longwood, Shimla",10am – 10pm,+919418798638,-,0,-,0
Saatvik Sweets,"Longwood, Shimla","Mithai, Desserts, Street Food",₹150 for two,https://www.zomato.com/shimla/saatvik-sweets-longwood/info,Shimla,"Near Lower Bazaar Tunnel, Longwood, Shimla",9am – 10pm,+911772656941,-,2,-,0
Khwaish Eat And Treat,"Chakkar, Shimla","Bakery, Beverages, Chinese, Fast Food",₹300 for two,https://www.zomato.com/shimla/khwaish-eat-and-treat-chakkar/info,Shimla,"Sarla Bhawan Kachighati, Near ICICI ATM, Chakkar, Shimla",9:30am – 8pm,+918988378622,-,0,-,0
Lord's Fast Food,"Kasumpti, Shimla","Fast Food, Chinese, Beverages",₹250 for two,https://www.zomato.com/shimla/lords-fast-food-kasumpti/info,Shimla,"Vishal Mega Mart, Chota Shimla, Near Summer Hill, Shimla, Kasumpti, Shimla",10am – 8pm,+918627048200,-,0,-,0
Quality Fast Food,"Sanjauli, Shimla",Chinese,₹150 for two,https://www.zomato.com/shimla/quality-fast-food-sanjauli/info,Shimla,"Cemetery Road, Sanjauli, Shimla",9am – 9pm,+918350989620,-,2,-,0
Pali Da Dhaba,"Longwood, Shimla",North Indian,₹500 for two,https://www.zomato.com/shimla/pali-da-dhaba-longwood/info,Shimla,"Local Bus Stand, Longwood, Shimla",10am – 11pm,"+911772651113,+918091413000",-,0,-,0
Hotel Ganga,"Longwood, Shimla","North Indian, Chinese",₹300 for two,https://www.zomato.com/shimla/hotel-ganga-longwood/info,Shimla,"Melrose Lodge Estate, Near Victory Tunnel, The Mall Road, Longwood, Shimla",9am – 10pm,"+911772652264,+917018500021",-,2,-,1
Mealstonecafe & Restaurant,"Sanjauli, Shimla","Fast Food, Chinese, North Indian, Mughlai, Desserts, Beverages",₹400 for two,https://www.zomato.com/shimla/mealstonecafe-restaurant-sanjauli/info,Shimla,"Kairon Building, Opposite Public Choice, Sanjauli, Shimla",11am – 11pm,+918341970000,-,0,-,0
Bhojan,"Phagli, Shimla",North Indian,₹200 for two,https://www.zomato.com/shimla/bhojan-phagli/info,Shimla,"Shop 14, Fay Lodge, Near Old Bus Stand, Phagli, Shimla",8am – 11pm,+911772806354,-,0,-,0
Hotel Nagsons,"Longwood, Shimla","North Indian, Chinese, Mughlai, Beverages",₹550 for two,https://www.zomato.com/shimla/hotel-nagsons-longwood/info,Shimla,"Hotel Dduz Hospital, Longwood, Shimla",9am – 11pm,+911772808114,-,0,-,0
Amritsari Rasoi,"Longwood, Shimla","North Indian, Chinese, Mughlai",₹400 for two,https://www.zomato.com/shimla/amritsari-rasoi-1-longwood/info,Shimla,"39/1, Near Dr. Pal Clinic, Lakkar Bazar, Longwood, Shimla",10am – 10pm,+919625613131,-,2,3.4,49
The Food Chariot,"Panthaghati, Shimla","Fast Food, Beverages",₹300 for two,https://www.zomato.com/shimla/the-food-chariot-panthaghati/info,Shimla,"Shop 1, Padam Niwas, Near Passport Office, Panthaghati, Shimla",10am – 10pm,+918628095839,-,0,-,0
Sharma Dhaaba,"Sanjauli, Shimla","North Indian, Fast Food",₹250 for two,https://www.zomato.com/shimla/sharma-dhaaba-sanjauli/info,Shimla,"Bus Stop, Shanan, Sanjauli, Shimla",6am – 10pm,+919318001300,-,0,-,0
Heaven Stars,"Phagli, Shimla","Fast Food, Beverages",₹200 for two,https://www.zomato.com/shimla/heaven-stars-phagli/info,Shimla,"Kashyap Niwas, Phagli, Shimla",10am – 10pm,+918437576650,-,0,-,0
Nee Green Rajpoot Dhaba,"Summer Hill, Shimla","Beverages, North Indian",₹100 for two,https://www.zomato.com/shimla/nee-green-rajpoot-dhaba-summer-hill/info,Shimla,"Shop 71/1, Busher House, Ram Bazar Shimla, Summer Hill, Shimla",7:30am – 10:30pm,"+911742651071,+919318788893",-,0,-,0
Roll Master’s,"Sanjauli, Shimla",Rolls,₹200 for two,https://www.zomato.com/shimla/roll-masters-sanjauli/info,Shimla,"Housing Board Colony, Sanjauli - Bhattakufer Road, Sanjauli, Shimla",10:30am – 10pm,+918591962300,-,0,-,0
Thakur Tea Stall,"Sanjauli, Shimla","North Indian, Tea",₹100 for two,https://www.zomato.com/shimla/thakur-tea-stall-sanjauli/info,Shimla,"IGMC Road, Near Sanjauli Chowk, Sanjauli, Shimla",8am – 9pm,+919805380622,-,1,-,0
Twins Corner,"Sanjauli, Shimla","Bakery, Desserts, Fast Food",₹200 for two,https://www.zomato.com/shimla/twins-corner-sanjauli/info,Shimla,"Near Vishal Mega Mart, Sanjauli Mall Road, Sanjauli, Shimla",11am – 10pm,+919805023112,-,0,-,0
Sunil Street Food,"Sanjauli, Shimla",Street Food,₹200 for two,https://www.zomato.com/shimla/sunil-street-food-sanjauli/info,Shimla,"Cemetery Road, Sanjauli, Shimla",8:30am – 7pm,+917018899693,-,0,-,0
Zayka Fast Food,"Chakkar, Shimla",Fast Food,₹250 for two,https://www.zomato.com/shimla/zayka-fast-food-chakkar/info,Shimla,"Lower Totu, Chakkar, Shimla",9am – 8:30pm,+919418374155,-,0,-,0
