Restaurant_Name,Locality,Cuisines,Average_Cost_for_two,Restaurant_Url,City,Address,Available_Time,Contact_Number,Dining_Ratings,Dining_Votes,Delivery_Ratings,Delivery_Votes
Biryani Queen,"Bhelupur, Varanasi","Biryani, Kebab, North Indian, Mughlai, Rolls, Beverages, Awadhi","₹1,000 for two",https://www.zomato.com/varanasi/biryani-queen-bhelupur/info,Varanasi,"B-27/92-C-1, Plot 65A, Ravindrapuri Colony, Bhelupur, Varanasi",11:15am – 11:15pm,+918115679397,-,2,4.0,782
Aman E Khas,"Bhelupur, Varanasi","North Indian, Mughlai, Chinese, Biryani, Desserts",₹850 for two,https://www.zomato.com/varanasi/aman-e-khas-bhelupur/info,Varanasi,"B-9/27 B, Pikhana, Bhelupur, Varanasi",11am – 11pm,+919792085111,4.0,508,4.1,17.8K
Baati Chokha,"Chetganj, Varanasi","North Indian, Bihari",₹350 for two,https://www.zomato.com/varanasi/baati-chokha-2-chetganj/info,Varanasi,"S-13/18, Teliabagh, Anand Mandir, Chetganj, Varanasi",11am – 10:30pm,+915422201010,4.5,542,4.3,"2,996"
Molecule Gastro Bar,"Mahmoorganj, Varanasi","Italian, North Indian, Fast Food, Desserts, Finger Food, Sichuan","₹1,000 for two",https://www.zomato.com/varanasi/molecule-gastro-bar-mahmoorganj/info,Varanasi,"D 63/9-A, 11th Floor, Didwania Square, Mahmoorganj, Varanasi",1:15pm – 12midnight,"+918303709998,+918303709998",4.1,130,4.5,428
Kerala Cafe,"Bhelupur, Varanasi","South Indian, North Indian, Chinese, Street Food, Beverages",₹300 for two,https://www.zomato.com/varanasi/kerala-cafe-bhelupur/info,Varanasi,"Bhelupur Crossing, Bhelupur, Varanasi",8am – 10pm,+918874277818,4.3,"1,258",-,0
Ming Garden,"Lanka, Varanasi","Chinese, Fast Food, Desserts, Beverages, Sichuan",₹600 for two,https://www.zomato.com/varanasi/ming-garden-lanka/info,Varanasi,"34-B, Ravindrapuri Colony, Lanka, Varanasi",11am – 10:30pm,"+915422312652,+915422310452",4.3,997,4.2,14.1K
The Yellow Chilli,"Mahmoorganj, Varanasi","North Indian, Mughlai, Chinese, Street Food, Desserts, Beverages",₹900 for two,https://www.zomato.com/varanasi/the-yellow-chilli-mahmoorganj/info,Varanasi,"First Floor, Zorba Tower, Mahmoorganj, Varanasi",11am – 11pm,+917800097000,4.3,326,3.8,"4,475"
Capsicum Food Court,"Lanka, Varanasi","North Indian, South Indian, Chinese, Fast Food, Pizza, Rolls, Beverages",₹400 for two,https://www.zomato.com/varanasi/capsicum-food-court-3-lanka/info,Varanasi,"B-31/225-4, Lanka, Varanasi",8am – 11pm,"+918810758081,+918810758082,+919451983199",4.0,"1,787",4.2,87K
Golden Hour Multi Cuisine Restaurant,"Lanka, Varanasi","North Indian, Chinese, Italian","₹1,000 for two",https://www.zomato.com/varanasi/golden-hour-multi-cuisine-restaurant-lanka/info,Varanasi,"B 32/32-184, Saket Nagar Colony, Lanka, Varanasi",11am – 11pm,+919889616005,3.9,8,4.2,50
The Taste Factory,"Mahmoorganj, Varanasi","North Indian, Chinese, Mughlai",₹800 for two,https://www.zomato.com/varanasi/the-taste-factory-2-mahmoorganj/info,Varanasi,"B38/1S, Tulsipur, Mahmoorganj, Varanasi",11:30am – 11:30pm,"+915422360050,+916393240025,+919810643674",4.6,238,4.1,"4,341"
Root Restaurant & River Club,"Assi Ghat, Varanasi","North Indian, Chinese, Fast Food, Beverages",₹800 for two,https://www.zomato.com/varanasi/root-restaurant-river-club-assi-ghat/info,Varanasi,"Nagwa Road, Dumraon Colony, Assi Ghat, Varanasi",11am – 11pm,+918400460355,4.1,146,3.8,120
VNS Live Studio,"Sigra, Varanasi","Continental, North Indian, Chinese, Beverages, Sichuan",₹700 for two,https://www.zomato.com/varanasi/vns-live-studio-sigra/info,Varanasi,"Ground Floor, 22 Gulab Bagh, Sigra, Varanasi",24 Hours,"+919161101114,+916392000710",3.6,361,4.2,935
Dhanyavad Foods,"Lanka, Varanasi","Hyderabadi, Biryani, Mughlai",₹500 for two,https://www.zomato.com/varanasi/dhanyavad-foods-1-lanka/info,Varanasi,"177, B-30/2, A-3, Plot 4, Prafulla Nagar Colony, Lanka, Varanasi",12:30pm – 11pm,+918355034085,-,1,4.1,368
Pind Balluchi,"Sigra, Varanasi","North Indian, Mughlai, Biryani, Continental, Chinese, Desserts","₹1,200 for two",https://www.zomato.com/varanasi/pind-balluchi-sigra/info,Varanasi,"3rd Floor, Swastik City Centre, Rathyatra, Sigra, Varanasi",11am – 11pm,"+917800007554,+917800007552,+917800007553",4.2,448,4.0,"9,446"
Banaras Food Truck,"Nadesar, Varanasi","Chinese, North Indian, Momos, Fast Food",₹500 for two,https://www.zomato.com/varanasi/banaras-food-truck-nadesar/info,Varanasi,"Survey 86/1, Cantonment, Nadesar, Varanasi",Opens at 5pm,+917408882888,3.9,11,New,0
Canton Royale Restaurant - Hotel Surya,"Hotel Surya, Nadersar, Varanasi","North Indian, Continental, Mediterranean, Fast Food, Salad, Asian, Desserts, Beverages","₹1,500 for two",https://www.zomato.com/varanasi/canton-royale-restaurant-hotel-surya-nadesar/info,Varanasi,"S 20/51 A-5, Hotel Surya, Varuna Bridge, Nadesar, Varanasi",12noon – 11pm,"+919838521199,+918853002353",4.2,109,4.2,"2,121"
Super Delicious Food,"Lanka, Varanasi","Chinese, Fast Food, North Indian",₹300 for two,https://www.zomato.com/varanasi/super-delicious-food-lanka/info,Varanasi,"Azad Katra, Hyderabad Gate, Susuwahi Road, Lanka, Varanasi",11am – 10:30pm,"+918874445500,+919044161595",4.0,137,3.9,"3,677"
Tao Bao Korean Cafe,"Durgakund, Varanasi","Korean, Beverages, Pasta",₹500 for two,https://www.zomato.com/varanasi/tao-bao-korean-cafe-durgakund/info,Varanasi,"B- 1/2, Padmashree Chauraha, Near Kali Mata Temple, Ravindrapuri Road, Durgakund, Varanasi",2pm – 10:30pm,+917651916540,New,1,-,0
My Table - The Lounge Bar,"Shastri Nagar, Varanasi","Finger Food, North Indian","₹1,500 for two",https://www.zomato.com/varanasi/my-table-the-lounge-bar-shastri-nagar/info,Varanasi,"5th Floor, Vinayak Plaza, Maldahiya, Shastri Nagar, Varanasi",3:30pm – 11:45pm,+918573000005,4.2,29,3.3,43
Blue Lassi Shop,"Dashaswmedh Road, Varanasi",Beverages,₹200 for two,https://www.zomato.com/varanasi/blue-lassi-shop-dashaswmedh-road/info,Varanasi,"CK 12/1, Kunj Gali, Near Rajbandhu, Govindpura, Dashaswmedh Road, Varanasi",9:30am – 9pm,+915422401127,3.9,5,-,0
Khadak Singh Da Dhaba,"Bhelupur, Varanasi","North Indian, Mughlai, Rolls, Chinese, Biryani, Kebab, Momos",₹300 for two,https://www.zomato.com/varanasi/khadak-singh-da-dhaba-bhelupur/info,Varanasi,"B-27/95-1, JAwahar Nagar. Extenction Road, Bhelupur, Varanasi",12noon – 12midnight,+917388948281,3.0,33,4.0,"1,752"
Deena Chat Bhandar,"Godaulia, Varanasi","Street Food, Chinese",₹200 for two,https://www.zomato.com/varanasi/deena-chat-bhandar-godaulia/info,Varanasi,"D-47/184, Luxa Road, Godaulia, Varanasi",2pm – 10:30pm,"+918840354496,+919839682454,+919415801051",4.5,662,4.3,14.9K
McDonald's,"JHV Mall, Nadesar, Varanasi","Burger, Fast Food, Wraps, Cafe, Beverages",₹500 for two,https://www.zomato.com/varanasi/mcdonalds-nadesar/info,Varanasi,"JHV Mall, Mall Road, Nadesar, Varanasi",10am – 12midnight,+919919990589,4.2,380,4.1,19K
The 3rd Floor Bar Stock Exchange,"Sigra, Varanasi","Chinese, Italian, Thai, Fast Food, Beverages, North Indian","₹1,400 for two",https://www.zomato.com/the3rdfloorbse/info,Varanasi,"22, Gulab Bagh, Opposite Sigra Police Station, Sigra, Varanasi",10am – 12midnight,+916392000710,4.4,304,3.5,325
Kesariya Thaal,"Shivala, Varanasi",North Indian,₹500 for two,https://www.zomato.com/varanasi/kesariya-thaal-shivala/info,Varanasi,"B 10/7 -7A, 7B, Krim Kund, Shivala, Varanasi",11am – 11pm,+918810758083,3.4,5,3.8,105
Rolls Royse Cafe,"Lanka, Varanasi","Rolls, Burger, Sandwich, Pizza, Fast Food, Street Food, North Indian, Chinese",₹400 for two,https://www.zomato.com/varanasi/rolls-royse-cafe-lanka/info,Varanasi,"Mohanpuri, Nasirpur, Lanka, Varanasi",10:30am – 11:30pm,+918957215158,3.9,11,4.0,76
Kashi Chat Bhandar,"Dashaswmedh Road, Varanasi",Street Food,₹100 for two,https://www.zomato.com/varanasi/kashi-chat-bhandar-dashaswmedh-road/info,Varanasi,"D-37/49, Badadev, Godowlia, Dashaswmedh Road, Varanasi",11am – 10pm,+918090421111,4.5,937,4.2,"2,784"
Cafebility,"Vinayak Plaza, Chetganj, Varanasi","Cafe, Continental, Pizza, Pasta, Sandwich, Burger, Mexican, Beverages",₹600 for two,https://www.zomato.com/varanasi/cafebility-chetganj/info,Varanasi,"2nd Floor, Vinayak Plaza, Maldahiya, Chetganj, Varanasi",11am – 8:30pm,"+917084111152,+917081791010",4.4,417,4.0,"2,930"
London Live Restaurant,"Chetganj, Varanasi","North Indian, Mughlai, Sandwich, Burger, Chinese",₹800 for two,https://www.zomato.com/varanasi/london-live-restaurant-chetganj/info,Varanasi,"C 27/249-23, Vivekanand Nagar, Jagatganj, Chetganj, Varanasi",11am – 11pm,+917991282823,4.2,591,3.8,10.3K
Fidka,"Bhelupur, Varanasi","North Indian, Chinese, Continental, Fast Food, Desserts, Shake, Beverages",₹400 for two,https://www.zomato.com/varanasi/fidka-bhelupur/info,Varanasi,"B 3/335-151-A-1-A, Ravindrapuri, Bhelupur, Varanasi",11am – 11pm,+919305425644,2.9,63,4.3,"1,275"
Charcoal Fine Dining,"Mahmoorganj, Varanasi","North Indian, Continental, Chinese, Fast Food, Desserts, Beverages","₹3,500 for two",https://www.zomato.com/varanasi/charcoal-fine-dining-mahmoorganj/info,Varanasi,"Plot 14, Near Sant Raghuber Nagar, Mahmoorganj, Varanasi",11am – 10:30pm,+919336929765,-,2,-,0
Wife On Leave Restaurant,"Sigra, Varanasi","North Indian, Chinese, Charcoal Chicken, BBQ, Continental, Afghan, Biryani, Beverages",₹700 for two,https://www.zomato.com/varanasi/wife-on-leave-restaurant-sigra/info,Varanasi,"Near Fatman Road, Sigra, Varanasi",11am – 11pm,"+919307000555,+918299383137",4.0,459,3.7,"1,504"
Saffron Veg Restaurant,"Godaulia, Varanasi","North Indian, South Indian, Chinese, Fast Food, Beverages",₹600 for two,https://www.zomato.com/varanasi/saffron-veg-restaurant-godaulia/info,Varanasi,"D 48/111, Misir Girja Ghar, Godaulia, Varanasi",9am – 10pm,"+915422420675,+919120533638",4.1,226,4.2,"2,839"
Radha Rasoi,"Sigra, Varanasi","North Indian, Chinese, South Indian, Sandwich, Fast Food, Shake, Beverages","₹1,000 for two",https://www.zomato.com/varanasi/radha-rasoi-sigra/info,Varanasi,"Shop 13, Ground Floor, Kashiraj Apartment, Zone-18, Sigra, Varanasi",11:45am – 11:30pm,+919264973890,3.9,4,3.2,9
The Palate - Ramada Plaza,"Ramada Plaza JHV, Varanasi","Asian, Continental, North Indian, South Indian, Beverages, Desserts","₹2,400 for two",https://www.zomato.com/varanasi/the-palate-ramada-plaza-nadesar/info,Varanasi,"JHV Mall, Cantonment, Nadesar, Varanasi",7am – 10:30pm,"+915422510000,+915422510005,+918874755551",4.1,51,-,0
Burger King,"Sigra, Varanasi","Burger, American, Fast Food, Beverages",₹500 for two,https://www.zomato.com/varanasi/burger-king-sigra/info,Varanasi,"C-19/134, M-B, Ground Floor & 1st Floor, Tulsi Complex, Near Shastri Nagar, Sigra, Varanasi","12midnight – 3am, 10am – 12midnight",+918177097293,4.0,289,4.2,25.6K
Burger Emperor,"Durgakund, Varanasi","Burger, North Indian, Chinese, Pizza, Fast Food, Shake",₹500 for two,https://www.zomato.com/varanasi/burger-emperor-durgakund/info,Varanasi,"B 1/87-12-A, Pandit Madan Mohan, Malviya Road, Durgakund, Varanasi",11am – 11pm,+917007862133,-,3,4.3,33
Subway,"IP Mall, Sigra, Varanasi","Healthy Food, Sandwich, Fast Food, Wraps, Salad, Beverages",₹400 for two,https://www.zomato.com/varanasi/subway-shastri-nagar/info,Varanasi,"Shop 12 &12 A, Ground Floor, IP Sigra Mall, Guru Nanak Nagar Colony, Vidyapeeth Road, Shastri Nagar, Varanasi","12midnight – 2am, 11am – 12midnight",+919956713228,-,3,3.9,596
The Vibe,"Shastri Nagar, Varanasi","North Indian, Chinese, Fast Food, Oriental","₹1,000 for two",https://www.zomato.com/varanasi/the-vibe-shastri-nagar/info,Varanasi,"C 19/134-B, Lallapura, Shastri Nagar, Varanasi","12midnight – 1:30am, 12:30pm – 12midnight",+918400086164,4.0,51,3.9,707
Cafe Big Chilli,"Assi Ghat, Varanasi","Chinese, Pizza, Italian, Sandwich, Fast Food, Wraps, Waffle, Shake",₹600 for two,https://www.zomato.com/varanasi/cafe-big-chilli-assi-ghat/info,Varanasi,"Shop 1, Plot 45, Dumrao Bagh Colony, Assi Ghat, Varanasi",10am – 10pm,+918887979023,4.1,22,4.0,660
Chrystal Bowl Restaurant,"Lanka, Varanasi","North Indian, Italian, Burger, Sandwich, Pasta, Fast Food, Pizza, Mexican","₹1,100 for two",https://www.zomato.com/varanasi/chrystal-bowl-restaurant-lanka/info,Varanasi,"34-B, Ravindrapuri Colony, Lanka, Varanasi",11am – 10:30pm,"+915422312652,+915422310452",4.0,373,4.3,"4,709"
KFC,"JHV Mall, Nadesar, Varanasi","Burger, Fast Food, Biryani, Desserts, Beverages",₹500 for two,https://www.zomato.com/varanasi/kfc-nadesar/info,Varanasi,"Plot 3, Counter 2, 3, Second Floor, JHV Mall, Mall Road, Cantonment, Nadesar, Varanasi",11am – 12midnight,+918042754444,3.5,7,4.3,"1,938"
Urban Tadka,"Lanka, Varanasi","North Indian, Chinese, Fast Food, Rolls, Biryani",₹500 for two,https://www.zomato.com/varanasi/urban-tadka-lanka/info,Varanasi,"Shital Lodge, Chittupur Gate, Lanka, Varanasi",11am – 11pm,+919696153734,3.6,13,3.8,"1,368"
Saundhi Aanch,"Lanka, Varanasi","North Indian, Chinese",₹300 for two,https://www.zomato.com/varanasi/saundhi-aanch-lanka/info,Varanasi,"Plot 35, Balaji Nagar Colony, Samaneghat, Lanka, Varanasi",10am – 11pm,+917048985571,4.1,16,4.1,649
Taste King,"Nadesar, Varanasi","North Indian, Burger, Chinese, Fast Food, Desserts, Shake, Beverages",₹300 for two,https://www.zomato.com/varanasi/taste-king-nadesar/info,Varanasi,"S 19/1 K, Mint House, Nai Bazar Cantt, Nadesar, Varanasi",10:30am – 10:30pm,"+919115006786,+918429751545",4.2,851,4.4,11K
Domino's Pizza,"IP Mall, Sigra, Varanasi","Pizza, Italian, Pasta, Fast Food, Desserts",₹400 for two,https://www.zomato.com/varanasi/dominos-pizza-chetganj/info,Varanasi,"14, Ground Floor, Cinema Site, IP Mallvaranasi, Shastri Nagar, Sigra, Chetganj, Varanasi",11am – 1am,+915422221747,4.0,"1,036",4.3,"6,365"
Hotel Milap,"Godaulia, Varanasi","North Indian, Street Food",₹200 for two,https://www.zomato.com/varanasi/hotel-milap-godaulia/info,Varanasi,"33, Vijayanagram Market, Opposite Cantt Railway Station, Godaulia, Varanasi","12midnight – 2am, 9am – 12midnight","+917800947855,+918840189188",3.2,322,3.2,15.1K
Four Course,"Jaitpura, Varanasi","North Indian, Chinese, Mughlai, Biryani, Oriental",₹700 for two,https://www.zomato.com/varanasi/four-course-jaitpura/info,Varanasi,"J 13/93-d-4, Cotton Mill Chaukaghat, near Jaitpura, Varanasi",12:30pm – 10:30pm,+916389890890,4.2,76,4.2,"2,825"
Matka Mutton Corner,"Chetganj, Varanasi","North Indian, Mughlai, Biryani",₹650 for two,https://www.zomato.com/varanasi/matka-mutton-corner-chetganj/info,Varanasi,"S17/331, Singh Medical Maldhaiya, Chetganj, Varanasi",11am – 11pm,+917985443988,4.1,121,3.7,"8,035"
Sol Bar - Hotel Surya,"Hotel Surya, Nadersar, Varanasi","Finger Food, North Indian, Mughlai, Fast Food, Pizza","₹1,500 for two",https://www.zomato.com/varanasi/sol-bar-hotel-surya-nadesar/info,Varanasi,"S 20/51, A-5, The Mall Road, Varuna Bridge, Nadesar, Varanasi",11am – 11pm,+915422508465,4.3,31,4.0,23
Terracotta Cafe,"Assi Ghat, Varanasi","Cafe, Fast Food, North Indian",₹300 for two,https://www.zomato.com/varanasi/terracotta-cafe-1-assi-ghat/info,Varanasi,"B1/146, Assi -Pushkar Talab Road, Opposite Alok Nursing Care Lane, Assi Ghat, Varanasi",9am – 11pm,+919129610006,3.7,25,-,0
Momos Of Shaolin ️,"Nadesar, Varanasi","Momos, Fast Food",₹300 for two,https://www.zomato.com/varanasi/momos-of-shaolin-nadesar/info,Varanasi,"Nehru Park, Near Varanasi Cantonment, Nadesar, Varanasi",2pm – 10:30pm,+917007912838,-,3,-,0
Devanshee City Restaurant,"Chetganj, Varanasi","North Indian, South Indian, Chinese, Fast Food, Beverages",₹500 for two,https://www.zomato.com/varanasi/devanshee-city-restaurant-chetganj/info,Varanasi,"Lauhabir Crossing, Jagatganj, Chetganj, Varanasi",10am – 10:30pm,+918574446222,3.7,47,3.8,476
BSB Local,"Mahmoorganj, Varanasi","North Indian, Chinese, Fast Food, Pizza, Ice Cream, Desserts, Beverages",₹700 for two,https://www.zomato.com/varanasi/bsb-local-mahmoorganj/info,Varanasi,"D 64/29, F Bank Colony, Mahmoorganj, Varanasi",11am – 11pm,+917007594007,4.1,297,4.2,"3,408"
Maharaja Family Restaurant,"Chetganj, Varanasi","Rolls, Biryani, Chinese",₹300 for two,https://www.zomato.com/varanasi/maharaja-family-restaurant-chetganj/info,Varanasi,"C27/232, Jagatganj, Chetganj, Varanasi",11am – 10:30pm,+917408530421,4.1,924,3.9,38K
Ksheer Sagar,"Dashaswmedh Road, Varanasi",Mithai,₹400 for two,https://www.zomato.com/varanasi/ksheer-sagar-dashaswmedh-road/info,Varanasi,"B-15/42, Sonapur Road, Dashaswmedh Road, Varanasi",9am – 9pm,+915422450777,4.8,172,-,0
Café De Coop,"Lanka, Varanasi","North Indian, Street Food",₹500 for two,https://www.zomato.com/varanasi/café-de-coop-3-lanka/info,Varanasi,"B 31/13 K, Malviya Kunj, Lanka, Varanasi",11am – 11pm,+917985068509,4.1,305,3.8,"5,130"
Sagar Ratna,"Lanka, Varanasi","South Indian, Ice Cream",₹500 for two,https://www.zomato.com/varanasi/sagar-ratna-lanka/info,Varanasi,"B-30/69-70, Swastik Plaza, Near Ravidas Gate, Lanka, Varanasi",9am – 11pm,+919519663065,3.8,360,4.3,10.5K
The Biryani Mahal Banaras,"Bhelupur, Varanasi","Biryani, Mughlai, North Indian","₹1,000 for two",https://www.zomato.com/varanasi/the-biryani-mahal-banaras-bhelupur/info,Varanasi,"B 27/88-2-A-E, Ravindrapuri, Bhelupur, Varanasi",11am – 11pm,"+919140925125,+917667893305",3.3,82,4.0,13.8K
Bhole Chature,"Sigra, Varanasi","North Indian, South Indian, Chinese, Momos, Fast Food, Shake, Beverages","₹1,000 for two",https://www.zomato.com/varanasi/bhole-chature-3-sigra/info,Varanasi,"A 4, D 58/19, Nagar Nigam Road, Sigra, Varanasi",1pm – 12midnight,+919839142536,-,1,4.3,183
Theth Banarasi Baati Chokha,"Assi Ghat, Varanasi","Rajasthani, Street Food, Desserts, Beverages",₹400 for two,https://www.zomato.com/varanasi/theth-banarasi-baati-chokha-1-assi-ghat/info,Varanasi,"3336, Dumraon Colony, Assi Ghat, Varanasi",10am – 8pm,+917800611115,-,1,-,0
Rahil Restaurant,"Sigra, Varanasi","North Indian, South Indian, Chinese, Ice Cream, Beverages, Salad",₹500 for two,https://www.zomato.com/varanasi/rahil-restaurant-sigra/info,Varanasi,"D-53/118-R, Rathyatra Crossing, Rathyatra, Sigra, Varanasi",9:30am – 10:30pm,"+915422401750,+919670033111",4.0,302,4.2,13.3K
Pallavi Baati Chokha Restaurant,"Sigra, Varanasi","North Indian, Rajasthani, Street Food, Beverages",₹400 for two,https://www.zomato.com/varanasi/pallavi-baati-chokha-restaurant-sigra/info,Varanasi,"Shop 15, 16, 17, 18, Shakti Shikha, Gandhi Nagar, Sigra, Varanasi",11am – 12midnight,+919616666338,4.3,221,4.3,"7,561"
New Banaras Restaurant & Bhojnalaya,"Lanka, Varanasi","North Indian, Fast Food, South Indian, Chinese, Biryani",₹400 for two,https://www.zomato.com/varanasi/new-banaras-restaurant-bhojnalaya-lanka/info,Varanasi,"House-10/75, Saket Nagar Colony, Nariya Road, Near Maruti Guest House, Lanka, Varanasi",11am – 11pm,+919453306148,4.0,52,4.2,"4,212"
Chowk - The Gateway Hotel,"Taj Ganges, Nadesar, Varanasi",Continental,"₹2,000 for two",https://www.zomato.com/varanasi/chowk-the-gateway-hotel-nadesar/info,Varanasi,"Nadesar Palace Grounds, Nadesar, Varanasi",7am – 11:30pm,+915426660001,4.1,79,-,0
Le Buffet- Hotel Le Lotus Grand,"Kakarmata, Varanasi","North Indian, Chinese, Continental",₹500 for two,https://www.zomato.com/varanasi/le-buffet-hotel-le-lotus-grand-kakarmata/info,Varanasi,"N 10/60, DLW Road, Kakarmata, Varanasi",8am – 11pm,+915422300803,4.5,81,4.0,"1,066"
Biryani Global,"Nadesar, Varanasi","Biryani, North Indian, Kebab, Chinese, Rolls, Mughlai, Beverages",₹450 for two,https://www.zomato.com/varanasi/biryani-global-nadesar/info,Varanasi,"Shop 12, Mint House, Nadesar, Varanasi",11am – 3am,+917390040070,-,2,3.6,16
Western Street Café  N Restaurant,"Bhelupur, Varanasi","North Indian, Chinese, Desserts, Fast Food, Beverages, Pizza, Sandwich, Coffee",₹600 for two,https://www.zomato.com/varanasi/western-street-café-n-restaurant-bhelupur/info,Varanasi,"B.27/35-8, Ravindrapuri Extention, Bhelupur, Varanasi",11am – 11pm,+919670068666,3.8,179,4.1,"2,179"
The London Shakes & Cafe,"Bhelupur, Varanasi","Fast Food, Chinese, Pasta, Waffle, Wraps, Sandwich, Desserts, Beverages",₹300 for two,https://www.zomato.com/varanasi/the-london-shakes-cafe-bhelupur/info,Varanasi,"B25/33-187, Jawahar Nagar Extension, Bhelupur, Varanasi",11:30am – 12:30am,"+919580981062,+915422277303",4.1,251,4.2,10.3K
Kalika  Restaurant,"Chetganj, Varanasi","North Indian, Chinese, Mughlai, Rolls, Biryani",₹450 for two,https://www.zomato.com/varanasi/kalika-restaurant-chetganj/info,Varanasi,"C 27/189 C, Jagatganj Chetganj, Varanasi",10:30am – 11:30pm,"+918081833934,+916389264246",3.6,364,3.9,15.1K
The Tripling Bistro,"Assi Ghat, Varanasi","Fast Food, Chinese, Momos, Pizza, Rolls, Shake, Beverages",₹500 for two,https://www.zomato.com/varanasi/the-tripling-bistro-3-assi-ghat/info,Varanasi,"Plot 45, Dumraobhag Colony, Assi Ghat, Varanasi",11am – 10pm,"+919795229339,+919373536931",4.0,380,3.9,"3,486"
Angeethee Restaurant,"Assi Ghat, Varanasi","Fast Food, Chinese, North Indian, Beverages, Desserts, Continental",₹750 for two,https://www.zomato.com/varanasi/angeethee-restaurant-assi-ghat/info,Varanasi,"B-1/128-11, Assi Ghat, Varanasi",10:30am – 9pm,"+918004215100,+915422366210",4.3,71,4.2,532
Receipe's Inn Restaurant,"Nadesar, Varanasi","North Indian, Chinese, Biryani",₹300 for two,https://www.zomato.com/varanasi/receipes-inn-restaurant-nadesar/info,Varanasi,"Mint House, Near Pet Plaza, Nadesar, Varanasi",11am – 10:30pm,+919450109938,3.7,168,4.1,"9,156"
Goli Vada Pav,"Bhelupur, Varanasi","Street Food, Fast Food, Beverages",₹250 for two,https://www.zomato.com/varanasi/goli-vada-pav-bhelupur/info,Varanasi,"B 36⁄38-29⁄2, Kabir Nagar Bhelupur, Varanasi","12midnight – 2am, 9am – 4:45pm, 5pm – 12midnight",+918318892901,-,1,4.1,209
A Cube,"Nadesar, Varanasi","North Indian, Mughlai, Biryani, Chinese, Sandwich, Fast Food, Desserts, Beverages","₹1,000 for two",https://www.zomato.com/varanasi/a-cube-1-nadesar/info,Varanasi,"Sh 18/5, Central Jail Road, Lashkar, Shivpur, Nagar Nigam Food Safety Zone-1, Nadesar, Varanasi",11am – 10:30pm,+915424016353,-,2,4.0,5
The Chocolate Heaven,"Bhelupur, Varanasi","Waffle, Fast Food, Desserts, Burger, Sandwich, Pizza, Beverages, Shake",₹800 for two,https://www.zomato.com/varanasi/the-chocolate-heaven-1-bhelupur/info,Varanasi,"B-27/92, C-1-B, Plot 65 A, First Floor, Ravindrapuri Colony, Bhelupur, Varanasi",11am – 10:30pm,+919628993999,4.3,212,4.1,"1,606"
Champaran Meat House,"Lanka, Varanasi","North Indian, Bihari",₹350 for two,https://www.zomato.com/varanasi/champaran-meat-house-lanka/info,Varanasi,"Nasirpur Road, Azad Katra, Hyderabad Gate, Susuwahi Road, Lanka, Varanasi",11:30am – 10pm,"+919956953695,+919793125001,+918986105385",4.0,161,3.7,"3,717"
Shri Narayan Mishthan,"Bhelupur, Varanasi","Mithai, Street Food",₹200 for two,https://www.zomato.com/varanasi/shri-narayan-mishthan-bhelupur/info,Varanasi,"B 26/53, Nawabganj, Bhelupur, Varanasi",7am – 11pm,"+918299616235,+915422315127,+917706087646",3.9,116,3.9,"9,869"
Shahi Daya Restaurant,"Sigra, Varanasi","North Indian, Fast Food, Burger, Chinese, Shake, South Indian, Beverages, Desserts",₹650 for two,https://www.zomato.com/varanasi/shahi-daya-restaurant-sigra/info,Varanasi,"B 21/2, China Town Complex, Rathyatra Gurubagh Road, Sigra, Varanasi",9am – 11pm,"+919307722039,+916306045589",4.4,257,4.2,"8,577"
Rajasthani Rasoi,"Mahmoorganj, Varanasi","Rajasthani, North Indian, Street Food, Beverages",₹600 for two,https://www.zomato.com/varanasi/rajasthani-rasoi-mahmoorganj/info,Varanasi,"D63/11-1, Mahmoorganj, Varanasi",11am – 10:30pm,+917080660007,3.5,136,3.9,"5,520"
The Big Chilli,"Nadesar, Varanasi","North Indian, Chinese, South Indian, Fast Food, Desserts, Beverages, Mughlai, Sichuan",₹550 for two,https://www.zomato.com/varanasi/the-big-chilli-nadesar/info,Varanasi,"S- 19/74, Varuna Bridge, Nadesar, Varanasi",9am – 10:30pm,+918707639016,3.9,167,4.0,"7,338"
Shri Rajbandhu Since 1887,"Sigra, Varanasi",Mithai,₹250 for two,https://www.zomato.com/varanasi/shri-rajbandhu-since-1887-sigra/info,Varanasi,"Shop 29, Kamachcha, Rathyatra, Sigra, Varanasi",10am – 9:30pm,+916232873333,4.2,47,4.4,421
Maharaja Veg & Non-Veg Foods,"Lanka, Varanasi","Rolls, Chinese",₹400 for two,https://www.zomato.com/varanasi/maharaja-veg-non-veg-foods-lanka/info,Varanasi,"B 30/5-A, Lanka, Varanasi",12:30pm – 11pm,+918004365760,4.0,808,4.1,11.4K
The Hungry Hub,"Mahmoorganj, Varanasi","Pizza, Sandwich, Rolls, Burger, Fast Food, Chinese, Shake, Beverages",₹500 for two,https://www.zomato.com/varanasi/the-hungry-hub-mahmoorganj/info,Varanasi,"N12/283 B, Jakkha Bajardiha, Mahmoorganj, Varanasi",10am – 10:30pm,+916393388266,-,2,2.1,7
7th Heaven,"Mahmoorganj, Varanasi","Bakery, Fast Food, Desserts",₹300 for two,https://www.zomato.com/varanasi/7th-heaven-mahmoorganj/info,Varanasi,"D-59/72 A-1, Mahmoorganj, Varanasi",11am – 10pm,"+917607778277,+917607779477",3.7,5,4.4,912
Lemon Grass Restaurant,"Dashaswmedh Road, Varanasi","Continental, North Indian, Chinese, Mughlai, Biryani, Fast Food, Shake, Beverages","₹1,000 for two",https://www.zomato.com/varanasi/lemon-grass-restaurant-dashaswmedh-road/info,Varanasi,"Fourth Floor, PDR Mall, Luxa Road, Varanasi, Dashaswmedh Road, Varanasi",11am – 9pm,"+919565399995,+917233990088",3.7,115,3.8,909
Pizza's Hub,"Sunderpur, Varanasi","Pizza, Italian, Fast Food",₹450 for two,https://www.zomato.com/varanasi/pizzas-hub-sunderpur/info,Varanasi,"Shop F-S-2A, First Floor, Tridev Apartment, Sunderpur, Varanasi",10:30am – 11pm,+917754929371,3.5,10,4.3,"1,969"
Ming Garden Bakery,"Lanka, Varanasi","Bakery, Desserts, Pizza, Shake, Beverages",₹400 for two,https://www.zomato.com/varanasi/ming-garden-bakery-lanka/info,Varanasi,"34-B, Ravindra Puri, Lanka, Varanasi",11am – 10:30pm,+919151118991,4.8,277,4.0,"5,033"
Diamond Hotel,"Bhelupur, Varanasi","Beverages, Coffee, Shake, Tea",₹150 for two,https://www.zomato.com/varanasi/diamond-hotel-bhelupur/info,Varanasi,"B 20/44, A-3, Bhelupur, Varanasi",11:15am – 10:30pm,+917706079569,3.9,179,4.4,"1,854"
