Restaurant_Name,Locality,Cuisines,Average_Cost_for_two,Restaurant_Url,City,Address,Available_Time,Contact_Number,Dining_Ratings,Dining_Votes,Delivery_Ratings,Delivery_Votes
Champaran,"Sigra, Varanasi","North Indian, Bihari, Biryani",₹400 for two,https://www.zomato.com/varanasi/champaran-sigra/info,Varanasi,"C 31/3-B, Vidyapeeth Road, Sigra, Varanasi",12:30pm – 2:30am,+918840309809,-,0,-,0
Chai Bar,"Lanka, Varanasi","Tea, Coffee, Beverages, Pizza, Sandwich, Burger, Pasta",₹200 for two,https://www.zomato.com/varanasi/chai-bar-1-lanka/info,Varanasi,"N1/26, K H A -1, Shivpuri Colony, Lanka, Varanasi",10am – 11pm,+917275759595,3.2,10,4.0,742
Brown Vinegar Cafe And Restaurant,"Sunderpur, Varanasi","Momos, Chinese, Beverages, Fast Food",₹300 for two,https://www.zomato.com/varanasi/brown-vinegar-cafe-and-restaurant-sunderpur/info,Varanasi,"84, Awaleshpur, Chunar Road, Sunderpur, Varanasi","12midnight – 4am, 10:30am – 12midnight",+918881703300,3.3,4,4.1,109
OTT Foods,"Mahmoorganj, Varanasi","North Indian, Biryani, Chinese, Fast Food",₹300 for two,https://www.zomato.com/varanasi/ott-foods-5-mahmoorganj/info,Varanasi,"63/1, Block 2/1, Mahmoorganj, Varanasi","12midnight – 1am, 11am – 12midnight",+916307740766,3.8,42,3.9,125
Hotel Shivoy Grand,"Shivala, Varanasi","North Indian, Chinese, Pizza, Sandwich, Oriental, Italian, Fast Food, Beverages",₹600 for two,https://www.zomato.com/varanasi/hotel-shivoy-grand-shivala/info,Varanasi,"B 9/47, Pilkhana, Shivala, Varanasi",10am – 10pm,+916307940209,3.3,4,-,1
Chai Sutta Bar,"Sigra, Varanasi","Burger, Fast Food, Sandwich, Street Food, Pizza, Tea, Coffee, Beverages",₹200 for two,https://www.zomato.com/varanasi/chai-sutta-bar-sigra/info,Varanasi,"D64/129-2A, Sigra, Varanasi",11am – 10pm,+917394083092,-,0,4.2,64
K G R Biryani,"Chetganj, Varanasi","Biryani, North Indian, Mughlai",₹400 for two,https://www.zomato.com/varanasi/k-g-r-biryani-chetganj/info,Varanasi,"C 27/183, Jagatganj, Chetganj, Varanasi",12noon – 11pm,+919151681618,3.8,9,4.0,7
Windsor Bar- Hotel Hindustan International,"Hotel Hindustan International, Varanasi",Finger Food,"₹1,200 for two",https://www.zomato.com/varanasi/windsor-bar-hotel-hindustan-international-sigra/info,Varanasi,"Hotel Hindustan International, C21/3, Maldahiya, Near Sigra, Varanasi",12noon – 11pm,+915422411484,3.9,6,-,0
Fresh Cake,"Kakarmata, Varanasi",Bakery,₹600 for two,https://www.zomato.com/varanasi/fresh-cake-kakarmata/info,Varanasi,"N12/274/F/2/G, Jakha, Kakarmata, Varanasi",24 Hours,+916394723632,-,0,-,0
Sri Naivedyam,"Mahmoorganj, Varanasi","South Indian, Chinese, North Indian, Beverages",₹400 for two,https://www.zomato.com/varanasi/sri-naivedyam-2-mahmoorganj/info,Varanasi,"D 63/4, Tulsipur, Sigra-Mahmoorganj Road, Mahmoorganj, Varanasi",9:30am – 9:30pm,+918948009191,-,1,-,0
Hira Sweets,"Nadesar, Varanasi","North Indian, Chinese, Street Food, South Indian, Beverages",₹300 for two,https://www.zomato.com/varanasi/hira-sweets-nadesar/info,Varanasi,"Counter 4, Second Floor, JHV Mall, Mall Road, Nadesar, Varanasi",11am – 11pm,"+919838011174,+919838011172",2.2,19,3.8,"1,268"
Nirvana Hotel,"Nadesar, Varanasi","North Indian, Chinese",₹500 for two,https://www.zomato.com/varanasi/nirvana-hotel-nadesar/info,Varanasi,"20/51, 1-N, Varuna Bridge, Cantonment, Nadesar, Varanasi",11am – 10:30pm,+917007141944,4.1,79,4.0,37
Foodify,"Bhelupur, Varanasi","Chinese, North Indian, Burger, Pizza, Fast Food, Street Food, Rolls",₹450 for two,https://www.zomato.com/varanasi/foodify-1-bhelupur/info,Varanasi,"Shop 7, Awaas Vikaas Building, Gurudham Crossing, Bhelupur, Varanasi",12midnight – 11pm,+918707894307,3.6,7,4.0,540
Hotel The Westinn,"Nadesar, Varanasi","North Indian, Chinese, Continental",₹650 for two,https://www.zomato.com/varanasi/hotel-the-westinn-1-nadesar/info,Varanasi,"S20/52-2A-1 The Mall Road, Cantonment, Varuna Bridge, Nepali Kothi, Nadesar, Varanasi",11am – 11pm,+919450543499,3.8,37,4.3,234
Banarasi Flavours,"Sigra, Varanasi","North Indian, South Indian, Mughlai, Chinese, Fast Food, Biryani, Shake",₹800 for two,https://www.zomato.com/varanasi/banarasi-flavours-sigra/info,Varanasi,"Plot C 14/175-3-M, Kazipura Khurd, Sonia, Sigra, Varanasi",11am – 11pm,+919569198951,3.9,23,4.3,38
Curry Leaves - Hotel Xenia,"Mahmoorganj, Varanasi","North Indian, Chinese, Oriental, Tea, Kebab, Beverages, Biryani, Pizza","₹1,000 for two",https://www.zomato.com/varanasi/curry-leaves-hotel-xenia-mahmoorganj/info,Varanasi,"D-63/11 Akk, Near Harsh Gas, Mahmoorganj, Varanasi",11am – 10pm,+919151000144,-,0,-,0
Lav Kush Family Restaurant,"Jaitpura, Varanasi","North Indian, Chinese, South Indian",₹700 for two,https://www.zomato.com/varanasi/lav-kush-family-restaurant-1-jaitpura/info,Varanasi,"K 52/1, Hall, N-3-1th Floor, Hartirath, Jaitpura, Varanasi",11am – 10pm,+918429549073,-,1,-,1
Hotel Vaibhav,"Nadesar, Varanasi","North Indian, Chinese, Mughlai, Fast Food, Beverages, Shake",₹800 for two,https://www.zomato.com/varanasi/hotel-vaibhav-nadesar/info,Varanasi,"56, Patel Nagar, Nadesar, Varanasi",10am – 11pm,+919336839169,3.9,8,4.0,21
Rajwada,"Bhelupur, Varanasi","North Indian, Rajasthani, Chinese, Beverages, Shake, Sichuan",₹650 for two,https://www.zomato.com/varanasi/rajwada-bhelupur/info,Varanasi,"B-27/92, 63-A, Ravindrapuri, Bhelupur, Varanasi",11am – 11pm,+917380949494,4.0,24,4.1,85
Milky Way,"Lanka, Varanasi","Bakery, Desserts",₹300 for two,https://www.zomato.com/varanasi/milky-way-1-lanka/info,Varanasi,"Nagwa, Janki Nagar Colony, Samneghat, Lanka, Varanasi",9am – 9pm,+919026263793,3.5,8,4.0,331
BB'S Cafe And Lounge,"Chetganj, Varanasi","Rolls, Chinese, Street Food, North Indian, Biryani, Sandwich, Pizza, Beverages",₹300 for two,https://www.zomato.com/varanasi/bbs-cafe-and-lounge-1-chetganj/info,Varanasi,"Shop 222, 2nd Floor, Vinayak Plaza Maldahiya, Chetganj, Varanasi",11am – 10:30pm,+917355579776,3.2,5,4.3,35
Garden Bar,"Hotel KamesHut, Chetganj, Varanasi",Finger Food,₹700 for two,https://www.zomato.com/varanasi/garden-bar-chetganj/info,Varanasi,"Jagatganj, Chauka Ghat, Chetganj, Varanasi",11am – 11pm,+918181968006,3.9,4,-,0
Shiva Restaurant,"Dashaswmedh Road, Varanasi","North Indian, Fast Food, Chinese, Beverages, Desserts",₹450 for two,https://www.zomato.com/varanasi/shiva-restaurant-dashaswmedh-road/info,Varanasi,"80, Varanasi HO, Dashaswmedh Road, Varanasi",10am – 10pm,+919936521876,3.9,5,4.2,0
Meenu Sweets & Restaurant,"Chetganj, Varanasi","North Indian, South Indian, Chinese",₹300 for two,https://www.zomato.com/varanasi/meenu-sweets-restaurant-chetganj/info,Varanasi,"C 28/141, Near Anand Mandir Cinema, Chetganj, Varanasi","9am – 12noon, 2:30pm – 11pm",+919005999800,3.8,66,4.2,895
Chestnuts,"Bhelupur, Varanasi",Bakery,₹350 for two,https://www.zomato.com/varanasi/chestnuts-2-bhelupur/info,Varanasi,"Anandbagh, Bhelupur, Varanasi",10am – 10pm,+917408674086,3.4,7,-,0
Nice Fast Food,"Sunderpur, Varanasi","Chinese, Fast Food, Rolls, Mughlai",₹300 for two,https://www.zomato.com/varanasi/nice-fast-food-sunderpur/info,Varanasi,"Azad Katra, Susuwahi Road, Hyderabad Gate, Sunderpur, Varanasi",11am – 11pm,+918318200212,3.3,4,4.0,240
The Spicy Grill,"Lanka, Varanasi","Fast Food, Chinese, South Indian, Mughlai, North Indian, Beverages",₹600 for two,https://www.zomato.com/varanasi/the-spicy-grill-lanka/info,Varanasi,"B32/21, Saket Nagar, Naria, Nagar Nigam Food Safety Zone - 16, Lanka, Varanasi",11am – 10pm,"+917398736060,+918887735621",3.9,53,4.0,35
Tandoor N Curry,"Nadesar, Varanasi","Mughlai, North Indian",₹500 for two,https://www.zomato.com/varanasi/tandoor-n-curry-nadesar/info,Varanasi,"SH-15/78-AK-9, Suddhipur, Nadesar, Varanasi",10am – 10pm,+918318243660,3.9,10,4.2,98
The Handi House,"Lahartara, Varanasi","North Indian, Chinese, Mughlai, Fast Food, South Indian",₹500 for two,https://www.zomato.com/varanasi/the-handi-house-lahartara/info,Varanasi,"DLW Road, Manduadih, Opposite Diesel Power House, Lahartara, Varanasi",12noon – 10:30pm,+919711328119,3.4,6,4.0,72
Just Chill,"Sigra, Varanasi","Street Food, Chinese, Sichuan",₹400 for two,https://www.zomato.com/varanasi/just-chill-sigra/info,Varanasi,"D 58/19, A1-F1-P, First Floor, Shakti Plaza Building, Sigra, Varanasi",10am – 9pm,+919336150469,3.9,7,3.8,27
Karagar Cafe & Lounge,"Bhelupur, Varanasi","North Indian, Chinese, Sandwich, Burger, Rolls, Pizza, Pasta, Beverages",₹700 for two,https://www.zomato.com/varanasi/karagar-cafe-lounge-bhelupur/info,Varanasi,"B 27/78-B-1-165-1, Gurudham Chauraha, Bhelupur, Varanasi",12noon – 11pm,+919307637364,2.6,65,4.0,233
Stark Bistro,"Lanka, Varanasi","Italian, Pizza, Burger, Sandwich, Wraps, Desserts, Mughlai, Fast Food",₹750 for two,https://www.zomato.com/varanasi/stark-bistro-lanka/info,Varanasi,"Kailash Bhawan, BHU Road, Opposite Axis Bank, Lanka, Varanasi",10am – 10pm,+919807454966,3.4,112,4.3,495
The Sada Bahar,"Chetganj, Varanasi","Chinese, South Indian, Desserts",₹300 for two,https://www.zomato.com/varanasi/the-sada-bahar-1-chetganj/info,Varanasi,"C-7/277A, Lahurabir Road, Senpura, Ramakanth Nagar, Chetganj, Varanasi",11am – 10pm,+919389010150,3.7,19,-,0
Everest Food Court,"Chetganj, Varanasi",North Indian,₹300 for two,https://www.zomato.com/varanasi/everest-food-court-chetganj/info,Varanasi,"C9/228-A, Habibpura, Chetganj, Varanasi",1pm – 6:45pm,+918765050505,3.9,72,4.4,"1,993"
Pluto,"Lanka, Varanasi","Street Food, Fast Food, Beverages",₹400 for two,https://www.zomato.com/varanasi/pluto-lanka/info,Varanasi,"Near Lanka Chauraha, Lanka, Varanasi",8:30am – 10:30pm,+918115721568,3.5,8,4.2,437
Vijay Bhojanalay And Restaurant,"Sunderpur, Varanasi","North Indian, Chinese",₹450 for two,https://www.zomato.com/varanasi/vijay-bhojanalay-and-restaurant-sunderpur/info,Varanasi,"Sabjimandi, Sunderpur, Varanasi",11am – 11pm,+919453155749,3.9,5,4.0,30
Cilantro Restaurant,"Assi Ghat, Varanasi","North Indian, Fast Food, Chinese, Continental, Desserts, Beverages",₹500 for two,https://www.zomato.com/varanasi/cilantro-restaurant-assi-ghat/info,Varanasi,"B-2/109, A-1-R, Near Mata Anandamayi Hospital, Assi Ghat, Varanasi",2pm – 10pm,+919721974111,3.9,9,4.2,43
Kalories Cafe,"Assi Ghat, Varanasi","Chinese, North Indian, Fast Food, Beverages, Sandwich, Burger",₹400 for two,https://www.zomato.com/varanasi/kalories-cafe-assi-ghat/info,Varanasi,"B1/3-23-B-12, Ravindrapuri, Assi Ghat, Varanasi",11am – 11pm,+917844973977,3.9,14,-,0
Govindam,"Shivala, Varanasi","North Indian, South Indian, Chinese, Salad","₹1,200 for two",https://www.zomato.com/varanasi/govindam-shivala/info,Varanasi,"B-10/5, Krimkund, Shivala, Varanasi",8am – 10:30pm,+919151044342,-,0,3.9,10
Arvi Restaurant,"Sunderpur, Varanasi","Chinese, North Indian, Biryani, Mughlai, Street Food, Shake, Beverages",₹600 for two,https://www.zomato.com/varanasi/arvi-restaurant-4-sunderpur/info,Varanasi,"N 8/256-A Newada, Sunderpur, Varanasi",11am – 10:30pm,"+919453789666,+917054311546",3.7,46,3.5,643
Varuna - The Gateway Hotel,"Taj Ganges, Nadesar, Varanasi","North Indian, Mughlai, Desserts","₹2,000 for two",https://www.zomato.com/varanasi/varuna-the-gateway-hotel-nadesar/info,Varanasi,"Nadesar Palace Grounds, Nadesar, Varanasi",Opens at 7:30pm,"+915422503019,+915426660001",4.9,55,-,0
Anjani Cafe,"Dashaswmedh Road, Varanasi","South Indian, Chinese, Fast Food, Street Food, Burger",₹300 for two,https://www.zomato.com/varanasi/anjani-cafe-dashaswmedh-road/info,Varanasi,"D 17/83, Bangali Tola, Dashaswmedh Road, Varanasi",8am – 8:30pm,+917388997053,3.9,8,4.2,392
Champaran-The Real Taste Of Handi,"Shastri Nagar, Varanasi","North Indian, Chinese, Fast Food, Mughlai, Bihari, Kebab, Biryani",₹500 for two,https://www.zomato.com/varanasi/champaran-the-real-taste-of-handi-shastri-nagar/info,Varanasi,"Shop no 48, Shastri Nagar, Varanasi",2pm – 11pm,"+917355352357,+919634748191",3.6,68,4.1,"1,232"
Kashi Cloud Kitchen,"Sigra, Varanasi","Sandwich, Burger, Fast Food, Chinese, Rolls, North Indian, Pizza",₹350 for two,https://www.zomato.com/varanasi/kashi-cloud-kitchen-1-sigra/info,Varanasi,"C 33/84, A-6T, Chandua Chittupur, Loko Chhitupura, Sigra, Varanasi","12midnight – 4am, 11am – 12midnight",+919140116345,-,1,3.9,25
Foodies Junction,"Sunderpur, Varanasi","North Indian, Chinese, Fast Food",₹450 for two,https://www.zomato.com/varanasi/foodies-junction-sunderpur/info,Varanasi,"N7/1, R/9A, Newada, Sunderpur, Varanasi",,+916307295202,3.9,38,4.3,"2,914"
KGN Food House,"Mahmoorganj, Varanasi","Chinese, Fast Food, Rolls, Burger",₹300 for two,https://www.zomato.com/varanasi/kgn-food-house-mahmoorganj/info,Varanasi,"B-38/217, A-6, Tulshipur, Mahmoorganj, Varanasi",1:15pm – 10:15pm,+919335429449,3.5,8,4.2,240
Cakes Man,"Sunderpur, Varanasi",Bakery,₹200 for two,https://www.zomato.com/varanasi/cakes-man-1-sunderpur/info,Varanasi,"A N-444/2, Kanchanpur, Post DLW, Sunderpur, Varanasi",9am – 10pm,+918808140339,3.4,17,4.4,354
Badal Restaurant,"Lanka, Varanasi","North Indian, Street Food, Desserts",₹300 for two,https://www.zomato.com/varanasi/badal-restaurant-lanka/info,Varanasi,"Chhittupur Gate, Near Badal Ladge, Lanka, Varanasi",9am – 8pm,+917355297584,3.8,4,-,0
Cask N Crave Restaurant,"Sunderpur, Varanasi","North Indian, Chinese",₹500 for two,https://www.zomato.com/varanasi/cask-n-crave-restaurant-sunderpur/info,Varanasi,"N2/272-A-7, 2nd Floor, Shri Ramji Complex, Karaundhi, Sunderpur, Varanasi",9am – 11:55pm,+918303524585,3.9,34,4.4,230
Lanka Inn,"Lanka, Varanasi","North Indian, Chinese, Fast Food, Street Food, Mughlai, Shake",₹350 for two,https://www.zomato.com/varanasi/lanka-inn-lanka/info,Varanasi,"Plot 9, Near PNB Bank, Prafull Nagar, Lanka, Varanasi",11am – 10:30pm,+918858491043,3.4,6,-,0
Green Ganga Cafe,"Assi Ghat, Varanasi","North Indian, Fast Food, Chinese, Beverages",₹300 for two,https://www.zomato.com/varanasi/green-ganga-cafe-assi-ghat/info,Varanasi,"Near Udupi Krishna Temple, Assi Ghat, Varanasi",9:30am – 10pm,+919118433423,-,1,-,0
Kripa Bakers,"Lanka, Varanasi","Bakery, North Indian, Chinese, Street Food, Fast Food",₹500 for two,https://www.zomato.com/varanasi/kripa-bakers-lanka/info,Varanasi,"Near Dhirendra Mahila College, Akhri Kurhua, Lanka, Varanasi",10am – 10:30pm,+919129634247,3.9,37,4.0,"2,255"
K Cake 65 Bake House,"Chetganj, Varanasi","Bakery, Desserts",₹400 for two,https://www.zomato.com/varanasi/k-cake-65-bake-house-chetganj/info,Varanasi,"C-21/65-D-4, Pisachmochan, Chetganj, Varanasi",10am – 10:30pm,+917275353237,3.0,4,4.4,223
The Champaran Family Restaurant,"Mahmoorganj, Varanasi","North Indian, Chinese, Bihari, Mughlai",₹400 for two,https://www.zomato.com/varanasi/the-champaran-family-restaurant-1-mahmoorganj/info,Varanasi,"D59/73, Akashvani, Opposite Banaras Kala Kendra, Mahmoorganj, Varanasi",11am – 11pm,+918419000082,-,2,4.0,514
Neopolitan Pizza,"Jaitpura, Varanasi","Pizza, Salad, Fast Food",₹500 for two,https://www.zomato.com/varanasi/neopolitan-pizza-jaitpura/info,Varanasi,"J12/9B, Ramkatora VNS, Zone 13, Jaitpura, Varanasi",10am – 10pm,+919717312499,New,0,New,5
Red Palace Restaurant & Marriage Lawn,"Sarnath, Varanasi","North Indian, Chinese, Mughlai, Biryani, Street Food, Desserts, Beverages, Ice Cream",₹400 for two,https://www.zomato.com/varanasi/red-palace-restaurant-marriage-lawn-sarnath/info,Varanasi,"Ledhupur, Ghazipur Road, Near Uttar Pradesh Power Corporation Limited Office, Sarnath, Varanasi",11am – 11:30pm,+919889885888,3.7,5,4.2,580
Pizza Hut,"Pandeypur, Varanasi","North Indian, Fast Food, Pizza",₹600 for two,https://www.zomato.com/varanasi/pizza-hut-2-pandeypur/info,Varanasi,"Ground Floor and First Floor, AVS Plaza, Pandeypur, Varanasi","12midnight – 1am, 10am – 12midnight",+917042254371,3.7,30,4.2,"2,447"
Shri Annapurna Restaurant And Bakers,"Pandeypur, Varanasi","North Indian, South Indian, Chinese, Biryani, Ice Cream",₹400 for two,https://www.zomato.com/varanasi/shri-annapurna-restaurant-and-bakers-pandeypur/info,Varanasi,"S9/84, Pandeypur, Varanasi",9am – 11pm,+917844030068,3.7,297,3.7,24.4K
Vegking Family Restaurant,"Nadesar, Varanasi","South Indian, Chinese, North Indian, Burger, Beverages, Ice Cream",₹500 for two,https://www.zomato.com/varanasi/vegking-family-restaurant-nadesar/info,Varanasi,"8/4-P-S, Ayodhyapuri Colony, Shivpur, Nadesar, Varanasi",11am – 10pm,+917607451856,3.9,10,4.2,380
Farzi Cafe,"Pandeypur, Varanasi","North Indian, Mughlai, Chinese, Desserts","₹1,500 for two",https://www.zomato.com/varanasi/farzi-cafe-pandeypur/info,Varanasi,"3rd Floor, Shivpur, Pandeypur, Varanasi",10am – 10pm,+918881751111,New,6,-,0
Sanzha Chulha Family Restaurant,"Nadesar, Varanasi","North Indian, Street Food, Chinese",₹400 for two,https://www.zomato.com/varanasi/sanzha-chulha-family-restaurant-nadesar/info,Varanasi,"S 30/14, Indrapur Road, Shivpur, Near Normal School, Nadesar, Varanasi",11am – 10:45pm,"+918564046440,+919919883360",3.7,112,3.9,"5,150"
Masala Kitchen,"Nadesar, Varanasi","North Indian, Chinese, Mughlai, Biryani, Pizza",₹450 for two,https://www.zomato.com/varanasi/masala-kitchen-nadesar/info,Varanasi,"S 8/416-a, Khajuri, Pandeypur, Varanasi",11am – 10:30pm,+917887007500,4.3,349,4.0,16.4K
Shree Shivay,"Nadesar, Varanasi","North Indian, Desserts",₹600 for two,https://www.zomato.com/varanasi/shree-shivay-nadesar/info,Varanasi,"S-1/118-6-1-P, Ground Floor, Chuppeypur, Near Sunbeam Varuna School, Nadesar, Varanasi",10am – 11pm,"+917234009381,+917234009383,+919935311449",4.4,192,4.2,"3,061"
Okhlee,"Ramnagar, Varanasi","Fast Food, Wraps, Momos, Chinese, Street Food, Pizza, Burger, Beverages",₹500 for two,https://www.zomato.com/varanasi/okhlee-ramnagar/info,Varanasi,"Bataubeer, Near Kalindi Hospital, Ramnagar, Varanasi",9:30am – 9:30pm,+916307188926,-,3,-,0
Shaakya Restaurant - Hotel SGT Plaza,"Sarnath, Varanasi","North Indian, Continental, Chinese, South Indian, Mughlai, Beverages","₹1,000 for two",https://www.zomato.com/varanasi/shaakya-restaurant-hotel-sgt-plaza-sarnath/info,Varanasi,"Hotel SGT Plaza, SA-14/98-8-S, Ganj, Sarnath, Varanasi",11am – 11pm,+917317002938,3.9,35,4.3,887
Banaras Metro Family Restaurant,"Pandeypur, Varanasi","North Indian, South Indian, Chinese",₹400 for two,https://www.zomato.com/varanasi/banaras-metro-family-restaurant-pandeypur/info,Varanasi,"S9/475, A1, SP Tower, Near Marukha Mata Mandir, Pandeypur, Varanasi",10am – 11pm,+917570023230,3.8,61,4.0,"3,022"
Jyoti Pizza Bite,"Lahartara, Varanasi",Pizza,₹400 for two,https://www.zomato.com/varanasi/jyoti-pizza-bite-lahartara/info,Varanasi,"Kundi Narepar, Lahartara, Varanasi",7:15am – 9:45pm,+918795297398,-,3,4.5,91
Flamingo,"Sarnath, Varanasi","Asian, Continental, Beverages","₹1,000 for two",https://www.zomato.com/varanasi/flamingo-sarnath/info,Varanasi,"The Fern Residency, Sarnath, Varanasi",4am – 11pm,+919151900271,-,0,-,0
The Pizza King,"Pandeypur, Varanasi",Pizza,₹250 for two,https://www.zomato.com/varanasi/the-pizza-king-pandeypur/info,Varanasi,"S9/84, Pandeypur Chauraha, Pandeypur, Varanasi",10am – 11pm,+917844030068,3.8,4,3.2,36
Mom’s Kitchen,"Nadesar, Varanasi","North Indian, Chinese, Momos, Fast Food, Pizza, Burger, Desserts, Beverages","₹1,000 for two",https://www.zomato.com/varanasi/moms-kitchen-nadesar/info,Varanasi,"S2/340/341A, Gilat Bazar, Patrakarpuram Colony, Nadesar, Varanasi",12:30pm – 11pm,+919170414707,3.9,5,4.0,888
Nawabi Zaiqua,"Pandeypur, Varanasi","Mughlai, North Indian, Biryani",₹400 for two,https://www.zomato.com/varanasi/nawabi-zaiqua-pandeypur/info,Varanasi,"S- 6/105, Golghar, Kachahari, Pandeypur, Varanasi",12:30pm – 11pm,+918726600012,4.0,117,4.1,"7,563"
Casamila Restro & Banquet,"Nadesar, Varanasi","North Indian, Chinese, Biryani",₹400 for two,https://www.zomato.com/varanasi/casamila-restro-banquet-nadesar/info,Varanasi,"S 8/108 S-M, Nadesar, Varanasi",11am – 10:30pm,+917348057588,3.9,42,4.2,"1,121"
Machaan Restaurant,"Pandeypur, Varanasi","North Indian, Chinese, Biryani, Street Food, Beverages",₹300 for two,https://www.zomato.com/varanasi/machaan-restaurant-pandeypur/info,Varanasi,"Dandupur, Shivpur, Pandeypur, Varanasi",11am – 11pm,+917355057636,-,2,-,0
Tandoor On The Kashi,"Nadesar, Varanasi","Pizza, Fast Food, North Indian, Biryani, Desserts","₹2,000 for two",https://www.zomato.com/varanasi/tandoor-on-the-kashi-nadesar/info,Varanasi,"S-1/3-18-1, Gilat Bazar, Near Normal School, Shivpur, Nadesar, Varanasi",11am – 11pm,+918858336668,-,3,3.4,99
Bhole Chature,"Pandeypur, Varanasi","North Indian, Chinese",₹250 for two,https://www.zomato.com/varanasi/bhole-chature-pandeypur/info,Varanasi,"SA-1/40-K, Khajuri Road, Pandeypur, Varanasi",11am – 10:30pm,+919519077707,-,1,4.1,49
Sanzha Chulha,"Nadesar, Varanasi","North Indian, Street Food, Chinese",₹400 for two,https://www.zomato.com/varanasi/sanzha-chulha-3-nadesar/info,Varanasi,"Near BHEL, Tarna, Shivpur, Airport Road, Nadesar, Varanasi",7am – 9pm,+917233009911,-,3,-,0
Paramshree Restaurant,"Pandeypur, Varanasi","South Indian, Chinese, North Indian, Street Food, Pizza, Desserts, Beverages",₹500 for two,https://www.zomato.com/varanasi/paramshree-restaurant-pandeypur/info,Varanasi,"S 8/247, Khajuri, Pandeypur, Varanasi",11am – 11pm,+917905197337,4.0,31,4.2,598
Tik Tok Pizza Burgers,"Pandeypur, Varanasi","Burger, Pizza, Fast Food",₹200 for two,https://www.zomato.com/varanasi/tik-tok-pizza-burgers-pandeypur/info,Varanasi,"SA 4/79A, Naibasti Panchkoshi Road, Pandeypur, Varanasi",1:30pm – 10pm,+917398259092,-,2,-,1
Matka Chicken And Mutton,"Nadesar, Varanasi",North Indian,₹500 for two,https://www.zomato.com/varanasi/matka-chicken-and-mutton-nadesar/info,Varanasi,"Dithori Mahal, Bhojubeer, Nadesar, Varanasi",11am – 10:30pm,+917318304900,-,1,-,0
Golden Muradabadi Hyderabadi Biryani,"Pandeypur, Varanasi",Biryani,₹350 for two,https://www.zomato.com/varanasi/golden-muradabadi-hyderabadi-biryani-pandeypur/info,Varanasi,"S 9/70-2, Nai Basti, Khajuri Road, Pandeypur, Varanasi",9:45am – 10:45pm,+916388525105,-,1,4.0,5
Veg Point,"Pandeypur, Varanasi","Chinese, North Indian",₹250 for two,https://www.zomato.com/varanasi/veg-point-pandeypur/info,Varanasi,"17A, Pahariya Mandi, Pandeypur, Varanasi",9:30am – 9:30pm,+918090204064,-,2,-,0
Hastag Multi Cuisine Restro & Garden,"Pandeypur, Varanasi","North Indian, Oriental, Chinese, Tibetan, Momos, Fast Food, Biryani, Desserts","₹1,000 for two",https://www.zomato.com/varanasi/hastag-multi-cuisine-restro-garden-pandeypur/info,Varanasi,"Araji 538, Ring Road, Pandeypur, Varanasi",11am – 10pm,+919305445516,-,3,3.7,56
A2 Food And Cafe,"Jaitpura, Varanasi","Chinese, Pizza, Sandwich, Fast Food, Street Food",₹250 for two,https://www.zomato.com/varanasi/a2-food-and-cafe-jaitpura/info,Varanasi,"J6/80, Digiya, Jaitpura, Varanasi",5am – 10:30pm,+919120845871,-,1,-,0
Sandesh Sweets and Restaurant,"Nadesar, Varanasi","Mithai, South Indian, Chinese, North Indian, Street Food",₹450 for two,https://www.zomato.com/varanasi/sandesh-sweets-and-restaurant-nadesar/info,Varanasi,"S-6/108, A-1-K, Golghar, Nadesar, Varanasi",7:30am – 10pm,+919721003535,3.7,89,4.1,"9,849"
Lazat - E - Banaras,"Pandeypur, Varanasi","North Indian, Mughlai, Biryani, Chinese, Momos",₹450 for two,https://www.zomato.com/varanasi/lazat-e-banaras-pandeypur/info,Varanasi,"SH 8/3/13, G/4, Ramjanki Dham Colony, Gilat Bazar, Near Sai Temple, Pandeypur, Varanasi",12noon – 12midnight,+918318344754,-,2,4.1,111
Chhappan Bhog Restaurant,"Nadesar, Varanasi","North Indian, Chinese, South Indian, Street Food, Ice Cream, Beverages",₹500 for two,https://www.zomato.com/varanasi/chhappan-bhog-restaurant-nadesar/info,Varanasi,"Shop - S2/157, Tagore Town, Orderly Bazar, Near Keshori Mandir, Nadesar, Varanasi",10am – 10pm,+919889709697,4.0,96,-,0
Go 69 Pizza,"Nadesar, Varanasi","Pizza, Burger, Fast Food, Beverages",₹300 for two,https://www.zomato.com/varanasi/go-69-pizza-nadesar/info,Varanasi,"BD Singh Katra, Bada Lalpur, Near Natiniyadai Mandir, Nadesar, Varanasi",10am – 11pm,+917007675513,3.8,176,3.5,"7,177"
The 100 Innings Food,"Nadesar, Varanasi","Fast Food, Chinese, Burger, Sichuan, Sandwich, Pizza",₹200 for two,https://www.zomato.com/varanasi/the-100-innings-food-nadesar/info,Varanasi,"Shop 13, Nagar Nigam Katra, Golghar Kachahari, Nadesar, Varanasi",10:30am – 10:30pm,+918009007577,3.5,8,4.2,187
New Biryani Mahal,"Nadesar, Varanasi","Biryani, Mughlai, North Indian, Kebab",₹500 for two,https://www.zomato.com/varanasi/new-biryani-mahal-nadesar/info,Varanasi,"Shop 8/73, Pakki Bazar Maqbool, Alam Road, Nadesar, Varanasi",11am – 11pm,+919936209888,2.9,18,4.2,"1,009"
The Pizza Caffe,"Pandeypur, Varanasi","Pizza, Fast Food, Beverages",₹400 for two,https://www.zomato.com/varanasi/the-pizza-caffe-pandeypur/info,Varanasi,"House 6/171, AS-4G, Pahariya, Pandeypur, Varanasi",11am – 11pm,+919956348056,3.7,14,4.0,910
Flavours Restaurant,"Nadesar, Varanasi","North Indian, Chinese, Mughlai, Fast Food, Wraps, Biryani, Desserts, Beverages","₹1,000 for two",https://www.zomato.com/varanasi/flavours-restaurant-nadesar/info,Varanasi,"Shivpur, Near Central Jail Road, Nadesar, Varanasi",11:30am – 10:30pm,+919369601101,3.2,26,4.0,273
Kalika Family Restaurant,"Pandeypur, Varanasi","North Indian, Chinese, Mughlai, Rolls, Biryani",₹450 for two,https://www.zomato.com/varanasi/kalika-family-restaurant-pandeypur/info,Varanasi,"S 8/442, Khajuri, Pandeypur, Varanasi",12noon – 11pm,+918112571111,3.1,12,3.7,"2,238"
Shri Chappan Bhog Restaurant,"Pandeypur, Varanasi","North Indian, South Indian, Chinese, Ice Cream, Beverages",₹550 for two,https://www.zomato.com/varanasi/shri-chappan-bhog-restaurant-pandeypur/info,Varanasi,"S-9/68-K-3-J, Pandeypur, Varanasi",9:30am – 10:30pm,+919118828484,3.7,32,3.7,"4,022"
