Restaurant_Name,Locality,Cuisines,Average_Cost_for_two,Restaurant_Url,City,Address,Available_Time,Contact_Number,Dining_Ratings,Dining_Votes,Delivery_Ratings,Delivery_Votes
Baker's Villa,"Chetganj, Varanasi",Bakery,₹350 for two,https://www.zomato.com/varanasi/bakers-villa-chetganj/info,Varanasi,"C 21/67-2-A-1, Mahamandal Nagar, Chetganj, Varanasi","12midnight – 2am, 9am – 12midnight",+919918300128,4.1,47,3.7,"2,854"
Petal Of Love And Cake,"Godaulia, Varanasi","Bakery, Desserts",₹200 for two,https://www.zomato.com/varanasi/petal-of-love-and-cake-1-godaulia/info,Varanasi,"B 21/62, Kamachha, Opposite Petrol Pump, Godaulia, Varanasi",9am – 12midnight,+919415336190,4.4,117,4.1,"6,170"
Zorko - Brand Of Food Lovers,"Nadesar, Varanasi","Burger, Pizza, Sandwich, Pasta, Fast Food, Shake, Beverages, Ice Cream",₹300 for two,https://www.zomato.com/varanasi/zorko-brand-of-food-lovers-1-nadesar/info,Varanasi,"Nadesar Road, Near Allahabad Bank, Nadesar, Varanasi",12:30pm – 12midnight,+918081882614,-,0,3.5,93
Shree Annpurna Restaurant,"Jaitpura, Varanasi","North Indian, Fast Food, Bakery, Beverages",₹500 for two,https://www.zomato.com/varanasi/shree-annpurna-restaurant-jaitpura/info,Varanasi,"Ramkatora, Piplani Katra, Jaitpura, Varanasi",9am – 10:30pm,+917998812325,3.3,4,-,0
Satkar Family Restaurant,"Lanka, Varanasi","North Indian, Chinese, Street Food, Biryani, Mughlai",₹500 for two,https://www.zomato.com/varanasi/satkar-family-restaurant-lanka/info,Varanasi,"Narayanpuri Dafi, NH 2 Highway, B.H.U, Lanka, Varanasi",10am – 12midnight,+919794706060,3.9,338,3.8,"8,323"
Tit Bit Cafe At Home,"Lanka, Varanasi","North Indian, South Indian, Chinese, Fast Food",₹350 for two,https://www.zomato.com/varanasi/tit-bit-cafe-at-home-lanka/info,Varanasi,"B 30/90, Swastik Plaza, Nagwa, Lanka, Varanasi",12noon – 11pm,+918127775145,4.3,270,4.3,"4,079"
Lemon Grass,"Lanka, Varanasi","North Indian, Chinese, Fast Food, Mughlai, Ice Cream, Cake",₹600 for two,https://www.zomato.com/varanasi/lemon-grass-lanka/info,Varanasi,"B 30/2A, Praful Nagar Colony, Near PNB Bank, Lanka, Varanasi",9am – 11pm,+919565366667,3.0,19,3.9,253
La Pino'z Pizza,"Bhelupur, Varanasi","Pizza, Pasta, Italian, Fast Food",₹450 for two,https://www.zomato.com/varanasi/la-pinoz-pizza-bhelupur/info,Varanasi,"B 3/354-C-1, Plot 126, Lane 6, Ravindrapuri Colony, Bhelupur, Varanasi",10am – 12midnight,+917459994424,3.0,25,3.8,"3,669"
Kasora,"Lahartara, Varanasi","North Indian, Biryani, Momos, Pizza, Desserts, Beverages, Mughlai",₹500 for two,https://www.zomato.com/varanasi/kasora-lahartara/info,Varanasi,"Araji 225, Madauli, Manduadih Road, Near Chauhaddi East House Of Rajendra Patel, Lahartara, Varanasi",11am – 11pm,+919956518670,4.0,35,3.8,"1,652"
Om Shree Ram Bhandar,"Nadesar, Varanasi","Mithai, Street Food, Desserts",₹200 for two,https://www.zomato.com/varanasi/om-shree-ram-bhandar-nadesar/info,Varanasi,"Shop 5, Mint House, Nadesar, Varanasi",7:30am – 9pm,"+919415811221,+915422507875",3.8,77,4.1,211
Hislerim Restaurant,"Lahartara, Varanasi","North Indian, Chinese",₹400 for two,https://www.zomato.com/varanasi/hislerim-restaurant-lahartara/info,Varanasi,"D65/284B, Bauliya, Near Durga Mandir, Lahartara, Varanasi",12noon – 11pm,+917007308886,3.7,20,4.3,47
Zaika Fresh & Tasty,"Sigra, Varanasi","North Indian, Chinese, Fast Food",₹200 for two,https://www.zomato.com/varanasi/zaika-fresh-tasty-sigra/info,Varanasi,"B 21/1, Shop 22, Rathyatra, Sigra, Varanasi",1:30pm – 11pm,+918948046392,3.9,82,4.1,"6,168"
The Aarna's Cafe,"Durgakund, Varanasi","Cafe, Pizza, Sandwich, Wraps, Street Food, Fast Food, Shake, Beverages",₹300 for two,https://www.zomato.com/varanasi/the-aarnas-cafe-durgakund/info,Varanasi,"B 36/38-29/2, Kabir Nagar, Durgakund, Varanasi",12noon – 11pm,+918787272029,-,1,4.0,134
The Dilli Durbar,"Sigra, Varanasi","North Indian, Chinese, Shake, Beverages",₹200 for two,https://www.zomato.com/varanasi/the-dilli-durbar-sigra/info,Varanasi,"Shop 12, Rathyatra Crossing, Sigra, Varanasi",11am – 10:30pm,+918577854485,-,3,3.8,124
Rasoi Restaurant,"Nadesar, Varanasi","North Indian, Biryani, Mughlai, Continental, Italian, Pasta, Chinese, Desserts","₹1,100 for two",https://www.zomato.com/varanasi/rasoi-restaurant-1-nadesar/info,Varanasi,"Arazi 988-89/2, Sikraul, Shivpur, Nadesar, Varanasi",11am – 10:30pm,+919792812345,4.0,46,3.9,152
Itihaas Alley Kitchen,"Assi Ghat, Varanasi","North Indian, Continental, Fast Food, Street Food, Chinese, Mediterranean, Desserts, Beverages","₹1,000 for two",https://www.zomato.com/varanasi/itihaas-alley-kitchen-1-assi-ghat/info,Varanasi,"B1/111, Assi Ghat, Varanasi",12noon – 9pm,+918400279327,3.8,23,-,1
Singh's Delight Restaurant,"Sunderpur, Varanasi","North Indian, Chinese, Fast Food, Pizza, Beverages, Seafood, Pasta, Desserts",₹700 for two,https://www.zomato.com/varanasi/singhs-delight-restaurant-sunderpur/info,Varanasi,"N 13/209, H-1, Brij Enclave Colony, Opposite Life Line Hospital, Sunderpur, Varanasi",10am – 10:30pm,"+919506100867,+919506100738",4.1,319,4.0,20.7K
Bhojanik - The Amayaa,"Nadesar, Varanasi","North Indian, Mughlai, Chinese, Desserts, Shake, Kebab, South Indian, Italian","₹2,000 for two",https://www.zomato.com/varanasi/bhojanik-the-amayaa-nadesar/info,Varanasi,"S20/51 Mall Road, Cantontment, Nadesar, Varanasi",7am – 11:30pm,+919198773341,3.9,12,4.0,5
Potli Baati Chokha Restaurant,"Assi Ghat, Varanasi",Bihari,₹300 for two,https://www.zomato.com/varanasi/potli-baati-chokha-restaurant-1-assi-ghat/info,Varanasi,"B1/153, Ganga Math, Assi Ghat, Varanasi",10:30am – 10:30pm,"+917523885624,+917523879197",4.2,75,4.2,411
Cafe-65 India Hotel,"Nadesar, Varanasi","Continental, Chinese, North Indian, Fast Food, Oriental, Sandwich, Desserts, Beverages","₹1,000 for two",https://www.zomato.com/varanasi/cafe-65-india-hotel-nadesar/info,Varanasi,"Subroto Chowk, Airforce Station, Mint Road Cantt, Nadesar, Varanasi",1pm – 10pm,+919305935863,3.8,13,3.0,6
The Taste Of Banarasiya,"Sigra, Varanasi","North Indian, Beverages, Chinese, Fast Food",₹250 for two,https://www.zomato.com/varanasi/the-taste-of-banarasiya-sigra/info,Varanasi,"C 33/283-A, Chhittupura, Sigra, Varanasi","12midnight – 1am, 9am – 12midnight",+919151222226,4.0,94,3.7,"2,429"
Kafe Fusion,"Sigra, Varanasi","Rolls, Wraps, Fast Food, North Indian",₹200 for two,https://www.zomato.com/varanasi/kafe-fusion-sigra/info,Varanasi,"C-19/120-20K, Kamla Nagar, Near Police Station, Sigra, Varanasi",10am – 12midnight,+919453002457,4.5,84,4.2,805
Sita Rasoi,"Lahartara, Varanasi","North Indian, Fast Food, Street Food",₹300 for two,https://www.zomato.com/varanasi/sita-rasoi-lahartara/info,Varanasi,"237/3, Madauli, Near True Value Maruti Showroom, Lahartara, Varanasi",11:45am – 10pm,+919839040045,3.1,17,4.1,254
RollsKing,"Mahmoorganj, Varanasi","Rolls, Fast Food, Beverages",₹350 for two,https://www.zomato.com/varanasi/rollsking-mahmoorganj/info,Varanasi,"D 63/1-B-2 A, Mahmoorganj, Varanasi",11:30am – 11:30pm,+917991369077,3.8,6,4.2,481
Vasco's Pizza,"Lanka, Varanasi","Pizza, Burger, Fast Food, Shake",₹300 for two,https://www.zomato.com/varanasi/vascos-pizza-1-lanka/info,Varanasi,"B 32/26 A- 3J, Saket Nagar, Naria, Lanka, Varanasi","12midnight – 4am, 1pm – 12midnight",+919140549240,3.8,14,4.3,678
New Sagar Fast Food,"Chetganj, Varanasi","Fast Food, North Indian",₹200 for two,https://www.zomato.com/varanasi/new-sagar-fast-food-chetganj/info,Varanasi,"C27/233 Jagatganj, Chetganj, Varanasi",,+919889675146,3.9,75,4.4,707
Uncle's Kitchen,"Shivala, Varanasi","North Indian, Mughlai, Chinese, Fast Food, Shake",₹500 for two,https://www.zomato.com/varanasi/uncles-kitchen-2-shivala/info,Varanasi,"B-10/48, Cream Kund, Shivala, Varanasi",10am – 10pm,+918303195414,3.8,50,4.0,302
Green Gardens,"Assi Ghat, Varanasi","North Indian, Chinese, Continental, Fast Food, Pancake, Desserts, Shake, Beverages","₹1,000 for two",https://www.zomato.com/varanasi/green-garden-assi-ghat/info,Varanasi,"Hotel Benaras Haveli, 1/224 B, Assi Ghat, Varanasi",7am – 10:30pm,"+917887072233,+919792019733,+915422310956",2.9,35,-,0
Dawat,"Godaulia, Varanasi","North Indian, South Indian, Chinese, Fast Food, Desserts, Beverages","₹1,000 for two",https://www.zomato.com/varanasi/dawat-godaulia/info,Varanasi,"Hotel Ganges Grand, Godowlia Crossing, Godaulia, Varanasi",11:30am – 10:30pm,"+915422392731,+917235809888",3.4,26,-,0
Prasadam,"Dashaswmedh Road, Varanasi","North Indian, Chinese, South Indian, Fast Food","₹1,000 for two",https://www.zomato.com/varanasi/prasadam-dashaswmedh-road/info,Varanasi,"CK-37/44-A, Shree Jalan Impex, Bansphatak, Shapuri Mall, Dashaswmedh Road, Varanasi",11am – 10:45pm,+919559955582,4.1,20,4.0,48
Dolphin Restaurant,"Dashaswmedh Road, Varanasi","North Indian, Chinese, Mexican, Sandwich, Pizza, Beverages, Pasta, Burger",₹700 for two,https://www.zomato.com/varanasi/dolphin-restaurant-1-dashaswmedh-road/info,Varanasi,"D16/30, Man Mandir Ghat, Dashaswmedh Road, Varanasi",8am – 11pm,+919919437170,-,2,-,4
Time Out Cafe,"Chetganj, Varanasi","North Indian, Chinese, Pizza, Continental, Biryani, Desserts, Coffee, Beverages",₹600 for two,https://www.zomato.com/varanasi/time-out-cafe-chetganj/info,Varanasi,"Shop 11, 1st Floor, Vinayak Plaza, Maldahiya, Chetganj, Varanasi",11am – 10:30pm,+919140545989,3.9,5,3.9,193
Ganga Kashi Family Restaurant,"Dashaswmedh Road, Varanasi","North Indian, Chinese, Biryani, Desserts, Beverages",₹800 for two,https://www.zomato.com/varanasi/ganga-kashi-family-restaurant-dashaswmedh-road/info,Varanasi,"D 50/198-115-A, Naisarak, Dashaswmedh Road, Varanasi",12noon – 11:30pm,+919026122415,-,0,4.0,23
Starbucks Coffee,"Lanka, Varanasi","Cafe, Coffee, Desserts, Beverages",₹300 for two,https://www.zomato.com/varanasi/starbucks-coffee-lanka/info,Varanasi,"N 1/69, Ground Floor, Krishna Bagh Nagwa, Lanka, Varanasi",8am – 11pm,+919670462532,-,0,-,0
Yelchiko Cafe & Diner,"Nadesar, Varanasi","North Indian, Chinese, Mughlai, Italian, Fast Food, Desserts, Beverages","₹1,000 for two",https://www.zomato.com/varanasi/yelchiko-cafe-diner-nadesar/info,Varanasi,"1, Mint House Road, Patel Nagar, Cantonment, Nadesar, Varanasi",12noon – 8pm,+916390177004,3.9,59,4.0,180
Lanka Vibes Cafe' & Restaurant,"Lanka, Varanasi","Chinese, North Indian, Biryani, Pizza, Pasta, Fast Food, Street Food, Ice Cream",₹300 for two,https://www.zomato.com/varanasi/lanka-vibes-cafe-restaurant-lanka/info,Varanasi,"B-31/13-k, Malviya Nagar, Lanka, Varanasi",11am – 11pm,"+919170005557,+919170005558,+919927001119",3.8,21,4.2,268
Ganga View Cafe & Restaurant,"Dashaswmedh Road, Varanasi","North Indian, Beverages",₹400 for two,https://www.zomato.com/varanasi/ganga-view-cafe-restaurant-dashaswmedh-road/info,Varanasi,"D 21/12 A-1, Rana Mahal, Dashaswmedh Road, Varanasi",1pm – 11pm,"+915422450544,+919452280519",3.9,6,-,1
Cafe Coffee Day,"JHV Mall, Nadesar, Varanasi","Cafe, Bakery, Tea, Shake, Beverages, Sandwich, Desserts",₹500 for two,https://www.zomato.com/varanasi/cafe-coffee-day-nadesar/info,Varanasi,"JHV Mall, Cantonment Area, Mall Road, Nadesar, Varanasi",10am – 10pm,+918303659357,3.1,76,4.2,414
Tasty Buds Restaurant,"Shivala, Varanasi","North Indian, Chinese, Rolls, Biryani, Beverages, Ice Cream, Salad, Coffee",₹700 for two,https://www.zomato.com/varanasi/tasty-buds-restaurant-shivala/info,Varanasi,"B10/33, Krimkund, Ravindrapuri Road, Gauriganj, Shivala, Varanasi",11am – 11pm,+918009087375,3.7,78,4.1,541
Dining Express The Train Restro,"Sunderpur, Varanasi","North Indian, Mughlai, Biryani, Chinese, Fast Food, Beverages, Ice Cream","₹1,200 for two",https://www.zomato.com/varanasi/dining-express-the-train-restro-sunderpur/info,Varanasi,"58/2, Chitaipur, Sunderpur, Varanasi",12noon – 11pm,+918853928205,3.6,4,4.2,44
KBC- Kabab Biryani & Curries,"Sigra, Varanasi",North Indian,₹400 for two,https://www.zomato.com/varanasi/kbc-kabab-biryani-curries-sigra/info,Varanasi,"C 27/179, A-K-3-A, Maldhaiya, Sigra, Varanasi",12noon – 12midnight,+919565789645,4.2,279,4.2,"3,875"
Tarang Bar - The Clarks Hotel,"Clarks Hotel, Nadesar, Varanasi","Finger Food, Beverages","₹1,500 for two",https://www.zomato.com/varanasi/tarang-bar-the-clarks-hotel-nadesar/info,Varanasi,"The Mall, Cantonment, Nadesar, Varanasi",11am – 10:30pm,+915422501011,3.9,7,-,0
Chestnuts,"Bhelupur, Varanasi",Bakery,₹350 for two,https://www.zomato.com/varanasi/chestnuts-1-bhelupur/info,Varanasi,"Ravindrapuri Colony, Lanka By Pass, Bhelupur, Varanasi",11am – 11pm,+915422277377,3.9,50,4.3,"1,089"
Mishra Marwadi Bhojnalaya,"Godaulia, Varanasi",North Indian,₹200 for two,https://www.zomato.com/varanasi/mishra-marwadi-bhojnalaya-godaulia/info,Varanasi,"D 52/15, Luxa Road, Opposite Hanuman Sai Baba Mandir, Godaulia, Varanasi","10am – 3:45pm, 6:15pm – 11:15pm",+919523058957,3.9,20,3.8,"1,486"
Himcream Kulfi Parlour,"Bhelupur, Varanasi",Ice Cream,₹100 for two,https://www.zomato.com/varanasi/himcream-kulfi-parlour-bhelupur/info,Varanasi,"B2/283, Near Ming Garden, Ravindrapuri, Bhelupur, Varanasi",11am – 11pm,"+919454501404,+919161605254",4.8,150,4.5,"5,493"
Cafe Cafe Varanasi,"Assi Ghat, Varanasi","Fast Food, North Indian, Street Food, Coffee, Beverages",₹600 for two,https://www.zomato.com/varanasi/cafe-cafe-varanasi-assi-ghat/info,Varanasi,"B2/276 A, SK, Assi Ghat, Varanasi",11am – 8pm,+919819377669,3.9,6,4.0,27
Bati Chokha Restaurant,"Bhelupur, Varanasi",Rajasthani,₹300 for two,https://www.zomato.com/varanasi/bati-chokha-restaurant-bhelupur/info,Varanasi,"Anandbagh, Ravindrapuri Road, Bhelupur, Varanasi",10am – 10pm,+919838840244,New,0,-,0
Thanco's Natural Ice Creams,"Bhelupur, Varanasi","Ice Cream, Desserts, Beverages",₹250 for two,https://www.zomato.com/varanasi/thancos-natural-ice-creams-bhelupur/info,Varanasi,"B20/44-4A, Sankat Mochan Tiraha, Bhelupur, Varanasi",11am – 10pm,+919792101630,3.6,7,4.1,71
Veda Hotel by RKS,"Dashaswmedh Road, Varanasi","North Indian, Chinese, Mughlai, Street Food, Beverages, Fast Food, Shake",₹500 for two,https://www.zomato.com/varanasi/veda-hotel-by-rks-dashaswmedh-road/info,Varanasi,"D-47/178, Ramapura, Dashaswmedh Road, Varanasi",11am – 10:30pm,+919151012462,3.6,18,4.0,30
Jamuna Das Biscuits,"Sigra, Varanasi",Bakery,₹300 for two,https://www.zomato.com/varanasi/jamuna-das-biscuits-sigra/info,Varanasi,"D-57/58, Near Maulavibag, Sigra, Varanasi",10am – 9pm,+919984466407,4.1,85,4.1,"1,080"
Poker Mania,"Bhelupur, Varanasi","Healthy Food, Salad, Chinese",₹450 for two,https://www.zomato.com/varanasi/poker-mania-bhelupur/info,Varanasi,"34, B D Chetmani Crossing, Ravindrapuri, Near Shakumbhari Complex, Bhelupur, Varanasi",9:30am – 9:30pm,+915422275185,3.9,11,-,0
Al-Baik World,"Sigra, Varanasi","North Indian, Fast Food",₹300 for two,https://www.zomato.com/varanasi/al-baik-world-sigra/info,Varanasi,"134, C -19, A 4, Gulab Bagh, Lallapura Khurd, Sigra, Varanasi",11am – 10pm,"+919984741490,+919506050107",4.2,76,3.8,"1,441"
Ganesh Chat Bhandar,"Sigra, Varanasi","Street Food, Chinese",₹200 for two,https://www.zomato.com/varanasi/ganesh-chat-bhandar-sigra/info,Varanasi,"Rathyatra, Mahmoorganj Road, Sigra, Varanasi",1pm – 10pm,+919984919271,4.0,103,4.1,"4,551"
Dada's Cafe,"Chetganj, Varanasi","South Indian, Chinese",₹100 for two,https://www.zomato.com/varanasi/dadas-cafe-chetganj/info,Varanasi,"C 7/27, Senpura, Chetganj, Varanasi",9am – 7pm,+918543867499,3.8,73,3.9,"2,808"
Grill By The Ocean - The Rivatas,"Rivatas, Nadesar, Varanasi","North Indian, Desserts","₹1,400 for two",https://www.zomato.com/varanasi/grill-by-the-ocean-the-rivatas-nadesar/info,Varanasi,"S 20/51, The Mall Road, Cantonment, Nadesar, Varanasi",11am – 11pm,+915426666100,3.9,30,4.0,12
Atrium Cafe- Hotel Hindustan International,"Hotel Hindustan International, Varanasi","Thai, Italian, Continental, North Indian, Fast Food, Desserts","₹1,200 for two",https://www.zomato.com/varanasi/atrium-cafe-hotel-hindustan-international-sigra/info,Varanasi,"C21/3, Hotel Hindustan International, Maldahiya, Near Sigra, Varanasi",24 Hours,+915422411484,4.0,16,-,0
Cresent Villa,"Bhelupur, Varanasi","North Indian, Chinese, Italian, Shake, Fast Food, Beverages",₹500 for two,https://www.zomato.com/varanasi/cresent-villa-bhelupur/info,Varanasi,"Plot 126, Lane 6, Ravindrapuri Colony, Bhelupur, Varanasi",1:30pm – 10:30pm,+915422276729,3.9,98,4.2,468
Satvik Restaurant,"Dashaswmedh Road, Varanasi","North Indian, Chinese, South Indian, Pizza, Fast Food, Shake","₹1,700 for two",https://www.zomato.com/varanasi/satvik-restaurant-dashaswmedh-road/info,Varanasi,"D 47/200-B, Luxa Road, Ramapura, Dashaswmedh Road, Varanasi",7am – 11:45pm,+918400022708,3.9,16,3.9,49
King's Pizza Factory,"Nadesar, Varanasi","Pizza, Fast Food, Shake",₹300 for two,https://www.zomato.com/varanasi/kings-pizza-factory-nadesar/info,Varanasi,"Shop 8/2-B-1-2 Ananta Colony, Nadesar, Varanasi","12midnight – 2am, 11am – 12midnight",+917355035689,-,2,4.0,844
Royal Livin,"Bhelupur, Varanasi","North Indian, Chinese, Fast Food, Beverages",₹700 for two,https://www.zomato.com/varanasi/royal-livin-bhelupur/info,Varanasi,"Plot 32-B, Gurudham Colony, Bhelupur, Varanasi",10am – 10pm,+918881002220,-,0,4.3,447
The Basant Bahar,"Chetganj, Varanasi","Mithai, Desserts, South Indian, Chinese",₹300 for two,https://www.zomato.com/varanasi/the-basant-bahar-chetganj/info,Varanasi,"0C 21- 89, Prakash Takie Building, Chetganj, Varanasi",9am – 9pm,+918573028803,3.4,39,4.3,"1,360"
Mamma Mia Biryani,"Kakarmata, Varanasi","Biryani, North Indian",₹400 for two,https://www.zomato.com/varanasi/mamma-mia-biryani-kakarmata/info,Varanasi,"10/36-A, Lakhraw, Bazardiha, Nagar Nigam Food Safety Zone-15, Kakarmata, Varanasi",11:30am – 11pm,+919120605039,4.0,63,3.9,"3,790"
Chestnuts,"Sigra, Varanasi","Bakery, Desserts, Fast Food",₹300 for two,https://www.zomato.com/varanasi/chestnuts-1-sigra/info,Varanasi,"B21/1, Maharaj Dharmkarya, Nidhi J-7-89, Rathyatra, Sigra, Varanasi",11am – 9:30pm,"+917408174081,+915422414040",3.8,108,4.2,"1,789"
Mark's Man Bar And Restaurant,"Mahmoorganj, Varanasi","Bar Food, North Indian, Chinese, Mughlai, Biryani, Beverages",₹700 for two,https://www.zomato.com/varanasi/marks-man-bar-and-restaurant-1-mahmoorganj/info,Varanasi,"D63/6B1A, Mahmoorganj Road, Mahmoorganj, Varanasi",11:30am – 11pm,+919889025259,3.9,6,-,0
The Sada Bahar,"Chetganj, Varanasi","Chinese, Fast Food, North Indian, South Indian",₹300 for two,https://www.zomato.com/varanasi/the-sada-bahar-chetganj/info,Varanasi,"C27/232, Jagatganj, Near Chetganj, Varanasi",10am – 10:30pm,+915424863125,3.9,72,4.1,"4,614"
Keshari Chat Corner,"Dashaswmedh Road, Varanasi","Street Food, Desserts, Shake",₹200 for two,https://www.zomato.com/varanasi/keshari-chat-corner-dashaswmedh-road/info,Varanasi,"Near Teri Neem Mod, Dashaswmedh Road, Varanasi",12noon – 10pm,"+915422412006,+919830734237",3.9,28,4.0,762
The Coriander Blend,"Sigra, Varanasi","Chinese, Italian",₹900 for two,https://www.zomato.com/varanasi/the-coriander-blend-sigra/info,Varanasi,"D-59/143, A-22, Sant Raghuwar Nagar Colony, Sigra, Varanasi",11am – 9:30pm,+916392739790,3.2,11,4.1,"1,866"
Cafe Choco Craze,"Shivala, Varanasi","Pizza, Burger, Momos, Fast Food, Ice Cream, Desserts, Shake, Beverages",₹400 for two,https://www.zomato.com/varanasi/cafe-choco-craze-shivala/info,Varanasi,"Shop 12, B 20/44, Vijaya Complex, Vijaya Nagar Colony, Bahadur Shah Zafar Marg, Shivala, Varanasi","12midnight – 1:30am, 11am – 12midnight",+919335475586,3.8,8,4.1,379
Foodie's Theka,"Mahmoorganj, Varanasi","North Indian, Chinese, Biryani, Fast Food, Pasta",₹300 for two,https://www.zomato.com/varanasi/foodies-theka-mahmoorganj/info,Varanasi,"D 63/1, B/2/N, Radha Market, Mahmoorganj, Varanasi",12noon – 10pm,+918840292504,3.9,6,3.5,162
Apna Fast Food Corner,"Bhelupur, Varanasi","North Indian, Chinese, Fast Food",₹200 for two,https://www.zomato.com/varanasi/apna-fast-food-corner-bhelupur/info,Varanasi,"IC Complex, Chetmani Chauraha, Bhelupur, Varanasi",1:30pm – 10:30pm,"+918299172887,+919795300630",4.1,228,3.8,11K
Family Thikana Dhaba,"Bhikharipur Kala, Varanasi","North Indian, Chinese, Street Food",₹550 for two,https://www.zomato.com/varanasi/family-thikana-dhaba-bhikharipur-kala/info,Varanasi,"Sahavabad, Near Rajendra Toyato Showroom, Bhikharipur Kala, Varanasi",7am – 11pm,+917054818891,3.6,20,-,0
Italian Pizza,"Chetganj, Varanasi","Pizza, Fast Food, North Indian, Chinese, Burger, Pasta, Biryani, Beverages",₹500 for two,https://www.zomato.com/varanasi/italian-pizza-chetganj/info,Varanasi,"C27/249-33, Swami Vivekanand Nagar Colony, Chetganj, Varanasi",10:30am – 10pm,+917007675513,4.3,106,3.7,"2,500"
"Gianis - Ice Cream, Shakes & Sundaes","Nadesar, Varanasi","Ice Cream, Desserts, Shake, Beverages",₹300 for two,https://www.zomato.com/varanasi/gianis-ice-cream-shakes-sundaes-nadesar/info,Varanasi,"S-17/317, Near Badi Masjid, Nadesar, Varanasi",12noon – 12midnight,+919336938918,4.0,130,4.0,"2,236"
Pizza Club,"Lanka, Varanasi",Pizza,₹250 for two,https://www.zomato.com/varanasi/pizza-club-2-lanka/info,Varanasi,"Haidarabad Gate BHU, Sushwahi, Lanka, Varanasi",11:30am – 10:15pm,+919794992507,-,1,-,4
Chilly Hunters Restaurant - Hotel Uday Palace,"Sunderpur, Varanasi","North Indian, Biryani",₹600 for two,https://www.zomato.com/varanasi/chilly-hunters-restaurant-hotel-uday-palace-sunderpur/info,Varanasi,"N-8/247-2K-2, Newada, Sunderpur, Varanasi",11am – 11:30pm,+918881889943,4.0,36,4.0,683
Silver Spoon Restaurant,"Dashaswmedh Road, Varanasi","North Indian, South Indian, Chinese, Fast Food, Beverages, Desserts",₹600 for two,https://www.zomato.com/varanasi/silver-spoon-restaurant-dashaswmedh-road/info,Varanasi,"D-46/19-1, Laxa, Dashaswmedh Road, Varanasi",11:30am – 10pm,+919648927009,4.0,35,3.8,896
Paprika Restaurant,"Lanka, Varanasi","North Indian, Chinese, South Indian, Fast Food, Mughlai, Beverages, Shake",₹700 for two,https://www.zomato.com/varanasi/paprika-restaurant-lanka/info,Varanasi,"B-30/5-1, Lanka, Varanasi",7:30am – 11pm,"+919455221624,+918400093388",2.7,15,4.0,"6,890"
The Rio Pub & Lounge,"Sigra, Varanasi","North Indian, Mughlai, Seafood, Biryani, Chinese, Fast Food, Shake, Beverages","₹1,300 for two",https://www.zomato.com/varanasi/the-rio-pub-lounge-sigra/info,Varanasi,"Kuber Complex, Rathyatra, East Main Road, Sigra, Varanasi",1pm – 11pm,+919151519803,-,0,-,0
The Green Balcony Cafe & Diner,"Assi Ghat, Varanasi","Chinese, Street Food, Fast Food, North Indian, Desserts, Beverages",₹650 for two,https://www.zomato.com/varanasi/the-green-balcony-cafe-diner-1-assi-ghat/info,Varanasi,"45, Dumrao bagh Colony, Bhelupur, Assi Ghat, Varanasi",11am – 11pm,+917838170371,3.7,9,3.8,89
Aadha-Aadha Café,"Dashaswmedh Road, Varanasi","Cafe, North Indian, Continental, Beverages",₹600 for two,https://www.zomato.com/varanasi/aadha-aadha-café-dashaswmedh-road/info,Varanasi,"D.20/15 Munshi Ghat, Dashaswmedh Road, Varanasi",8am – 9pm,+918887134507,-,1,-,0
The Chocolate Room,"Bhelupur, Varanasi","Mexican, Italian, Burger, Healthy Food, Desserts, Ice Cream, Beverages, Wraps",₹700 for two,https://www.zomato.com/varanasi/the-chocolate-room-bhelupur/info,Varanasi,"J 12/79, Natimali, Bhelupur, Varanasi",11am – 11pm,+915422277300,4.0,48,3.7,44
JBB Restaurant & Cafe,"Durgakund, Varanasi","North Indian, Chinese, Mughlai, Rolls, Street Food, Biryani, Burger",₹400 for two,https://www.zomato.com/varanasi/jbb-restaurant-cafe-durgakund/info,Varanasi,"Kabir Nagar, Near Kids Care Hospital, Durgakund, Varanasi","12midnight – 7:30am, 9am – 12midnight",+918957469552,3.2,77,3.4,"5,321"
Red Chilli Restaurant,"Lanka, Varanasi","North Indian, South Indian, Chinese, Beverages, Sichuan",₹550 for two,https://www.zomato.com/varanasi/red-chilli-restaurant-1-lanka/info,Varanasi,"B 36/4-7, Sankat Mochan Crossing, Lanka Road, Lanka, Varanasi",10am – 10:30pm,+919454842780,4.2,56,4.2,692
Gloria Family Restaurant,"Sunderpur, Varanasi","South Indian, North Indian, Chinese",₹400 for two,https://www.zomato.com/varanasi/gloria-family-restaurant-sunderpur/info,Varanasi,"Opposite State Bank ATM, DLW Road, Sunderpur, Varanasi",9am – 10:30pm,+919307236972,3.8,66,4.3,773
Dakshin Kashi,"Dashaswmedh Road, Varanasi","South Indian, North Indian, Street Food, Fast Food, Chinese, Beverages",₹400 for two,https://www.zomato.com/varanasi/dakshin-kashi-dashaswmedh-road/info,Varanasi,"Gate 4, Shri Kashi Vishwanath Temple, Dashaswmedh Road, Varanasi",7am – 10:30pm,+919415839426,3.7,10,-,0
Cimaya Resto,"Lanka, Varanasi","Cafe, Coffee, North Indian, Chinese, Fast Food, Pizza, Sandwich, Ice Cream",₹600 for two,https://www.zomato.com/varanasi/cimaya-resto-lanka/info,Varanasi,"2085 & 2086, 2nd Floor, Near Hyderabad Gate, Lanka, Varanasi",12:30pm – 10:45pm,+918543006317,-,0,2.7,8
The Coffee House,"Bhelupur, Varanasi","North Indian, South Indian, Chinese, Beverages, Shake",₹350 for two,https://www.zomato.com/varanasi/the-coffee-house-bhelupur/info,Varanasi,"B 20/45, Jain Mandir, Bhelupur, Varanasi",12:30pm – 11pm,+918417006464,2.8,45,4.2,391
Hotel Landmark,"Mahmoorganj, Varanasi","Mughlai, North Indian, Chinese, Continental, Desserts, Beverages","₹1,400 for two",https://www.zomato.com/varanasi/hotel-landmark-mahmoorganj/info,Varanasi,"B-38, 7-3, Mahmoorganj Road, Opposite Akashwani, Mahmoorganj, Varanasi","7:30am – 10:30am, 12noon – 3:30pm, 5pm – 10pm",+917318001704,3.9,15,4.0,12
Bangs,"Lanka, Varanasi","Burger, Fast Food, Roast Chicken, Desserts, Beverages",₹550 for two,https://www.zomato.com/varanasi/bangs-lanka/info,Varanasi,"2nd Floor, Haridhan Bhawan, Madhav Market, Lanka, Varanasi",11am – 11pm,+917897400500,3.7,286,4.2,"6,694"
