Restaurant_Name,Locality,Cuisines,Average_Cost_for_two,Restaurant_Url,City,Address,Available_Time,Contact_Number,Dining_Ratings,Dining_Votes,Delivery_Ratings,Delivery_Votes
Kimmo’s Kitchen,"Lanka, Varanasi","North Indian, Chinese, Pizza, Burger, Biryani, Momos, Salad, Continental","₹1,100 for two",https://www.zomato.com/varanasi/kimmos-kitchen-lanka/info,Varanasi,"B 30/2A-8, Prafulla Nagar Colony, Lanka, Varanasi",9am – 11:30pm,+918299230672,4.0,27,4.1,136
Chillax Fast Food Corner,"Chetganj, Varanasi","Pizza, Burger, Rolls, Sandwich, Fast Food, Chinese",₹300 for two,https://www.zomato.com/varanasi/chillax-fast-food-corner-chetganj/info,Varanasi,"Hathua Market, Chetganj Road, Chetganj, Varanasi",12noon – 9:30pm,"+919838475947,+918009556106",3.7,26,4.0,330
Satkar's Regale,"Sigra, Varanasi","North Indian, Chinese, Continental, Pasta, Fast Food, Pizza, Shake, Beverages",₹700 for two,https://www.zomato.com/varanasi/satkars-regale-sigra/info,Varanasi,"Chandrika Nagar Colony, Near Nagar Nigam, Sigra, Varanasi",11am – 10:30pm,+916307681861,3.9,193,4.0,"1,956"
Lav Kush Hotel,"Bhelupur, Varanasi","North Indian, Biryani",₹400 for two,https://www.zomato.com/varanasi/lav-kush-hotel-bhelupur/info,Varanasi,"B 12/118-A-1, Gauriganj, Bhelupur, Varanasi",11am – 11pm,+919044708125,2.9,7,-,0
Pehalwan Chicken Biryani & Restaurant,"Bhelupur, Varanasi","Biryani, North Indian",₹300 for two,https://www.zomato.com/varanasi/pehalwan-chicken-biryani-restaurant-bhelupur/info,Varanasi,"B-11/69, Ahata Rohila, Gauriganj, Bhelupur, Varanasi",Opens at 5pm,+919935040057,3.3,4,4.1,214
Mysteria,"Bhelupur, Varanasi","North Indian, Chinese, Italian, Burger, Fast Food, Desserts, Shake, Juices","₹1,000 for two",https://www.zomato.com/varanasi/mysteria-bhelupur/info,Varanasi,"Plot B/27/93/D/A, 1st Floor, Zone 17, Bhelupur, Varanasi",12:15pm – 10:45pm,+919511119561,New,0,3.0,10
The Burger Company,"Durgakund, Varanasi",Burger,₹250 for two,https://www.zomato.com/varanasi/the-burger-company-durgakund/info,Varanasi,"B 28/1, Ghosiyari Tala, Durgakund, Varanasi",10am – 10pm,+915424079469,-,1,4.2,269
Sri Annapurna Restaurant,"Chetganj, Varanasi","North Indian, South Indian, Street Food, Beverages",₹200 for two,https://www.zomato.com/varanasi/sri-annapurna-restaurant-chetganj/info,Varanasi,"12/16-a, Ramkatora, Piplani Katra, Jaitpura, Ramkatora Road, Chetganj, Varanasi",10am – 10pm,+919235596415,-,0,-,0
English Masala,"Lanka, Varanasi","North Indian, Sandwich, Chinese, Italian, Continental, Fast Food, Biryani, Beverages",₹500 for two,https://www.zomato.com/varanasi/english-masala-1-lanka/info,Varanasi,"44, Madhav Market, Lanka, Varanasi",12noon – 11pm,+917905365055,2.9,6,4.2,"2,589"
Cupid Roof,"Lanka, Varanasi","South Indian, Chinese, Fast Food, Kebab","₹1,000 for two",https://www.zomato.com/varanasi/cupid-roof-lanka/info,Varanasi,"B-21/117-18, Mahaveer Colony, Chhitupur Vinayaka, Lanka, Varanasi",12noon – 6pm,+917307049656,-,1,-,0
Zaika,"Lanka, Varanasi","Mughlai, North Indian, Chinese, Pizza, Fast Food","₹1,000 for two",https://www.zomato.com/varanasi/zaika-lanka/info,Varanasi,"8-A, Durgakund Road, Lanka, Varanasi",11am – 11pm,+918707267596,3.2,208,4.1,"1,752"
Rasna Family Restaurant,"Sigra, Varanasi","Chinese, North Indian, South Indian, Fast Food, Beverages, Desserts",₹600 for two,https://www.zomato.com/varanasi/rasna-family-restaurant-sigra/info,Varanasi,"D 58/118-H, Rathyatra, Sigra, Varanasi",10am – 10:45pm,+918726271599,4.2,260,4.3,"2,380"
Mr. Jalapenos,"Lanka, Varanasi","North Indian, Italian, Mexican, Fast Food, Pasta, Desserts, Beverages",₹700 for two,https://www.zomato.com/varanasi/mr-jalapenos-lanka/info,Varanasi,"N 1/61-2 RC, Ghat Road, Lanka, Varanasi",11am – 11pm,+919839166001,4.1,191,4.1,366
The Kerala House And Cafe,"Lanka, Varanasi",South Indian,₹400 for two,https://www.zomato.com/varanasi/the-kerala-house-and-cafe-lanka/info,Varanasi,"8/0, Tulsi Manas Mandir, Sankat Mochan, Lanka, Varanasi",7am – 11:30pm,+919336422226,3.6,97,3.8,"5,549"
Hunger Point,"Lanka, Varanasi","North Indian, Chinese, South Indian, Fast Food, Street Food",₹300 for two,https://www.zomato.com/varanasi/hunger-point-1-lanka/info,Varanasi,"N-1/66-E-3, Samne Ghat, Lanka, Varanasi",10am – 11pm,+919415136438,2.8,5,4.1,"1,361"
Treat Cafe And Dine,"Nadesar, Varanasi","Italian, North Indian, Continental, Chinese, Sandwich, Desserts, Beverages",₹600 for two,https://www.zomato.com/varanasi/treat-cafe-and-dine-nadesar/info,Varanasi,"S 19/56-57, Varuna Bridge Crossing, Nadesar, Varanasi",11am – 11pm,+917309390000,4.1,40,4.1,738
Moonshiner Restaurant And Bar,"Mahmoorganj, Varanasi","North Indian, Mughlai, Biryani, Chinese, Fast Food, Desserts, Beverages, Ice Cream","₹1,500 for two",https://www.zomato.com/varanasi/moonshiner-restaurant-and-bar-mahmoorganj/info,Varanasi,"B-38/9-M-7, Raghunath Nagar, Mahmoorganj, Varanasi",11am – 10:30pm,+919835688882,-,1,3.7,17
Pizza's Masti,"Lanka, Varanasi","Pizza, Fast Food",₹350 for two,https://www.zomato.com/varanasi/pizzas-masti-lanka/info,Varanasi,"B 32/23 B 1, Saket Nagar, Lanka, Varanasi",11am – 12midnight,+918005388018,3.1,5,4.0,339
Mangi Ferra Cafe - Hotel Surya,"Hotel Surya, Nadersar, Varanasi","North Indian, Fast Food, Pizza, Sichuan, Kebab, Burger",₹800 for two,https://www.zomato.com/varanasi/mangi-ferra-cafe-hotel-surya-nadesar/info,Varanasi,"20/51, A-5, The Mall Road, Varuna Bridge, Nadesar, Varanasi",12noon – 11pm,"+918853002353,+919838521199",4.4,123,4.0,115
Flavours Cafe,"Lanka, Varanasi","Cafe, Pizza, Fast Food, Desserts, Beverages",₹550 for two,https://www.zomato.com/varanasi/flavours-cafe-lanka/info,Varanasi,"1st Floor, Swastik Plaza, Near Ravidas Gate, BHU Road, Lanka, Varanasi",9:30am – 8pm,+919112500281,3.6,214,4.1,476
Sun Rise Restaurant,"Nadesar, Varanasi","North Indian, South Indian, Chinese, Pizza, Fast Food, Momos, Shake, Beverages","₹1,000 for two",https://www.zomato.com/varanasi/sun-rise-restaurant-nadesar/info,Varanasi,"S 15/1, Ghausabad, Near Prakash Petrol Pump, Nadesar, Varanasi",10:30am – 10:15pm,+919565667788,4.3,164,4.2,"3,508"
Captain Nova,"Bhelupur, Varanasi","North Indian, Chinese, Continental, Pizza, Fast Food, Oriental, Mexican, Sichuan",₹700 for two,https://www.zomato.com/varanasi/captain-nova-bhelupur/info,Varanasi,"B 27/87-7-87-8-87-8A, Ravindrapuri Mauja, Bhadaini, Bhelupur, Varanasi",12noon – 12midnight,"+917518876565,+918299448552",3.7,33,3.9,"1,105"
Culture Garden,"Godaulia, Varanasi","North Indian, Biryani, Chinese, Pizza, Fast Food, Ice Cream, Beverages","₹1,000 for two",https://www.zomato.com/varanasi/culture-garden-godaulia/info,Varanasi,"D -45/2/A, Luxa, Godaulia, Varanasi",11am – 11pm,+919511163009,-,1,-,0
Ambrosia Restaurant,"Bhikharipur Kala, Varanasi","North Indian, Chinese, Biryani, Fast Food, Street Food, Bakery, Desserts, Beverages",₹500 for two,https://www.zomato.com/varanasi/ambrosia-restaurant-bhikharipur-kala/info,Varanasi,"Sita Dham Mandir, Bhullanpur, DLW, Maduadih, Bhikharipur Kala, Varanasi",12noon – 10pm,+919936249567,3.5,241,4.0,"7,159"
New Biryani Head Quater,"Chetganj, Varanasi","Biryani, Pizza, Sandwich",₹400 for two,https://www.zomato.com/varanasi/new-biryani-head-quater-chetganj/info,Varanasi,"H-C 27/249, Vivekanand Colony, Maldahiya, Chetganj, Varanasi",10:30am – 10pm,+917007675513,3.6,13,3.4,57
Hotel Kalika,"Nadesar, Varanasi","North Indian, Chinese, Street Food, Biryani",₹400 for two,https://www.zomato.com/varanasi/hotel-kalika-nadesar/info,Varanasi,"Mint House, Nadesar Road, Nadesar, Varanasi",12midnight – 11pm,+916394892575,3.8,64,4.0,"2,428"
Mangalam Bakers,"Assi Ghat, Varanasi",Desserts,₹400 for two,https://www.zomato.com/varanasi/mangalam-bakers-assi-ghat/info,Varanasi,"B-29, Nagwa Road, Dumrao Colony, Assi Ghat, Varanasi",11am – 11pm,+919472002460,3.2,8,3.9,230
The Matka Chicken King,"Chetganj, Varanasi","North Indian, Chinese",₹500 for two,https://www.zomato.com/varanasi/the-matka-chicken-king-chetganj/info,Varanasi,"Ck 27/183, Chetganj, Varanasi",11am – 11pm,+918468041409,3.3,4,-,1
The Keshari Restaurant,"Dashaswmedh Road, Varanasi","North Indian, South Indian, Chinese, Continental, Desserts",₹700 for two,https://www.zomato.com/varanasi/the-keshari-restaurant-dashaswmedh-road/info,Varanasi,"D 14/8, Teri Neem, Crossing, Dashaswmedh Road, Varanasi",11am – 11pm,+919307987881,3.0,122,4.1,87
Banarasi Tadka,"Assi Ghat, Varanasi","Chinese, North Indian, South Indian",₹350 for two,https://www.zomato.com/varanasi/banarasi-tadka-6-assi-ghat/info,Varanasi,"B 2/225, D-1, Bhadaini, Assi Ghat, Varanasi",12noon – 11pm,+919140587338,-,2,4.1,106
Aum Cafe,"Assi Ghat, Varanasi","Healthy Food, Desserts, Juices, Coffee, Beverages",₹550 for two,https://www.zomato.com/varanasi/aum-cafe-assi-ghat/info,Varanasi,"B1/201, Assi Ghat, Varanasi",10am – 4:30pm,+919335361122,3.8,46,4.2,429
Marwadi Rasoi,"Godaulia, Varanasi","North Indian, Chinese, South Indian, Kebab, Desserts","₹1,000 for two",https://www.zomato.com/varanasi/marwadi-rasoi-godaulia/info,Varanasi,"Araji 237/3, Bhullanpur, Near True Value Marhuli Maruti Suzuki, Godaulia, Varanasi",12noon – 11pm,+918795000017,-,1,New,1
Hungry Heads,"Sigra, Varanasi","Chinese, Shake, Pizza, Sandwich, Rolls, Burger, Waffle, Beverages",₹900 for two,https://www.zomato.com/varanasi/hungry-heads-sigra/info,Varanasi,"D 58/20 B, Dashashwamedh, Sigra, Varanasi",12:30pm – 10:30pm,+918881329777,4.2,171,4.3,260
The Food Palace,"Lahartara, Varanasi","North Indian, Chinese, Biryani, Beverages, Kebab, Rolls",₹400 for two,https://www.zomato.com/varanasi/the-food-palace-lahartara/info,Varanasi,"Near Bhaskra Talab, Rohania, Kesharipur, Lahartara, Varanasi",11am – 11pm,+918400900425,-,1,4.0,579
Creme Borne,"Dashaswmedh Road, Varanasi","Ice Cream, Desserts, Waffle, Sandwich, Burger, Italian, American, Beverages",₹600 for two,https://www.zomato.com/varanasi/creme-borne-dashaswmedh-road/info,Varanasi,"CK/15/1/05, Bulanala, Near Kashi Vishwanath Temple, Dashaswmedh Road, Varanasi",10am – 10pm,+919219945085,-,2,3.5,11
Mapango Pizza,"Durgakund, Varanasi","Fast Food, Pizza, Sandwich, Burger, Beverages",₹200 for two,https://www.zomato.com/varanasi/mapango-pizza-durgakund/info,Varanasi,"B 36, 44/B-3, Kabir Nagar Colony, Shukulpura, Durgakund, Varanasi",12:30pm – 10pm,"+917376047166,+918825874266",-,3,4.0,24
Udupi Sagar,"Jaitpura, Varanasi","South Indian, North Indian, Chinese","₹1,100 for two",https://www.zomato.com/varanasi/udupi-sagar-jaitpura/info,Varanasi,"A-1 B-12/119, Jaitpura, Varanasi",8am – 10:30pm,+917388890965,-,0,-,0
Popular Baati Chokha,"Sigra, Varanasi","North Indian, Street Food, Beverages",₹100 for two,https://www.zomato.com/varanasi/popular-baati-chokha-sigra/info,Varanasi,"D-59/105-B-74, Kamachcha, Sigra, Varanasi",11am – 9pm,+919369095761,3.9,4,-,0
Hotel Four Element,"Mahmoorganj, Varanasi","North Indian, Chinese, Pizza, Burger, Desserts, Sichuan",₹700 for two,https://www.zomato.com/varanasi/hotel-four-element-mahmoorganj/info,Varanasi,"194/1, Near Manduadih Railway Station, Manduadih, DLW Road, Mahmoorganj, Varanasi",11am – 10pm,+919076606750,3.9,11,3.9,188
Drinks On Board,"Sigra, Varanasi","North Indian, Chinese, Fast Food, Desserts, Beverages, Pizza, Pasta, Shake","₹1,000 for two",https://www.zomato.com/varanasi/drinks-on-board-16-sigra/info,Varanasi,"C-19/27-14-1, Gulab, Sigra, Varanasi",1pm – 11pm,"+916390577577,+916391577577",-,1,-,1
Rajesh Sweets & Bakers,"Chetganj, Varanasi","North Indian, Fast Food, South Indian, Chinese, Biryani, Desserts, Shake, Beverages",₹500 for two,https://www.zomato.com/varanasi/rajesh-sweets-bakers-chetganj/info,Varanasi,"C 27/272, A-1, Kashi Anathalaya, Maldhaiya, Chetganj, Varanasi",12noon – 11pm,+919838347347,3.9,144,4.2,"2,962"
99 Pancakes,"Bhelupur, Varanasi","Pancake, Pizza, Fast Food, Shake, Beverages",₹400 for two,https://www.zomato.com/varanasi/99-pancakes-bhelupur/info,Varanasi,"B-27/92- 62A, Ravindrapuri Colony, Bhelupur, Varanasi","12midnight – 2am, 11am – 12midnight",+919984923607,3.8,9,4.3,995
Urga Restaurant & Cafe,"Jaitpura, Varanasi","Cafe, Coffee, South Indian, North Indian, Italian, Fast Food, Desserts, Beverages",₹600 for two,https://www.zomato.com/varanasi/urga-restaurant-cafe-1-jaitpura/info,Varanasi,"C 26/1A, Kabir Road, Jaitpura, Varanasi",12noon – 10pm,+918881889599,New,1,New,3
Sita Rasoi - A Unit Of Mint Leaf,"Durgakund, Varanasi","North Indian, South Indian, Chinese, Fast Food, Street Food","₹1,000 for two",https://www.zomato.com/varanasi/sita-rasoi-a-unit-of-mint-leaf-durgakund/info,Varanasi,"B-36/38-33/1, Kabir Nagar, Durgakund, Varanasi",12noon – 11pm,+917800805805,4.3,144,3.9,"3,847"
Bar Bar,"Nadesar, Varanasi","Continental, Chinese, North Indian, Desserts, Bar Food","₹1,100 for two",https://www.zomato.com/varanasi/bar-bar-nadesar/info,Varanasi,"59, Patel Nagar, Cantt, Nadesar, Varanasi",10:01am – 10pm,"+919305935863,+919305935864,+915422502325",4.2,118,2.8,13
Annapurna Rasoi Family Restaurant,"Dashaswmedh Road, Varanasi","North Indian, South Indian, Chinese, Beverages, Ice Cream",₹500 for two,https://www.zomato.com/varanasi/annapurna-rasoi-family-restaurant-dashaswmedh-road/info,Varanasi,"D 48/118, Girjaghar Crossing, Near HP Petrol Pump, Dashaswmedh Road, Varanasi",11am – 11pm,+919721511241,-,2,3.9,110
Aalishan Zaika,"Lahartara, Varanasi","North Indian, Fast Food, Chinese, Beverages, Ice Cream",₹550 for two,https://www.zomato.com/varanasi/aalishan-zaika-1-lahartara/info,Varanasi,"Modhaila, North-house Raj Patel, Opposite Vivek Hospital, South Road, Lahartara, Varanasi",10am – 10:30pm,"+917525010766,+917525010770",3.9,115,4.1,"3,739"
My Slice & Cafe,"Jaitpura, Varanasi","Pizza, Sandwich, Pasta, Fast Food, Street Food, Shake, Coffee, Tea",₹450 for two,https://www.zomato.com/varanasi/my-slice-cafe-jaitpura/info,Varanasi,"K66/52, Narharpura Lohtiya, Jaitpura, Varanasi",11am – 9:30pm,+918887037905,3.4,4,-,4
C2H5 Klub,"Chetganj, Varanasi","Chinese, Fast Food, Salad, North Indian, Bar Food, Desserts, Ice Cream","₹1,200 for two",https://www.zomato.com/varanasi/c2h5-klub-2-chetganj/info,Varanasi,"C21/89-E, Mahamandal Nagar, Chetganj, Varanasi","12midnight – 12:30am, 10:30am – 12midnight",+919820443223,4.2,18,3.8,10
Banarasi Biryani,"Lanka, Varanasi","Mughlai, North Indian, Biryani",₹300 for two,https://www.zomato.com/varanasi/banarasi-biryani-lanka/info,Varanasi,"B 30/71-70, Swastik Market, Lanka, Varanasi",1pm – 10pm,+917880854522,3.7,8,4.5,214
Indian Food Cafezonia,"Bhikharipur Kala, Varanasi","North Indian, South Indian, Street Food, Chinese, Beverages",₹250 for two,https://www.zomato.com/varanasi/indian-food-cafezonia-bhikharipur-kala/info,Varanasi,"Audhe, Bachhawn, Bhikharipur Kala, Varanasi",8am – 10pm,+919838076796,-,2,-,2
Meals on Wheels,"Nadesar, Varanasi","Chinese, North Indian, Momos, Fast Food",₹250 for two,https://www.zomato.com/varanasi/meals-on-wheels-nadesar/info,Varanasi,"Army Canteen, Varanasi Cantonment, Nadesar, Varanasi",Opens at 5pm,+919648738732,3.3,5,4.3,48
Caara's Kitchen,"Bhikharipur Kala, Varanasi","North Indian, Mughlai, Biryani, Chinese, Fast Food, Shake, Beverages",₹500 for two,https://www.zomato.com/varanasi/caaras-kitchen-bhikharipur-kala/info,Varanasi,"Village Awleshpur, Bhikharipur Kala, Varanasi",11:30am – 11pm,+919936595013,-,1,4.0,8
Baskin Robbins - Ice Cream Desserts,"Bhelupur, Varanasi","Ice Cream, Desserts, Beverages",₹500 for two,https://www.zomato.com/varanasi/baskin-robbins-ice-cream-desserts-bhelupur/info,Varanasi,"Plot 33, Line, 16, Ravinderpuri, Bhelupur, Varanasi",11am – 11pm,"+918896788481,+918896788481",4.2,46,4.3,901
Amantran,"Sunderpur, Varanasi","Chinese, North Indian, Mughlai, Biryani, Beverages",₹550 for two,https://www.zomato.com/varanasi/amantran-1-sunderpur/info,Varanasi,"N 6/17, Chitaipur, Sunderpur, Varanasi",10am – 11pm,"+919305406933,+918601285675",3.0,7,-,0
Root Espresso,"Sigra, Varanasi","Continental, Fast Food, Pasta, Asian, Pizza, Bakery, Desserts, Beverages",₹900 for two,https://www.zomato.com/varanasi/root-espresso-1-sigra/info,Varanasi,"C 19/115-A-116-S-2, Sigra, Varanasi",11am – 11pm,+918400460355,3.3,16,3.4,160
Mandarin Restaurant,"Sigra, Varanasi","Chinese, North Indian, Seafood, Beverages","₹1,000 for two",https://www.zomato.com/varanasi/mandarin-restaurant-sigra/info,Varanasi,"C19/27-14-1, Gulab Bagh, Sigra, Varanasi",11:30am – 10:30pm,+917007575657,4.1,48,4.4,569
Annapurna Restaurant,"Sigra, Varanasi","North Indian, Chinese, Beverages",₹600 for two,https://www.zomato.com/varanasi/annapurna-restaurant-1-sigra/info,Varanasi,"C 31/4, B-12, 13 Englishia Line, Vidyapeeth Road, Sigra, Varanasi",8am – 11pm,"+915422221585,+919792203144",3.5,38,-,0
Bikanervala,"IP Vijaya Mall, Varanasi","North Indian, Street Food, South Indian, Chinese, Fast Food, Desserts, Shake, Beverages",₹500 for two,https://www.zomato.com/varanasi/bikanervala-bhelupur/info,Varanasi,"Shop 101, IP Vijaya Mall, Bhelupur, Varanasi",9:45am – 10:45pm,+919335044777,3.9,260,4.2,13.9K
Goli Vada Pav No. 1,"Durgakund, Varanasi","Street Food, Beverages",₹250 for two,https://www.zomato.com/varanasi/goli-vada-pav-no-1-durgakund/info,Varanasi,"Shop 14, B 27/96-K-1-F-14, Gurudham, Durgakund, Varanasi","12midnight – 4am, 12noon – 12midnight",+916389327913,3.6,8,4.3,"1,792"
Kalakaar Cafe And Restaurant,"Assi Ghat, Varanasi","North Indian, Pizza, Pasta, Fast Food, Chinese, Street Food, Beverages",₹500 for two,https://www.zomato.com/varanasi/kalakaar-cafe-and-restaurant-assi-ghat/info,Varanasi,"B1-128/44, Dumraon Bagh Colony, Assi Ghat, Varanasi","12midnight – 1am, 11:30am – 11:45pm",+918309458741,-,1,New,1
Dosawala,"Lanka, Varanasi","South Indian, Chinese",₹300 for two,https://www.zomato.com/varanasi/dosawala-lanka/info,Varanasi,"B-36/8, Sankat Mochan, Lanka, Varanasi",10am – 10:30pm,+919696969600,-,1,-,1
Brown Bread Bakery,"Dashaswmedh Road, Varanasi","Sandwich, Continental, Italian, Pizza, North Indian, Desserts, Ice Cream",₹500 for two,https://www.zomato.com/varanasi/brown-bread-bakery-dashaswmedh-road/info,Varanasi,"D 25/42 Ganga Mahal, Bangali Tola, Dashaswmedh Road, Varanasi",7am – 10pm,+919838888823,3.0,87,3.9,94
The Pridhee Restaurant,"Sunderpur, Varanasi","North Indian, Chinese",₹300 for two,https://www.zomato.com/varanasi/the-pridhee-restaurant-sunderpur/info,Varanasi,"2/272, 2nd Floor, Shree Ramji Complex Mall, Sunderpur, Varanasi",11am – 10pm,+917398322172,New,1,4.1,44
Flavour Junction,"Bhelupur, Varanasi","North Indian, Chinese, Momos, Fast Food, Street Food, Shake, Beverages",₹300 for two,https://www.zomato.com/varanasi/flavour-junction-bhelupur/info,Varanasi,"B-27/92-A-4, Chetmani Chauraha, Bhelupur, Varanasi",Opens at 4:30pm,+918115954045,-,1,New,4
Zeenat Restaurant,"Chetganj, Varanasi","North Indian, Mughlai, Kebab","₹1,000 for two",https://www.zomato.com/varanasi/zeenat-restaurant-chetganj/info,Varanasi,"S 13/67, Teliyabagh, Chetganj, Varanasi",1pm – 11pm,+919026428361,4.1,91,4.4,219
Blurry Night Restaurant,"Durgakund, Varanasi","North Indian, Mughlai, Chinese, Biryani, Kebab, Momos, Bar Food, Desserts","₹1,200 for two",https://www.zomato.com/varanasi/blurry-night-restaurant-durgakund/info,Varanasi,"B 27/86-A-2, Main Road, Durgakund, Varanasi",11:30am – 11:30pm,+916386021246,4.1,16,4.2,83
Cafe Unplugged,"Nadesar, Varanasi","Fast Food, Rolls, Chinese, Street Food, Burger, Beverages, Shake",₹400 for two,https://www.zomato.com/varanasi/cafe-unplugged-nadesar/info,Varanasi,"S 2/653, 1, Varunapul, Nadesar, Varanasi",11:30am – 10:30pm,+919451333363,3.7,51,4.1,"2,881"
Shivay Multi Cuisine Restaurant,"Dashaswmedh Road, Varanasi","North Indian, South Indian, Biryani, Fast Food, Beverages",₹450 for two,https://www.zomato.com/varanasi/shivay-multi-cuisine-restaurant-dashaswmedh-road/info,Varanasi,"CK 58/11 B, Madhyameshwar, Nichi Bagh, Dashaswmedh Road, Varanasi",11:30am – 11pm,+919555840300,New,1,New,4
Cubana Heights Club & Restaurant,"Lanka, Varanasi","North Indian, Chinese, Mughlai, Pasta, Pizza, Fast Food, Biryani, Beverages","₹2,100 for two",https://www.zomato.com/varanasi/cubana-heights-club-restaurant-lanka/info,Varanasi,"B30/2C-5, Bharati Plaza, Lanka, Varanasi",12noon – 12midnight,+919559525175,-,1,2.1,9
Chef Kitchen's Restaurant,"Lahartara, Varanasi","Chinese, Pizza, Burger, Momos, Shake, Beverages",₹250 for two,https://www.zomato.com/varanasi/chef-kitchens-restaurant-lahartara/info,Varanasi,"Sheodaspur, Lahartara, Varanasi",11am – 10pm,+917355143554,New,1,New,4
Maa Annpurna Idali Dosa Corner,"Dashaswmedh Road, Varanasi",South Indian,₹100 for two,https://www.zomato.com/varanasi/maa-annpurna-idali-dosa-corner-dashaswmedh-road/info,Varanasi,"Bansphatak Dashaswmedh Road, Varanasi",9:30am – 9:30pm,"+919305301610,+917985492279",-,1,-,0
Mark's Cafe - Diner,"Assi Ghat, Varanasi","Continental, North Indian, Asian, Desserts, Beverages",₹600 for two,https://www.zomato.com/varanasi/marks-cafe-diner-assi-ghat/info,Varanasi,"Plot 52, Dumraon Bagh Colony, Assi Ghat, Varanasi",8:15am – 8:45pm,+919305306392,3.7,75,3.7,10
Keshari Food Plaza,"Lanka, Varanasi","North Indian, South Indian, Chinese, Fast Food, Desserts, Beverages, Italian",₹700 for two,https://www.zomato.com/varanasi/keshari-food-plaza-lanka/info,Varanasi,"B 36/1-K, Ramapuri Colony, Sankat Mochan, Lanka, Varanasi",11am – 10pm,"+919455538562,+915422311122",3.8,74,4.2,252
The Belgian Waffle Co.,"Bhelupur, Varanasi","Waffle, Pancake, Desserts, Beverages, Ice Cream",₹300 for two,https://www.zomato.com/varanasi/the-belgian-waffle-co-4-bhelupur/info,Varanasi,"B 20/44, A 44, Shop 13, Vijay Complex, Bhelupur, Varanasi","12midnight – 1:30am, 10:45am – 12midnight",+919336596574,3.3,5,4.5,"1,952"
Novelty Centre,"Dashaswmedh Road, Varanasi","Shake, Beverages, Sandwich, Street Food",₹300 for two,https://www.zomato.com/varanasi/novelty-centre-dashaswmedh-road/info,Varanasi,"D 14/2, Terhineem, Dashaswmedh Road, Varanasi",10:30am – 9:30pm,+917045082003,New,1,-,0
Roll Corner,"Chetganj, Varanasi","Rolls, North Indian, Biryani, South Indian, Chinese, Mughlai",₹250 for two,https://www.zomato.com/varanasi/roll-corner-chetganj/info,Varanasi,"Teliyabag Crossing, Jagatganj, Chetganj, Varanasi",1pm – 9pm,+919452024531,4.2,449,-,0
Maharaja Fast Food &  Chicken Roll Corner,"Lanka, Varanasi","Chinese, North Indian, Rolls",₹250 for two,https://www.zomato.com/varanasi/maharaja-fast-food-chicken-roll-corner-lanka/info,Varanasi,"Near Bhul Gai, Malviya Nagar, Lanka, Varanasi",9:30am – 9pm,+919936311300,-,2,-,0
1951 - The Clarks Hotel,"Clarks Hotel, Nadesar, Varanasi","North Indian, Chinese, Mughlai, Italian, Beverages, Sandwich, Continental, Desserts","₹1,500 for two",https://www.zomato.com/varanasi/1951-the-clarks-hotel-nadesar/info,Varanasi,"The Mall, Cantonment, Nadesar, Varanasi",6am – 11pm,+915422501011,3.1,9,4.5,436
Bistro B2,"Chetganj, Varanasi","Burger, North Indian, Chinese, Pizza, Shake, Beverages, Sandwich, Ice Cream",₹900 for two,https://www.zomato.com/varanasi/bistro-b2-chetganj/info,Varanasi,"C7/285, Shanti Tower, Chetganj, Varanasi",12noon – 11pm,+917071801025,4.0,381,4.1,15.7K
Shivika Cafe & Resturant,"Assi Ghat, Varanasi","Pizza, North Indian, Chinese, Pasta, Juices",₹300 for two,https://www.zomato.com/varanasi/shivika-cafe-resturant-assi-ghat/info,Varanasi,"Sant Ravidas Ghat Road, Near Ravidash Park, Nagwa, Assi Ghat, Varanasi",10am – 12midnight,Not available for this place,New,1,-,0
Toxic Bar - Ramada Plaza,"Ramada Plaza JHV, Varanasi","Bar Food, North Indian, Fast Food","₹1,200 for two",https://www.zomato.com/varanasi/toxic-bar-ramada-plaza-nadesar/info,Varanasi,"Ramada Plaza JHV, The Mall, Cantonment, Nadesar, Varanasi",12noon – 11pm,"+915422510000,+915422510005,+918874755551",3.9,13,-,0
Treat Restaurant & Bar,"Nadesar, Varanasi","North Indian, Chinese, Kebab, Mughlai, Continental, Beverages","₹1,000 for two",https://www.zomato.com/varanasi/treat-restaurant-bar-nadesar/info,Varanasi,"S19/56-57, Varuna Bridge Crossing, Nadesar, Varanasi",11am – 11pm,+917309390000,4.3,48,4.3,607
Eclipse Gastrobar,"Chetganj, Varanasi","North Indian, Chinese, Biryani, Fast Food, Pizza, Momos","₹1,000 for two",https://www.zomato.com/varanasi/eclipse-gastrobar-chetganj/info,Varanasi,"C30/36, 1 A, Maldahiya, Chetganj, Varanasi",2pm – 11:30pm,+919984390684,-,0,4.0,6
Swastik Fast Food,"Lanka, Varanasi","Fast Food, Chinese, Street Food",₹250 for two,https://www.zomato.com/varanasi/swastik-fast-food-3-lanka/info,Varanasi,"B 39, Nagwa, Lanka, Varanasi",2pm – 10:30pm,+919452605645,New,1,New,1
Bianca Cafe - Hotel Castillo,"Sigra, Varanasi","North Indian, Thai, Chinese, South Indian, Pizza, Desserts, Beverages, Sichuan",₹800 for two,https://www.zomato.com/varanasi/bianca-cafe-hotel-castillo-sigra/info,Varanasi,"S-64/127-A, Sigra, Varanasi",11am – 11pm,+917311186528,3.8,28,4.1,87
POSHTEL VNS,"Nadesar, Varanasi","Italian, Fast Food, Oriental, Pizza, North Indian, Coffee, Shake, Beverages",₹800 for two,https://www.zomato.com/varanasi/poshtel-vns-nadesar/info,Varanasi,"72, Buddha Vihar Colony, Cantonment, Nadesar, Varanasi",11:30am – 12midnight,"+919867603699,+919005311183",3.9,5,4.0,10
Manbhavan Food Corner,"Lanka, Varanasi","Fast Food, Chinese, Rolls, Biryani, North Indian",₹300 for two,https://www.zomato.com/varanasi/manbhavan-food-corner-lanka/info,Varanasi,"Prafullnagar, BHU, Lanka, Varanasi",1:30am – 11:30pm,"+916387606049,+917080467016",4.1,130,3.9,"9,602"
UP- 65,"Durgakund, Varanasi","North Indian, Chinese, Mughlai, Fast Food, Coffee, Desserts, Beverages, Sichuan",₹800 for two,https://www.zomato.com/varanasi/up-65-durgakund/info,Varanasi,"B-27/96, Plot 3, Gurudham Colony, Durgakund, Varanasi",11am – 11pm,+919838851075,4.2,273,4.2,67
