Restaurant_Name,Locality,Cuisines,Average_Cost_for_two,Restaurant_Url,City,Address,Available_Time,Contact_Number,Dining_Ratings,Dining_Votes,Delivery_Ratings,Delivery_Votes
The League Sports Bar Lounge,"Labbipet, Vijayawada","South Indian, North Indian, Continental, Chinese, Finger Food",₹500 for two,https://www.zomato.com/vijayawada/the-league-sports-bar-lounge-labbipet/info,Vijayawada,"3rd Floor, LEPL Centro Mall, MG Road, Labbipet, Vijayawada",Opens at 12:30pm,"+919133009966,+919133009977",4.8,37,4.3,40
Continental Park Hotel,"Governorpet, Vijayawada","Biryani, North Indian, Chinese, Continental",₹600 for two,https://www.zomato.com/vijayawada/continental-park-hotel-governorpet/info,Vijayawada,"29-2-7, Ramamandiram Road, Governorpet, Vijayawada",Opens at 11am,+919030797779,3.9,120,3.9,"3,605"
Raj Darbar Restaurant,"Labbipet, Vijayawada","Andhra, Chinese, Biryani, North Indian",₹300 for two,https://www.zomato.com/vijayawada/raj-darbar-restaurant-labbipet/info,Vijayawada,"40/1/117C, Bandar Road, Labbipet, Vijayawada",Opens at 11am,+919533508888,3.2,4,4.1,"2,914"
Desi Tadka,"Labbipet, Vijayawada","North Indian, Chinese",₹450 for two,https://www.zomato.com/vijayawada/desi-tadka-labbipet/info,Vijayawada,"60/16/5, 1st Cross, Navodaya Colony, Siddhartha Nagar, Lane Beside Modern Foods, Moghalrajpuram, Labbipet, Vijayawada",Opens at 11:30am,"+917989037277,+918662972519",3.8,31,4.2,755
Heera Fusion Restaurant,"Auto Nagar, Vijayawada","Biryani, Chinese, North Indian",₹400 for two,https://www.zomato.com/vijayawada/heera-fusion-restaurant-auto-nagar/info,Vijayawada,"54-20/8-1, Sri Nagar Colony, Novetel Service Line, Vivekananda Statue Road, Auto Nagar, Vijayawada",Opens at 11:30am,+919581152535,4.1,318,3.8,19.1K
Jagavi's Train Restaurant,"Labbipet, Vijayawada","Andhra, Seafood, North Indian, Biryani, Chinese","₹1,200 for two",https://www.zomato.com/vijayawada/jagavis-train-restaurant-1-labbipet/info,Vijayawada,"40-1-52C, Acharya Ranga Nagar, M G Road, Labbipet, Vijayawada",Opens at 11:30am,+919908099671,-,3,4.0,795
Silver Dum Biryani,"Gurunanak Colony, Vijayawada",Biryani,₹250 for two,https://www.zomato.com/vijayawada/silver-dum-biryani-gurunanak-colony/info,Vijayawada,"Door 57-13-33, P & T Colony, Patamata, Gurunanak Colony, Vijayawada",Opens at 11:30am,+917842651234,4.3,320,4.4,12.2K
Pankaja Cool Drinks,"Islampet, Vijayawada",Beverages,₹100 for two,https://www.zomato.com/vijayawada/pankaja-cool-drinks-islampet/info,Vijayawada,"11-25-305, One Town, Imam Panja Street, Main Road, Islampet, Vijayawada",Opens at 10am,+919848383006,-,1,-,0
Gold Cup Fast Food,"Gunadala, Vijayawada","South Indian, Chinese",₹200 for two,https://www.zomato.com/vijayawada/gold-cup-fast-food-2-gunadala/info,Vijayawada,"Door 49-1-225, Ramavarapadu Ring, Gunadala, Vijayawada",6am – 11pm,+919441717416,-,0,-,2
Silver Spoon,"Gurunanak Colony, Vijayawada","Biryani, North Indian, Chinese, Seafood, Mughlai, Sichuan",₹500 for two,https://www.zomato.com/vijayawada/silver-spoon-gurunanak-colony/info,Vijayawada,"59A-20-3/2, Gurunanak Colony Road, Gurunanak Nagar, Gurunanak Colony, Vijayawada",Opens at 12noon,+917416457799,3.9,127,4.2,"3,581"
Sri Ramaiah Mess And Caterers,"Governorpet, Vijayawada",Andhra,₹500 for two,https://www.zomato.com/vijayawada/sri-ramaiah-mess-and-caterers-governorpet/info,Vijayawada,"Door 29-14-25, Prakasam Road, Governorpet, Vijayawada",Opens at 11:45am,+919884494628,3.1,11,4.2,"5,066"
Flavours Of Andhra,"Gurunanak Colony, Vijayawada","Andhra, North Indian, Chinese, Biryani, Sichuan",₹300 for two,https://www.zomato.com/vijayawada/flavours-of-andhra-gurunanak-colony/info,Vijayawada,"59A-9-6B, Plot 123A, Sai Baba Temple Street, Teacher Colony, Near Gurunanak Colony, Vijayawada",Opens at 12noon,+919866811377,3.9,8,3.6,222
Naidu Gari Kunda Biryani,"Gunadala, Vijayawada",Biryani,₹500 for two,https://www.zomato.com/vijayawada/naidu-gari-kunda-biryani-gunadala/info,Vijayawada,"D -45-1-49, Padavala Revu, Eluru Road, Revenue Ward 4, Near Indian Oil Petrol Bunk, Gunadala, Vijayawada",Opens at 11:30am,+917997145666,4.2,254,3.7,"5,083"
Sai Silver Dum Biryani,"Auto Nagar, Vijayawada","Biryani, Chinese",₹500 for two,https://www.zomato.com/vijayawada/sai-silver-dum-biryani-auto-nagar/info,Vijayawada,"12-6, Old Checkpost Center, Auto Nagar, Vijayawada",Opens at 11:30am,+918919443535,3.6,13,4.3,500
Sri Vijaya Durga Family Restaurant,"Tadepalli, Vijayawada","Biryani, Andhra, Chinese, Seafood",₹550 for two,https://www.zomato.com/vijayawada/sri-vijaya-durga-family-restaurant-tadepalli/info,Vijayawada,"Door 12-467/8, Nera Usodaya Super Market, Tadepalli, Vijayawada",Opens at 10am,"+918686470333,+918978791933",-,0,-,0
One  Cake's,"Governorpet, Vijayawada","Bakery, Desserts, Fast Food, Street Food",₹400 for two,https://www.zomato.com/vijayawada/one-cakes-governorpet/info,Vijayawada,"Door 29-37-9A, Kotthavanthena Center, Governorpet, Vijayawada",Opens at 10am,+919848000391,-,0,4.0,14
Udupi Tiffin Center,"Governorpet, Vijayawada","South Indian, Street Food",₹100 for two,https://www.zomato.com/vijayawada/udupi-tiffin-center-governorpet/info,Vijayawada,"27-21-18, Kaleswarrao Road, Governorpet, Vijayawada",6:30am – 9:30pm,+918919488286,-,0,-,0
Leela Sai Hotel & Caterers,"Poranki, Vijayawada",South Indian,₹250 for two,https://www.zomato.com/vijayawada/leela-sai-hotel-caterers-poranki/info,Vijayawada,"1-259/1-2-199, Lakshmi Puram Colony, Poranki, Vijayawada",7am – 10pm,+919542574519,-,0,4.3,575
Harika Royal Restaurant,"PNT Colony, Vijayawada","Biryani, Andhra, North Indian, Chinese, Seafood",₹600 for two,https://www.zomato.com/vijayawada/harika-royal-restaurant-pnt-colony/info,Vijayawada,"43-106/1, Nandamurinagar, Mutylampadu, Near Singh Nagar, PNT Colony, Vijayawada",Opens at 11am,+919440969664,4.3,334,4.3,"9,010"
Sarovar Mess,"Gandhi Nagar, Vijayawada",Andhra,₹200 for two,https://www.zomato.com/vijayawada/sarovar-mess-gandhi-nagar/info,Vijayawada,"26-3-44, Near Santhi Theatre, Nageswara Rao Pantulu Road, Gandhi Nagar, Vijayawada",Opens at 11am,+918662576620,3.8,207,-,0
90's Restaurant,"Gurunanak Colony, Vijayawada","Chinese, Biryani",₹700 for two,https://www.zomato.com/vijayawada/90s-restaurant-gurunanak-colony/info,Vijayawada,"54-15-9B, Plot 552, NH Service Road, Bharati Nagar, Gurunanak Colony, Vijayawada",Opens at 11:15am,+919849333377,4.0,20,3.4,"1,244"
Karimulla Biryani Hotel,"Islampet, Vijayawada",Biryani,₹300 for two,https://www.zomato.com/vijayawada/karimulla-biryani-hotel-islampet/info,Vijayawada,"9-71-20, Syed Gulammihiddin Road, Islampet, Vijayawada",Opens at 11am,+916300420783,4.2,132,3.5,"8,759"
The New Dolphin Family Restaurant,"Gandhi Nagar, Vijayawada","Chinese, South Indian, North Indian, Biryani, Seafood",₹700 for two,https://www.zomato.com/vijayawada/the-new-dolphin-family-restaurant-gandhi-nagar/info,Vijayawada,"26/13/72, Gandhi Nagar, Vijayawada",Opens at 11am,+919246116007,4.4,299,4.3,12.5K
Bamboo & Biryani,"Labbipet, Vijayawada","Biryani, North Indian",₹400 for two,https://www.zomato.com/vijayawada/bamboo-biryani-labbipet/info,Vijayawada,"Door 40-3-18, Ground Floor, Rajeswari Nilayam, Siddhartha Nagar, Opposite Vasanth Marg, Labbipet, Vijayawada",Opens at 12noon,+917337332020,3.6,103,4.1,"2,815"
New Welcome Fast Food,"Governorpet, Vijayawada","Tea, South Indian",₹250 for two,https://www.zomato.com/vijayawada/new-welcome-fast-food-governorpet/info,Vijayawada,"Door 33-4-16A, Vemula Syamala Devi Road, Kasthuribai Peta, Mogalrajpuram, Governorpet, Vijayawada",7am – 10pm,+917013816195,-,0,4.1,293
Shaz Shawarma,"Governorpet, Vijayawada",Shawarma,₹150 for two,https://www.zomato.com/vijayawada/shaz-shawarma-governorpet/info,Vijayawada,"30-9-11, Durga Agraharam, Governorpet, Vijayawada",Opens at 9:15am,+917989084285,-,0,4.0,376
SFC,"Krishna Lanka, Vijayawada","Burger, Sandwich, Pizza, Fast Food, Ice Cream, Juices, Shake, Beverages",₹400 for two,https://www.zomato.com/vijayawada/sfc-krishna-lanka/info,Vijayawada,"Feeder Road, Krishna Lanka, Vijayawada",Opens at 10am,+918520001026,-,0,-,0
Brewbakes,"Gurunanak Colony, Vijayawada","Cafe, Coffee, Tea, Shake, Beverages, Pizza, Desserts, Fast Food",₹600 for two,https://www.zomato.com/vijayawada/brewbakes-gurunanak-colony/info,Vijayawada,"54-16-8/29, 3rd Line, Venkateswara Nagar, Gurunanak Colony, Vijayawada",6:30am – 10pm,+919291651111,-,1,3.9,55
Element E7 Multicuisine Restaurant,"Governorpet, Vijayawada","Biryani, Continental, North Indian, Pizza, Fast Food, Sichuan, Salad, South Indian",₹900 for two,https://www.zomato.com/vijayawada/element-e7-multicuisine-restaurant-governorpet/info,Vijayawada,"D 29-14-64, Prakasam Road, Governorpet, Vijayawada",Opens at 11:30am,+917277577677,3.9,13,4.1,"1,093"
Gismat Arabic Restaurant,"Labbipet, Vijayawada","Arabian, Ice Cream, Mandi, Beverages",₹700 for two,https://www.zomato.com/vijayawada/gismat-arabic-restaurant-labbipet/info,Vijayawada,"40-1-116, 1st Floor, KBR Heights, Near Reliance Trends, Labbipet, Vijayawada",Opens at 12:15pm,+919346475555,3.5,16,4.1,678
Alfa Alankar Mandi House,"Gandhi Nagar, Vijayawada","Biryani, Arabian",₹700 for two,https://www.zomato.com/vijayawada/alfa-alankar-mandi-house-gandhi-nagar/info,Vijayawada,"Door 26-13-73, Alankar Complex, Sanyasiraju Street, Gandhi Nagar, Vijayawada",Opens at 12:15pm,+918885522211,3.3,5,3.6,259
Kura Karam Restaurant,"Gunadala, Vijayawada","North Indian, Chinese, Seafood, Biryani, Andhra, Mughlai, Beverages, Kebab",₹800 for two,https://www.zomato.com/vijayawada/kura-karam-restaurant-gunadala/info,Vijayawada,"D 48-10-15/1, Opposite NTR Health University, Gunadala, Vijayawada",Opens at 11am,+919505912043,3.9,75,4.2,"5,121"
Lassi Day Cafe,"Islampet, Vijayawada","Beverages, Shake, Ice Cream, Desserts",₹200 for two,https://www.zomato.com/vijayawada/lassi-day-cafe-islampet/info,Vijayawada,"4-1-43, Sree Tammina Azad Nilayam, Chitti Nagar, Islampet, Vijayawada",Opens at 12noon,+919494645592,3.7,9,3.9,"1,140"
TFL,"Labbipet, Vijayawada","Italian, Continental, Chinese, Bakery, Beverages, Sichuan",₹400 for two,https://www.zomato.com/vijayawada/tfl-labbipet/info,Vijayawada,"36-11-7/A, Santhi Nagar, 1st Lane, Moghalrajupuram, Labbipet, Vijayawada",Opens at 11am,"+918662484969,+917095004567",4.0,225,4.1,"2,143"
Pakoda Hub,"Labbipet, Vijayawada","Chinese, Seafood, Street Food, Andhra",₹400 for two,https://www.zomato.com/vijayawada/pakoda-hub-labbipet/info,Vijayawada,"40-5-2B, Tikkle Road, Labbipet, Vijayawada",Opens at 12noon,+919160345588,3.8,46,4.2,"1,551"
AL - Rahim Family Restaurant,"Labbipet, Vijayawada","Andhra, Shawarma, Seafood, Chinese, Ice Cream",₹350 for two,https://www.zomato.com/vijayawada/al-rahim-family-restaurant-labbipet/info,Vijayawada,"60/1/7/1, Ground Floor, Chennupati Ravamma Complex, Sunnapubaptilu Centre, Siddharth Nagar, Labbipet, Vijayawada",Opens at 12:30pm,+918977595389,New,2,New,4
Hotel Srinivasa,"Governorpet, Vijayawada","Andhra, Chinese, Biryani, Seafood, North Indian",₹500 for two,https://www.zomato.com/vijayawada/hotel-srinivasa-governorpet/info,Vijayawada,"Durgaiah Street, Governorpet, Vijayawada",Opens at 12noon,"+918662573284,+919848813348",4.5,482,4.2,13.7K
Good Morning Tea And Fastfood,"Governorpet, Vijayawada","South Indian, Chinese, Beverages",₹300 for two,https://www.zomato.com/vijayawada/good-morning-tea-and-fastfood-governorpet/info,Vijayawada,"Museum Road, Governorpet, Vijayawada",6am – 11pm,+918662577517,-,0,-,0
Navarang Bakery And Sweets,"Islampet, Vijayawada","Bakery, Mithai",₹300 for two,https://www.zomato.com/vijayawada/navarang-bakery-and-sweets-5-islampet/info,Vijayawada,"KT Road, Opposite Anjaneya Temple, Islampet, Vijayawada",8am – 10pm,+917780467737,-,0,-,0
Babai Hotel,"Gandhi Nagar, Vijayawada",South Indian,₹300 for two,https://www.zomato.com/vijayawada/babai-hotel-gandhi-nagar/info,Vijayawada,"NRP Road, Gandhi Nagar, Vijayawada",Opens at 12noon,+919848064321,4.2,573,-,0
Kadiyapatnam Military Hotel,"Labbipet, Vijayawada","Biryani, Andhra, South Indian",₹300 for two,https://www.zomato.com/vijayawada/kadiyapatnam-military-hotel-labbipet/info,Vijayawada,"40-7-4, Near RR Durbar, Moghulrajpuram, Labbipet, Vijayawada",Opens at 12noon,+917557345345,-,2,-,2
Hotel Vdara,"Labbipet, Vijayawada","Biryani, Chinese, North Indian, South Indian, Seafood, Andhra, Sichuan","₹1,000 for two",https://www.zomato.com/vijayawada/hotel-vdara-labbipet/info,Vijayawada,"40-6-3, Plot 6, Revenue Colony Park, Sidhartha Nagar, Labbipet, Vijayawada",Opens at 11:15am,+918374742799,3.8,18,4.1,"1,067"
Blue Fox,"Labbipet, Vijayawada","Chinese, North Indian, Seafood, Desserts, Beverages","₹1,200 for two",https://www.zomato.com/vijayawada/blue-fox-1-labbipet/info,Vijayawada,"Door 40-1-1/17, Majety Surendranath, Mongalrajpuram, Donka Road, Labbipet, Vijayawada",Opens at 11am,+919248011611,-,2,3.8,196
Under The Woods,"Christurajupuram, Vijayawada","North Indian, Pizza, Chinese, Continental, Desserts",₹500 for two,https://www.zomato.com/vijayawada/under-the-woods-christurajupuram/info,Vijayawada,"32-2-7B, Siddhartha College Road, Moghalrajpuram, Christurajupuram, Vijayawada",Opens at 12noon,+919967067915,3.4,19,4.2,409
Blind Chemistry,"Labbipet, Vijayawada","Beverages, Continental, Italian, Desserts",₹700 for two,https://www.zomato.com/vijayawada/blind-chemistry-labbipet/info,Vijayawada,"Plot- 40-5-9, Ground Floor, Lime Light Building, Tikkle Road, Labbipet, Vijayawada",Opens at 11:30am,+919515879999,4.0,42,3.7,611
Bawarchi,"Labbipet, Vijayawada","Biryani, Chinese, North Indian, Seafood",₹500 for two,https://www.zomato.com/vijayawada/bawarchi-labbipet/info,Vijayawada,"Near Stella Collage, Gayatri Nagar, Labbipet, Vijayawada",Opens at 11:30am,+918885444555,3.9,221,3.8,"2,107"
Ramesh Pulka Point And Fast Foods,"Christurajupuram, Vijayawada","North Indian, Chinese",₹250 for two,https://www.zomato.com/vijayawada/ramesh-pulka-point-and-fast-foods-christurajupuram/info,Vijayawada,"D59-11-10-1, Gayatri Nagar, Christurajupuram, Vijayawada",Opens at 12:30pm,+919491166157,3.9,9,4.4,"3,349"
The Drunk Yard,"Christurajupuram, Vijayawada","North Indian, Bar Food","₹1,000 for two",https://www.zomato.com/vijayawada/the-drunk-yard-christurajupuram/info,Vijayawada,"40-27-6/8, Polyclinic Road, Opposite Lalithaa Jewellery, Christurajupuram, Vijayawada",Opens at 10am,+918662484950,-,0,-,0
Sri Anjaneya Fast Foods,"Gurunanak Colony, Vijayawada","South Indian, Biryani, Chinese",₹350 for two,https://www.zomato.com/vijayawada/sri-anjaneya-fast-foods-1-gurunanak-colony/info,Vijayawada,"68-4-14, Nalluri Vari Street, Opposite Patamata E-Seva, Gurunanak Colony, Vijayawada",7am – 10:30pm,+919963303214,-,1,3.9,60
Hotel Karthikeya,"Governorpet, Vijayawada","South Indian, Chinese, Biryani",₹300 for two,https://www.zomato.com/vijayawada/hotel-karthikeya-governorpet/info,Vijayawada,"Stall A 26, Pandit Nehru Bus Station, Governorpet, Vijayawada",12midnight – 11:45pm,+919666634899,-,0,3.7,13
Basha Biryani Point,"Enikepadu, Vijayawada","Biryani, South Indian, Chinese",₹350 for two,https://www.zomato.com/vijayawada/basha-biryani-point-enikepadu/info,Vijayawada,"11-196, 100 Feet Road, Near D Mart, Enikepadu, Vijayawada",Opens at 10am,+918143405626,-,0,3.6,7
RK Military Mess & Fast Foods,"Poranki, Vijayawada","South Indian, Biryani",₹250 for two,https://www.zomato.com/vijayawada/rk-military-mess-fast-foods-poranki/info,Vijayawada,"7-185, Kanuru, Main Road, Near Vijayalakshmi Theater, Poranki, Vijayawada",Opens at 9:45am,+916262408409,-,0,4.0,5
Mayuri Tiffens & Fastfood,"Gurunanak Colony, Vijayawada",Street Food,₹200 for two,https://www.zomato.com/vijayawada/mayuri-tiffens-fastfood-gurunanak-colony/info,Vijayawada,"Near SBI Bank, Pantakaluva Road, Gurunanak Colony, Vijayawada","7am – 12noon, 4pm – 10pm","+919505837222,+917013679505",-,0,-,0
Cafe Terrase,"Gurunanak Colony, Vijayawada","Cafe, Coffee, Pasta, Chinese, Pizza, Fast Food, Desserts, Beverages","₹1,000 for two",https://www.zomato.com/vijayawada/cafe-terrase-gurunanak-colony/info,Vijayawada,"54/15/18/1D, Gurunanak Colony, Vijayawada",Opens at 1pm,+917711887555,-,3,3.2,21
Bismillah Biryani And Fast Food,"Krishna Lanka, Vijayawada","Biryani, South Indian, Chinese, North Indian, Sichuan",₹350 for two,https://www.zomato.com/vijayawada/bismillah-biryani-and-fast-food-krishna-lanka/info,Vijayawada,"Post Office Road, Krishna Lanka, Vijayawada",Opens at 11:15am,+919986108851,4.1,252,3.9,22.1K
Madhurima Restaurant,"Auto Nagar, Vijayawada","North Indian, South Indian, Chinese, Biryani, Sichuan",₹400 for two,https://www.zomato.com/vijayawada/madhurima-restaurant-auto-nagar/info,Vijayawada,"74-1-22/1, Patamata, Beside Donka Road, Auto Nagar, Vijayawada",Opens at 10:30am,"+917842156555,+917842156444",4.0,946,3.7,59.2K
Barbecue Signature,"Labbipet, Vijayawada","North Indian, Chinese","₹1,000 for two",https://www.zomato.com/vijayawada/barbecue-signature-1-labbipet/info,Vijayawada,"39-1-57, 5Th Floor, PVP Square, At BVR Mall, M.G.Road, Labbipet, Vijayawada",Opens at 12:30pm,+919666683838,3.2,9,3.9,8
The Bread Basket,"Gurunanak Colony, Vijayawada","Pizza, Sandwich, Burger, Fast Food, Bakery, Beverages",₹450 for two,https://www.zomato.com/vijayawada/the-bread-basket-gurunanak-colony/info,Vijayawada,"Door 57-11-1A, Padamata, Gurunanak Colony, Vijayawada",Opens at 10:30am,+917995435555,3.9,6,4.3,"2,261"
Grills & Rolls,"Labbipet, Vijayawada","Arabian, Rolls, Fast Food, Desserts",₹300 for two,https://www.zomato.com/vijayawada/grills-rolls-labbipet/info,Vijayawada,"40-1-51A, M&M Show Room, MG Road, Labbipet, Vijayawada",Opens at 5pm,"+919346222188,+918121111999",4.2,136,4.1,"4,198"
Khaan Saab,"Labbipet, Vijayawada","North Indian, Mughlai, South Indian, Biryani",₹700 for two,https://www.zomato.com/vijayawada/khaan-saab-labbipet/info,Vijayawada,"Door 40-6-21, Revenue Colony, Park Road, Siddhardha Nagar, Mogalrajpuram, Labbipet, Vijayawada",Opens at 12noon,"+919100667666,+918666666774",3.9,429,3.6,12.2K
Paustik Restaurant,"Governorpet, Vijayawada","North Indian, Chinese, Street Food",₹750 for two,https://www.zomato.com/vijayawada/paustik-restaurant-governorpet/info,Vijayawada,"27-16-104, Besent Road, Governorpet, Vijayawada",Opens at 11am,+917816060475,3.3,11,4.0,565
Taco Bell,"PVP Square Mall, Labbipet, Vijayawada","Mexican, Fast Food, Wraps, Beverages",₹550 for two,https://www.zomato.com/vijayawada/taco-bell-labbipet/info,Vijayawada,"39-1-57, PVP Square Mall, Third Floor, Unit 3F, 28, MG Road, Mogalrajapuram, Labbipet, Vijayawada",Opens at 11am,+917428593043,3.6,98,3.6,"2,851"
Amma Hotel,"Islampet, Vijayawada","North Indian, South Indian",₹200 for two,https://www.zomato.com/vijayawada/amma-hotel-2-islampet/info,Vijayawada,"11-1-16, 1 Town, Tarapet, Babu Rajendra Prasad Road, Islampet, Vijayawada",Opens at 10am,+918662561381,-,0,-,0
Snack Shake,"Gunadala, Vijayawada","Fast Food, Beverages, Sichuan",₹150 for two,https://www.zomato.com/vijayawada/snack-shake-gunadala/info,Vijayawada,"47-10-17/2, Gunadala, Vijayawada",Opens at 9:30am,+918247541740,-,2,3.4,600
Gowtham Restaurant,"Gurunanak Colony, Vijayawada","Biryani, Chinese, South Indian",₹500 for two,https://www.zomato.com/vijayawada/gowtham-restaurant-gurunanak-colony/info,Vijayawada,"59-A-21-1/3-A, High School Road, Gurunanak Colony, Vijayawada",Opens at 11:30am,+918008589152,-,0,-,0
Sri Anjaneya Family Restaurants,"Governorpet, Vijayawada","Biryani, Chinese, North Indian, Andhra, Sichuan",₹400 for two,https://www.zomato.com/vijayawada/sri-anjaneya-family-restaurants-governorpet/info,Vijayawada,"27/18/100, Besant Road, Near Apsara Theatre, Governorpet, Vijayawada",Opens at 11am,+919391988888,-,0,3.5,70
Sri Ram Fast Foods,"Labbipet, Vijayawada","South Indian, Andhra",₹200 for two,https://www.zomato.com/vijayawada/sri-ram-fast-foods-labbipet/info,Vijayawada,"D 40-5, 2 D, Venus Apartmment, Opposite D.V Manor, Tikkle Road, Labbipet, Vijayawada",7am – 10pm,+917032897989,-,0,-,0
Boss Of Burgers,"Labbipet, Vijayawada","Burger, Wraps, American, Fast Food, Shake, Beverages",₹750 for two,https://www.zomato.com/vijayawada/boss-of-burgers-labbipet/info,Vijayawada,"40/14/5/3, 1st Floor, Chandramoulipuram, Labbipet, Vijayawada",Opens at 10:30am,+918014379143,4.3,103,3.9,"3,026"
Tonique Restaurant,"Governorpet, Vijayawada","North Indian, Mughlai, Biryani, Chinese, Seafood",₹850 for two,https://www.zomato.com/vijayawada/tonique-restaurant-governorpet/info,Vijayawada,"29/1/7, Kaleswara Road, Governorpet, Vijayawada",Opens at 12noon,+916304354766,3.9,4,4.1,287
Monk's Kitchen,"Auto Nagar, Vijayawada","Thai, Mexican, Chinese, Continental, Shake, Sichuan",₹400 for two,https://www.zomato.com/vijayawada/monks-kitchen-auto-nagar/info,Vijayawada,"Guru Nanak Colony, Auto Nagar, Vijayawada",Opens at 12noon,+918886026666,4.0,177,3.3,820
Shree Santosh Family Dhaba,"Gandhi Nagar, Vijayawada","North Indian, Biryani, Chinese, South Indian, Rajasthani",₹600 for two,https://www.zomato.com/vijayawada/shree-santosh-family-dhaba-gandhi-nagar/info,Vijayawada,"26-15-1A, Ground Floor, 63, Opp Rama Talkies, Gandhi Nagar, Vijayawada",Opens at 11:30am,"+918667964995,+917014499639",3.5,57,3.7,"5,270"
The 2nd Wife Family Restaurant,"Gollapudi, Vijayawada","North Indian, Chinese, Andhra, Biryani, Shake, Sichuan",₹600 for two,https://www.zomato.com/vijayawada/the-2nd-wife-family-restaurant-gollapudi/info,Vijayawada,"76 18 29, Bhavanipuram, National Highway 65, Gollapudi, Vijayawada",Opens at 11:30am,+919652375678,3.9,77,4.0,"3,179"
Serenade - Manor Food Plaza,"Labbipet, Vijayawada","Biryani, North Indian",₹500 for two,https://www.zomato.com/vijayawada/serenade-manor-food-plaza-labbipet/info,Vijayawada,"40-5-16, MG Road, Opposite Savitri Netralayam, Labbipet, Vijayawada",Opens at 11am,"+919000974455,+919000874455",2.8,46,4.2,"1,282"
Cross Roads,"Christurajupuram, Vijayawada","Biryani, North Indian, Chinese, South Indian, Andhra",₹400 for two,https://www.zomato.com/vijayawada/cross-roads-christurajupuram/info,Vijayawada,"Moghalrajupuram, Sub Post Office Road, Christurajupuram, Vijayawada",Opens at 12noon,+916289834028,3.7,114,4.1,"5,995"
Gourmet Bar,"Novotel - Auto Nagar, Vijayawada","Continental, Finger Food","₹2,200 for two",https://www.zomato.com/vijayawada/gourmet-bar-auto-nagar/info,Vijayawada,"Novotel Vijayawada Varun, Bharathi Nagar, Auto Nagar, Vijayawada",Opens at 11am,"+917799741022,+918666688999",4.9,29,-,0
Southern Spice Nasta,"Gurunanak Colony, Vijayawada","South Indian, Andhra",₹200 for two,https://www.zomato.com/vijayawada/southern-spice-nasta-gurunanak-colony/info,Vijayawada,"Door 59A/8/1/1/1, Vasavi Nagar, Gurunanak Road, Gurunanak Colony, Vijayawada",6:30am – 10:30pm,"+918374233359,+918859399499",2.5,8,4.3,"7,974"
The House Of Pancakes,"Labbipet, Vijayawada","Waffle, Pancake",₹250 for two,https://www.zomato.com/vijayawada/the-house-of-pancakes-labbipet/info,Vijayawada,"Brindavan Colony, Sriram Nagar, Labbipet, Vijayawada",Opens at 10am,+919490984509,-,0,-,0
Hosanna Once More Fruit Juice,"Gandhi Nagar, Vijayawada","Beverages, Juices, Shake",₹200 for two,https://www.zomato.com/vijayawada/hosanna-once-more-fruit-juice-gandhi-nagar/info,Vijayawada,"Shop 17, Door 14-20-29, Padmanabha Building, Gandhi Nagar, Vijayawada",Opens at 10am,+919849653273,-,3,4.2,733
Gouse Shawarma,"Governorpet, Vijayawada",Shawarma,₹300 for two,https://www.zomato.com/vijayawada/gouse-shawarma-governorpet/info,Vijayawada,"Stall 29, Railway Quarters, Brts Road, Governorpet, Vijayawada",12midnight – 11:45pm,+918328620396,-,1,3.8,159
Andhra Go - Pushti,"Labbipet, Vijayawada",Andhra,₹100 for two,https://www.zomato.com/vijayawada/andhra-go-pushti-labbipet/info,Vijayawada,"Door 1-1, Government Veterinary Hospital, M.G Road, Labbipet, Vijayawada",6:30am – 10pm,+917013593893,-,0,-,0
Alankar Sweets & Bakers,"Auto Nagar, Vijayawada","Mithai, Bakery",₹200 for two,https://www.zomato.com/vijayawada/alankar-sweets-bakers-1-auto-nagar/info,Vijayawada,"8-334/1, Endowments Colony, Padmaja Nagar, Ntr Marg, Auto Nagar, Vijayawada",8:30am – 10:30pm,+917849996666,-,0,-,0
A Kit Kat Bakery,"Auto Nagar, Vijayawada","Burger, Fast Food, Pizza, Sandwich, Bakery",₹250 for two,https://www.zomato.com/vijayawada/a-kit-kat-bakery-1-auto-nagar/info,Vijayawada,"58-6-41, Pantakaluva Road, Auto Nagar, Vijayawada",Opens at 10am,"+919052081232,+919985447893",-,0,3.7,91
Five Star Koli Hut,"Governorpet, Vijayawada","Burger, Fast Food",₹200 for two,https://www.zomato.com/vijayawada/five-star-koli-hut-governorpet/info,Vijayawada,"29-37-11A, Seetharamapuram, Eluru Road, Governorpet, Vijayawada",24 Hours,+918143891347,-,0,3.9,11
Giani,"Poranki, Vijayawada","Ice Cream, Desserts",₹300 for two,https://www.zomato.com/vijayawada/giani-poranki/info,Vijayawada,"Shop 1, Rajasree Estates, Near Kamaiahthopu Centre, Opp Ramaiah Rice Mill, MG Road, Kanuru, Poranki, Vijayawada",Opens at 10am,+916302207275,-,1,3.6,155
Royal Family Dhaba,"Tadepalli, Vijayawada","Chinese, Biryani, North Indian",₹450 for two,https://www.zomato.com/vijayawada/royal-family-dhaba-tadepalli/info,Vijayawada,"Near HP Petrol Bunk, Guntur, Tadepalli, Vijayawada",Opens at 10am,"+918801323777,+919866068939",-,0,-,0
8 Millet House,"Labbipet, Vijayawada","Healthy Food, South Indian, Biryani",₹300 for two,https://www.zomato.com/vijayawada/8-millet-house-1-labbipet/info,Vijayawada,"IGMS Complex, MG Road, Labbipet, Vijayawada",Opens at 11am,+917993188727,4.3,62,4.4,"1,327"
New Chand Hotel,"Islampet, Vijayawada","Biryani, North Indian",₹300 for two,https://www.zomato.com/vijayawada/new-chand-hotel-2-islampet/info,Vijayawada,"12-2-89, BRP Road, Panja Center, Islampet, Vijayawada",Opens at 11:45am,+919542707607,2.7,6,4.0,18
